country,source,title,date_iso,summary,url,category,status
South Africa,Infrastructure News,Sanlam-backed CFM Closes Largest EM Climate Adaptation Infrastructure Fund,2025-10-21,Climate Fund Managers (CFM)   a climate-focused blended finance investment manager  announced today the final close of its second blended finance facility  Climate Investor Two (CI2)  at USD 1.065 billion. With new commitments of USD 190 million plus a EUR 205 million EFSD+ guarantee from the European Union  CI2 surpasses its initial USD 1 billion target  becoming the largest climate adaptation infrastructure fund focused on emerging markets globally. The fund blends public and private capita...,https://infrastructurenews.co.za/2025/10/21/sanlam-backed-cfm-closes-largest-em-climate-adaptation-infrastructure-fund/,,
South Africa,Infrastructure News,Legal Borehole Drilling Is A Key Enabler To Mitigating South Africa’s Water Crisis,2025-10-22,Albertus Lombaard  Borehole Water Association of Southern Africa Drilling Division Technical Advisor In the face of extreme weather events  including drought and floods  safeguarding water resources has never been more critical. Added to adverse climate conditions is the challenge of delivering water to homes and businesses through ageing and poorly maintained water infrastructure. According to industry watchdog the Borehole Water Association (BWA)   these factors together make the drilling o...,https://infrastructurenews.co.za/2025/10/22/legal-borehole-drilling-is-a-key-enabler-to-mitigating-south-africas-water-crisis/,,
South Africa,Infrastructure News,WISA Climate Change Division Present a Webinar on International Day of Climate Action,2025-10-20,To mark the International Day of Climate Action  the WISA Climate Change Division invites professionals  researchers  and stakeholders from across the water sector to join a free online webinar exploring how South Africa is responding to the urgent challenges posed by climate change. This two-hour virtual session will showcase a wide range of responses – from government policy frameworks and scientific research to community-level adaptation and industry innovation. Attendees will gain practic...,https://infrastructurenews.co.za/2025/10/20/wisa-climate-change-division-present-a-webinar-on-international-day-of-climate-action/,,
South Africa,Infrastructure News,SA To Introduce Framework To Govern Carbon Markets,2025-10-23,Government is set to introduce a new framework to guide and expand high-integrity carbon markets in South Africa. Addressing the Carbon Markets Africa Summit 2025   the Minister of Forestry  Fisheries and the Environment   Dr Dion George  said when carbon markets are governed with integrity  they can mobilise finance  transfer technology  and drive inclusive growth. “The framework lays the foundation for developing  governing  and scaling high-integrity carbon markets in South Africa. It is d...,https://infrastructurenews.co.za/2025/10/23/sa-to-introduce-framework-to-govern-carbon-markets/,,
South Africa,Infrastructure News,SA’s Nuclear Industrialisation Plan Aims To Drive Economic And Energy Capacity,2025-10-21,South Africa is preparing to develop a comprehensive nuclear industrialisation plan that goes far beyond simply converting nuclear energy into electricity  according to Minister of Electricity and Energy   Dr Kgosientsho Ramokgopa. “It’s not just about converting nuclear energy into electricity. It’s about what benefits the South African economy and what components within the nuclear fuel cycle we can domesticate or localise ” Ramokgopa said. The Minister was speaking during a media briefing ...,https://infrastructurenews.co.za/2025/10/21/sas-nuclear-industrialisation-plan-aims-to-drive-economic-and-energy-capacity/,,
South Africa,Infrastructure News,Sassda Spearheads Stainless Steel Master Plan As Sector Roadmap To 2030,2025-10-24,The Southern Africa Stainless Steel Development Association (Sassda) has announced the launch of a new Stainless Steel Master Plan (SSMP)  a national collaborative initiative that will chart the course for the local stainless steel sector’s growth  competitiveness  and sustainability to 2030. The SSMP is being developed as a dedicated framework for the stainless steel value chain  following the Department of Trade  Industry and Competition’s (the dtic) 2020 Steel Master Plan  which formed par...,https://infrastructurenews.co.za/2025/10/24/sassda-spearheads-stainless-steel-master-plan-as-sector-roadmap-to-2030/,,
South Africa,Infrastructure News,Empowering Communities Through Clean Energy – EWSETA Advances South Africa’s G20 Clean Cooking Legacy,2025-10-21,South Africa has achieved a significant milestone in its clean energy transition through the G20 Clean Cooking Legacy Programme  a global initiative that united all G20 member states behind the goal of universal access to sustainable energy. Working under the leadership of the Department of Electricity and Energy (DEE)   the Energy and Water Sector Education and Training Authority (EWSETA) and Eskom Holdings SOC Limited (Eskom) were among the key national institutions that helped conceptualis...,https://infrastructurenews.co.za/2025/10/21/empowering-communities-through-clean-energy-ewseta-advances-south-africas-g20-clean-cooking-legacy/,,
South Africa,Infrastructure News,The role of Civil Society in Johannesburg’s future,2025-10-21,Johannesburg is grappling with multiple crises  from failing infrastructure  crumbling services and eroding trust in governance. While the problems are immense  the residents of Johannesburg are not without hope or action. Yunus Chamda  coordinator of the Johannesburg Crisis Alliance A direct response to the growing concerns of Johannesburg residents  the Joburg Crisis Alliance (JCA) was born.JCA is “an emerging alliance that is gradually building a civic movement that aims to arrest the decl...,https://infrastructurenews.co.za/2025/10/21/the-role-of-civil-society-in-johannesburgs-future/,,
South Africa,Infrastructure News,Ramokgopa Unveils Massive R2.2 Trillion Electricity Plan To Revive Economy,2025-10-21,The Minister of Electricity and Energy   Dr Kgosientsho Ramokgopa  has announced an ambitious Integrated Resource Plan (IRP) 2025 aimed at resolving the country’s long-standing electricity crisis and jump-starting economic growth. Government plans to invest R2.2 trillion  which is about 30% of the nation’s gross domestic product (GDP)  in a comprehensive energy transformation strategy. This comes after last week’s announcement by Minister in the Presidency  Khumbudzo Ntshavheni  of Cabinet ap...,https://infrastructurenews.co.za/2025/10/21/ramokgopa-unveils-massive-r2-2-trillion-electricity-plan-to-revive-economy/,,
South Africa,Infrastructure News,Parliamentary Committee Commends Progress at TCTA Water Projects,2025-10-24,The Portfolio Committee on Water and Sanitation has in recent weeks conducted oversight visits to several key water and sanitation infrastructure projects across the country. On 9 October 2025  the committee toured the Central Basin Acid Mine Drainage (AMD) treatment plant in Germiston  operated by Trans-Caledon Tunnel Authority (TCTA). Leading the visit were TCTA Chief Executive  Percy Sechemane  and Board Chairperson  Precious Sibiya  who reaffirmed the organisation’s commitment to sustaina...,https://infrastructurenews.co.za/2025/10/24/parliamentary-committee-commends-progress-at-tcta-water-projects/,,
South Africa,Infrastructure News,Durban Container Terminal Pier 2 Boosts Capacity With New Ship-to-shore Cranes,2025-10-24,Transnet SOC Ltd (“Transnet”) today launched four new ship-to-shore (STS) cranes valued at R967 million at the Durban Container Terminal (DCT) Pier 2 to enhance the terminal’s operational efficiency  cargo-handling capacity  and competitiveness. The new STS cranes will replace an old fleet which has reached its end–of–lifecycle. Two of the cranes are being commissioned  with endurance testing and operational handover scheduled to start in the last week of October 2025. The remaining two crane...,https://infrastructurenews.co.za/2025/10/24/durban-container-terminal-pier-2-boosts-capacity-with-new-ship-to-shore-cranes/,,
South Africa,Infrastructure News,R147m Waterfront Project To Boost East London Tourism  Jobs,2025-10-22,The Transnet National Ports Authority (TNPA) has officially broken ground on the R147 million Latimer’s Landing redevelopment at the Port of East London — a flagship project set to revitalise the city’s waterfront and inject fresh energy into the Eastern Cape’s tourism and economic landscape. The redevelopment marks a major milestone in the long-anticipated transformation of Latimer’s Landing into a vibrant mixed-use precinct. Once a purely operational marine quay  the site has evolved into a...,https://infrastructurenews.co.za/2025/10/22/r147m-waterfront-project-to-boost-east-london-tourism-jobs/,,
South Africa,Infrastructure News,Ford South Africa Champions Homegrown Talent at the 2025 Service Engineering & Operations Skills Contest,2025-10-20,Skills development and technical excellence are critical to the sustainability of South Africa’s automotive industry. As vehicle technology advances and customer expectations evolve  the demand for highly skilled technicians capable of diagnosing and maintaining complex systems has never been greater. In line with this commitment to continuous learning and professional development  Ford Motor Company of Southern Africa (Manufacturing) (Pty) Limited (“Ford South Africa”) hosted its Service Eng...,https://infrastructurenews.co.za/2025/10/20/ford-south-africa-champions-homegrown-talent-at-the-2025-service-engineering-operations-skills-contest/,,
South Africa,Infrastructure News,From Coal To Clean Water: Arnot’s New Legacy,2025-10-21,Seriti Resources   in partnership with Nafasi Water Technologies   is launching a project to finance  build and operate a water treatment project at the Arnot Closed Colliery near Middelburg  Mpumalanga. This initiative reflects Seriti’s commitment to responsible water management  environmental stewardship  and compliance with regulatory requirements. The Olifants River catchment is one of South Africa’s most important water systems  supporting communities  agriculture  industry  and biodiver...,https://infrastructurenews.co.za/2025/10/21/from-coal-to-clean-water-arnots-new-legacy/,,
South Africa,Infrastructure News,Record-Breaking Absa ESD Expo Boosts SMMEs – Generating R24 Million In Business Opportunities,2025-10-20,This year’s 14th annual Absa Enterprise & Supplier Development (ESD) Expo   held alongside the 19th annual Smart Procurement World Indaba  wrapped up with record-breaking attendance and over R24 million in business opportunities generated for South African small  medium and micro enterprises (SMMEs). The two-day event  hosted in Johannesburg by Smart Procurement and sponsored by Absa  drew 476 SMMEs  31 corporate procurement teams and nearly 1 700 visitors. “This year’s enormous success cemen...,https://infrastructurenews.co.za/2025/10/20/record-breaking-absa-esd-expo-boosts-smmes-generating-r24-million-in-business-opportunities/,,
South Africa,Infrastructure News,The Science Beneath The Surface With AKS Lining Systems: Smarter Landfill Containment,2025-10-20,Peter Hardie  manager technical and international sales  AKS Lining Systems Geosynthetic linings are the barrier between a functional landfill and one that poses public health concerns. These linings are used to separate the waste from the earth underneath  preventing leachate and soil contamination. AKS Lining Systems   a company supplying geosynthetic linings to more than 30 countries  focuses on high-density polyethylene (HDPE) lining systems. Peter Hardie  manager: technical and internati...,https://infrastructurenews.co.za/2025/10/20/the-science-beneath-the-surface-with-aks-lining-systems-smarter-landfill-containment/,,
South Africa,Infrastructure News,Innovative Filter Monitoring In Drinking Water Supplies,2025-10-20,Access to clean drinking water is fundamental to public health and the overall well-being of communities. With ongoing advancements in technology  approaches to monitoring and preserving water quality have become increasingly sophisticated. Today’s filtration systems depend on highly accurate  intelligent monitoring tools to ensure that every drop consistently meets the most stringent standards for safety and quality. The monitoring process starts by drawing raw water from a natural source  s...,https://infrastructurenews.co.za/2025/10/20/innovative-filter-monitoring-in-drinking-water-supplies/,,
South Africa,Infrastructure News,Sappi Recognised In The Forbes Magazine World’s Best Employers And Top Companies For Women Rankings For 2025,2025-10-17,Sappi has once again earned a place on the prestigious Forbes magazine and Statista World’s Best Employers list for 2025 (#289 globally and #5 in South Africa) as well as the World’s Top Companies for Women list for 2025 (#144 globally and #2 in South Africa). These recognitions reaffirm Sappi’s continued commitment to creating an inclusive  engaging and purpose-driven workplace – one where people feel valued  empowered and inspired to grow. The dual recognition highlights the company’s stron...,https://infrastructurenews.co.za/2025/10/17/sappi-recognised-in-the-forbes-magazine-worlds-best-employers-and-top-companies-for-women-rankings-for-2025/,,
South Africa,Infrastructure News,EWSETA Empowers South Africa’s Next Generation of Water Professionals Through Digital Enablement,2025-10-17,Safeguarding South Africa’s water future begins with people who are skilled  innovative and ready to lead. The Energy and Water Sector Education and Training Authority (EWSETA) is at the forefront of this national effort  driving change through education  technology and skills development opportunities. At the 2025 Water and Sanitation Education Programme (WSEP) National Awards  477 participants  including learners  educators  coordinators and provincial representatives  were recognised acros...,https://infrastructurenews.co.za/2025/10/17/ewseta-empowers-south-africas-next-generation-of-water-professionals-through-digital-enablement/,,
South Africa,Infrastructure News,Civil Society To G20: “South Africans Demand A Just  People-centred Energy Future!”,2025-10-17,Before the G20 Climate and Environmental Sustainability Working Group Ministerial Meeting kicked off at the Cape Town International Convention Centre (CTICC) yesterday – to discuss a range of technical papers on biodiversity  land degradation  drought and water sustainability  chemicals and waste management  as well as climate change  air quality and oceans – a group of small-scale fishers  community activists joined The Green Connection   Extinction Rebellion   Project90By2030 and SboNdaba D...,https://infrastructurenews.co.za/2025/10/17/civil-society-to-g20-south-africans-demand-a-just-people-centred-energy-future/,,
South Africa,Infrastructure News,Growthpoint Backs Cape Winelands Airport With Landmark Partnership,2025-10-17,Growthpoint Properties (JSE: GRT)  South Africa’s leading Real Estate Investment Trust (REIT)  has made an initial investment with the right to co-invest and develop the new Cape Winelands Airport precinct  marking the start of a strategic partnership to deliver the Western Cape’s next-generation aviation  hospitality and industrial hub. Growthpoint  which co-owns Cape Town’s signature V&A Waterfront and holds group property assets to the value of R155.8 billion across retail  office and logi...,https://infrastructurenews.co.za/2025/10/17/growthpoint-backs-cape-winelands-airport-with-landmark-partnership/,,
South Africa,Infrastructure News,Africa’s Institutional Capital is Powering the Next Wave of Infrastructure Growth,2025-10-17,Africa’s Institutional Capital is Powering the Next Wave of Infrastructure Growth Africa faces an infrastructure financing gap of over USD 100 billion annually – yet its USD 2 trillion in pension and sovereign wealth fund assets hold the potential to bridge it. At PIAfrica 2026   over 200 senior decision-makers from 25+ countries will gather to explore how institutional investors can drive long-term  sustainable development through infrastructure  private markets  and impact investments. PIAf...,https://infrastructurenews.co.za/2025/10/17/africas-institutional-capital-is-powering-the-next-wave-of-infrastructure-growth/,,
South Africa,Infrastructure News,SANEDI Celebrates Exceptional Results – Driving South Africa’s Energy Future With Integrity And Impact,2025-10-17,The South African National Energy Development Institute (SANEDI) is proud to announce an outstanding performance for the 2024/2025 financial year – achieving 100% of its performance targets and securing a fourth consecutive clean audit opinion from the Auditor-General of South Africa (AGSA). This exceptional outcome reflects SANEDI’s deep commitment to excellence  integrity  and impact in advancing South Africa’s energy sector. It also highlights the strength of SANEDI’s governance structures...,https://infrastructurenews.co.za/2025/10/17/sanedi-celebrates-exceptional-results-driving-south-africas-energy-future-with-integrity-and-impact/,,
South Africa,Infrastructure News,Ongoing Power Outages In Alrode – Millions Of Rands Already Lost,2025-10-17,In a candid discussion on 702 Drive with host John Perlman  Professor Valli Padiachi  a veteran energy expert and former executive manager at Eskom and City Power  revealed the multifaceted causes behind the surge in substation fires plaguing South Africa. As incidents escalate amid economic pressures and infrastructure strain  Padiachi called for urgent investments in maintenance and rapid-response security to avert widespread blackouts and safety risks. The interview  sparked by a recent su...,https://infrastructurenews.co.za/2025/10/17/ongoing-power-outages-in-alrode-millions-of-rands-already-lost/,,
South Africa,Infrastructure News,Building Africa’s Industrial Future Through Skills And Innovation,2025-10-16,The second Africa Skills Week (ASW) which promotes youth skills development and fosters collaboration across the continent  is currently underway in Addis Ababa  Ethiopia. Higher Education and Training Deputy Minister  Dr Mimmy Gondwe is leading South Africa’s delegation to the gathering which began on Monday. It is being hosted by the African Union Commission’s Department of Education  Science  Technology and Innovation (ESTI)  in collaboration with the Ethiopian Ministry of Labour and Skill...,https://infrastructurenews.co.za/2025/10/16/building-africas-industrial-future-through-skills-and-innovation/,,
South Africa,Infrastructure News,TNPA Issues RFP for Port of Cape Town,2025-10-16,Transnet National Ports Authority (TNPA) has issued a Request for Proposals (RFP) for the appointment of a suitable terminal operator to construct and manage a Break Bulk Terminal specialising in cold storage of fish and related products at the Port of Cape Town. The earmarked port terminal site is a brownfield development  measuring approximately 7 273 m²  which is located adjacent to the ship repair and liquid bulk precincts. The site is regarded as integral to fishing operations at the por...,https://infrastructurenews.co.za/2025/10/16/tnpa-issues-rfp-for-port-of-cape-town/,,
South Africa,Infrastructure News,The Association of Water and Sanitation Institutions of South Africa  AWSISA  Africa & Global South Water and Sanitation Dialogue 2025,2025-10-15,The overarching topic for this year is “Towards Sustainable Water and Sanitation Security in Africa”. The theme speaks to the urgent need for long-term  inclusive solutions. Attendees will get front-row access to panel discussions  exhibitions  and networking sessions geared toward driving meaningful progress in water access and sanitation infrastructure. “This Dialogue is not just another event  it’s a space where ideas meet action ” says AWSISA Chairperson of the Board  Mr. Ramateu Monyokol...,https://infrastructurenews.co.za/2025/10/15/the-association-of-water-and-sanitation-institutions-of-south-africa-awsisa-africa-global-south-water-and-sanitation-dialogue-2025-2/,,
South Africa,Infrastructure News,Oil Water Separator Design And Sizing Demystified With Rocla,2025-10-15,Many still view oil water separators as simple concrete boxes  but evolving regulations and technology demand far more precision. Proper classification  correct sizing  and awareness of site-specific risks are essential. Without this  operators risk non-compliance  flooding  or costly retrofits. A new design mindset is urgently required. The design and specification of oil/water separators often falls into a ‘no man’s land’ wherein there is a vast lack of understanding and appreciation toward...,https://infrastructurenews.co.za/2025/10/15/oil-water-separator-design-and-sizing-demystified-with-rocla/,,
South Africa,Infrastructure News,International E-Waste Day: Pick n Pay Partners up to Tackle the E-Waste Challenge,2025-10-14,With its e-waste collection containers in stores across the nation  Pick n Pay   together with Ewaste Africa and the E-waste Recycling Authority have collected 124 tonnes of e-waste since the beginning of 2025. Pick n Pay  together with Ewaste Africa and the E-waste Recycling Authority (ERA)  reminds the public that old phones  laptops  TVs  fridges and broken toasters don’t belong in cupboards  garages or landfills  and that these gadgets  known as e-waste  have recyclable components. The Gl...,https://infrastructurenews.co.za/2025/10/14/international-e-waste-day-pick-n-pay-partners-up-to-tackle-the-e-waste-challenge/,,
South Africa,Infrastructure News,How Disaster-Ready Are African Countries? Study Of 5 Shows Some Progress  But Also Huge Gaps,2025-10-14,When we hear the word “disaster” we often think of floods  droughts or earthquakes – events caused by nature. But what really turns these events into disasters is how prepared we are to deal with them. A flood becomes a disaster when people do not have safe housing  early warnings or emergency support. In other words  disasters often show us what’s missing in our preparation. Yet  with climate extremes becoming more frequent and communities under growing pressure  countries do not have the lu...,https://infrastructurenews.co.za/2025/10/14/how-disaster-ready-are-african-countries-study-of-5-shows-some-progress-but-also-huge-gaps/,,
South Africa,Infrastructure News,Namibia To Host The Next Africa PPP 2025: Unlocking Africa’s $4 Trillion Capital For Infrastructure Investment. High-Level Speakers Set To Unpack The Opportunities,2025-10-14,Africa has nearly $4 trillion in domestic institutional capital that it can tap for infrastructure investment according to a recent report by leading continental lender  AFC. Held by pension funds  sovereign wealth funds and banks  this capital pool could help bridge the $100 billion plus annual infrastructure investment gap being exacerbated by debt distressed public budgets  rising protectionism as well as FDI and official development assistance that are failing to keep up with the continen...,https://infrastructurenews.co.za/2025/10/14/namibia-to-host-the-next-africa-ppp-2025-unlocking-africas-4-trillion-capital-for-infrastructure-investment-high-level-speakers-set-to-unpack-the-opportunities/,,
South Africa,Infrastructure News,Africa’s Future Internet Could Be On Innovative Overland Submarine Cables,2025-10-14,When it comes to digital infrastructure in Africa  few things are more pressing than the need for faster  more resilient  and more direct connectivity between the continent’s east and west coasts. As things stand today  if a submarine cable is cut north of Mombasa  data traffic must travel all the way down to South Africa  across the country  and back up the West Coast to reach Europe or the Americas. That detour not only adds significant cost but also doubles latency – something no cloud-rel...,https://infrastructurenews.co.za/2025/10/14/africas-future-internet-could-be-on-innovative-overland-submarine-cables/,,
South Africa,Infrastructure News,Werner Pumps Launches Redesigned Industrial High-Pressure Washer,2025-10-14,Werner Pumps has launched its fully redesigned range of industrial high-pressure washers  engineered for medium- to heavy-duty applications and built with a “racing-car” style cart that boosts manoeuverability  stability and on-site safety. The expanded line-up includes both electric and petrol variants  with 220V  380V 3-phase  and petrol engine-driven options  delivering 150 to 250 bar of pressure. Every unit now ships standard with a 10 m hose  high-pressure gun  low-water inlet switch  an...,https://infrastructurenews.co.za/2025/10/14/werner-pumps-launches-redesigned-industrial-high-pressure-washer/,,
South Africa,Infrastructure News,New Resilience In Water Storage,2025-10-14,In a world increasingly defined by the need for sustainable infrastructure and resilient systems  water storage has emerged as a critical component of industrial  agricultural  and municipal planning. Aquadam   a steel tank and water storage solutions company  has taken these needs into account and produced the Rhino Tank. This tank is durable  efficient  and built with the long term in mind. The Rhino Tank is a bolted steel tank enhanced with a Fusion Bonded Epoxy (FBE) coating. This coating...,https://infrastructurenews.co.za/2025/10/14/new-resilience-in-water-storage/,,
