country,source,title,date_iso,summary,url,category,status
South Africa,Infrastructure News,Villagers lodge complaint with African Development Bank against Lesotho Highlands Water Project,2025-09-30,Eighteen rural mountain communities in Lesotho have formally complained about Phase II of the Lesotho Highlands Water Project (LHWP). The massive project  a joint scheme with South Africa  will supply water to Gauteng and generate electricity for Lesotho. By Sechaba Mokhethi About 1 600 villagers  backed by human rights groups  Seinoli Legal Centre and Accountability Counsel  brought their detailed complaint to the African Development Bank (AfDB)  a key financier of the project. They allege u...,https://infrastructurenews.co.za/2025/09/30/villagers-lodge-complaint-with-african-development-bank-against-lesotho-highlands-water-project/,,
South Africa,Infrastructure News,Carbon Budgets Raise Urgency Of Company Plans To Reduce Emissions,2025-09-30,South Africa has taken an important step towards meeting its carbon reduction commitments under the Paris Agreement  with carbon budget regulations that will demand tangible action from the country’s large emitters. Published for comment in early August 2025  the draft National Greenhouse Gas Carbon Budget and Mitigation Plan Regulations set the stage for companies to plan exactly how they will cut their carbon emissions – against real targets they will be legally obliged to meet. Philippa Bu...,https://infrastructurenews.co.za/2025/09/30/carbon-budgets-raise-urgency-of-company-plans-to-reduce-emissions/,,
South Africa,Infrastructure News,Concor’s Wind Energy Gamechanger: Full Bop Under One Roof,2025-09-30,In a milestone achievement for South Africa’s renewable energy sector  Concor has taken full control of the Balance of Plant (BoP) scope on the TotalEnergies Renewables De Aar 2 South Wind Energy Facility in the Northern Cape. This marks the first time the company is delivering a fully wrapped BoP contract under its own direct engineering and construction management. Not only is Concor the main contractor for the 25 turbine project spread across five farms near Philipstown  but it is also res...,https://infrastructurenews.co.za/2025/09/30/concors-wind-energy-gamechanger-full-bop-under-one-roof/,,
South Africa,Infrastructure News,Namibian Municipality Strengthens Service Delivery With Werner Pumps Truck and Trailer,2025-09-30,The Municipality of Walvis Bay in Namibia has strengthened its sewer and drainage maintenance capabilities with the addition of a South African-manufactured Werner Pumps jetting trailer to complement its existing Werner Pumps combination jetting and vacuum truck. According to Immanuel Gabriel  Foreman: Reticulation in the Department of Water  Waste Liquid and Environmental Management  the decision to invest again in Werner Pumps equipment was influenced by the quality and reliability of the f...,https://infrastructurenews.co.za/2025/09/30/namibian-municipality-strengthens-service-delivery-with-werner-pumps-truck-and-trailer/,,
South Africa,Infrastructure News,Verder Pumps SA: Big Green Innovation  Bold Global Solutions,2025-09-29,The Verder Group is underpinned by two divisions: Verder Liquids   a high-tech pump-manufacturing specialist  and Verder Scientific   a leading laboratory and analysing-equipment supplier. “Our divisions are two sides of the same coin. While Verder Liquids moves fluids  Verder Scientific measures them. And that gives us a position of offering end-to-end solutions – whether it’s mining  where we have pump and laboratory offerings  or  e.g.  in water treatment  where our pumps and test equipmen...,https://infrastructurenews.co.za/2025/09/29/verder-pumps-sa-big-green-innovation-bold-global-solutions/,,
South Africa,Infrastructure News,Invisible Warrior Makes Positive Impact In Drought Battle,2025-09-29,Matthew Hills  Engineer  Nelson Mandela Bay Municipality When the taps of the Nelson Mandela Bay Municipality (NMBM) were perilously close to running dry  one of the most impactful lifelines didn’t come from building a new dam or a flashy pipeline. It came from the flow of data through a new Telemetry-SCADA  system. “During the drought  Nelson Mandela Bay was struggling to balance on a water supply and demand knife edge. To cope with this  we had to be extremely agile and were constantly open...,https://infrastructurenews.co.za/2025/09/29/invisible-warrior-makes-positive-impact-in-drought-battle/,,
South Africa,Infrastructure News,KSB Pumps: Powering Technology with Training,2025-09-29,The latest water solutions would go nowhere without the correct training. South Africa cannot afford to pour money into good technology without backing that technology up with skills. Ensuring that people who operate their pumps are in the know  KSB Pumps and Valves has invested in a specialised training centre designed to equip internal and branch staff  as well as certified partners  with in-depth knowledge of KSB products and systems. Clients are also catered for with the provision of firs...,https://infrastructurenews.co.za/2025/09/29/ksb-pumps-powering-technology-with-training/,,
South Africa,Infrastructure News,Ekuvukeni Water Supply Project to Improve Lives of KZN Communities,2025-09-29,The Minister of Cooperative Governance and Traditional Affairs (CoGTA)  Velenkosini Hlabisa  has officially handed over the completed works of the Ekuvukeni Water Supply Project in KwaZulu-Natal’s Alfred Duma Local Municipality. Addressing community members  traditional leaders  and government stakeholders at the Ekuvukeni Sportsfield at the handover on Thursday  Hlabisa emphasised the constitutional importance of water as a basic human right. “Section 27 of the Bill of Rights affirms that ev...,https://infrastructurenews.co.za/2025/09/29/ekuvukeni-water-supply-project-to-improve-lives-of-kzn-communities/,,
South Africa,Infrastructure News,New Data Shows Liquid Board Carton And PET Plastic Recycling In SA Is On The Rise,2025-09-29,CEO Telly Chauke South Africa’s recycling initiatives under the extended producer responsibility (EPR) legislation are proving positive. PETCO   a producer responsibility organisation (PRO)  published its annual review stating that they have met the legislated targets for 99% of the tonnage of identified products placed on the market by its members in 2024. Petco  representing 29 major brands including Coca-Cola  PepsiCo  Tiger Brands  and Tetra Pak  reported strong progress in its recycling ...,https://infrastructurenews.co.za/2025/09/29/new-data-shows-liquid-board-carton-and-pet-plastic-recycling-in-sa-is-on-the-rise/,,
South Africa,Infrastructure News,Passenger Rail Gets Back On Track  Slowly,2025-09-26,By 2021  the Passenger Rail Agency of South Africa (PRASA) had collapsed. As corruption and mismanagement took hold over the previous ten years  the rail service became increasingly unreliable and unsafe. Almost all of PRASA’s customers stopped using the train in this period  many opting for more expensive but reliable taxi and bus services. Infrastructure decayed without being maintained or replaced. Security contracts were allowed to lapse  leading to widespread vandalism. The covid pandemi...,https://infrastructurenews.co.za/2025/09/26/passenger-rail-gets-back-on-track-slowly/,,
South Africa,Infrastructure News,Government Plans To Eliminate Load Reduction,2025-09-26,In the next 12 to 18 months  government will work aggressively to eliminate load reduction by rolling out smart meters  dealing with illegal electricity connections and upgrading infrastructure. Load reduction refers to the intentional interruption of electricity in specific areas where the local network becomes overloaded  especially during peak demand periods. This measure is essential to safeguard critical infrastructure  particularly in areas affected by high energy losses or illegal conn...,https://infrastructurenews.co.za/2025/09/26/government-plans-to-eliminate-load-reduction/,,
South Africa,Infrastructure News,Cape Town Unveils Groundbreaking Household Survey Results For Data-driven City Planning,2025-09-25,The City of Cape Town is pleased to announce the release of findings from its inaugural city-wide Cape Town Household Survey  conducted between February and October 2024. This landmark initiative represents a significant step forward in the City’s commitment to data-driven decision-making  inclusive governance  and responsive service delivery for all residents. The survey  which engaged over 8 000 households across the city  from formal residences to informal settlements and backyard dwelling...,https://infrastructurenews.co.za/2025/09/25/cape-town-unveils-groundbreaking-household-survey-results-for-data-driven-city-planning/,,
South Africa,Infrastructure News,Bi (Bearings International) Proudly Enters South Africa’s Pump Market In Partnership With Leading Italian Manufacturer – SAER,2025-09-25,Bi (Bearings International) is proud to announce its strategic entry into the local pumps market  through an exclusive distribution agreement with leading Italian pump manufacturer – SAER . “As a leading supplier and distributor of premium mechanical industrial consumables to key industries across Southern Africa for six decades  our decision to enter the local pump market stems from a natural progression to also offer our customers access to fluid handling products ” says Bi Product Applicat...,https://infrastructurenews.co.za/2025/09/25/bi-bearings-international-proudly-enters-south-africas-pump-market-in-partnership-with-leading-italian-manufacturer-saer/,,
South Africa,Infrastructure News,Unveiling SEACOM 2.0 – ​ ​A new digital renaissance and subsea network to power the Indian Ocean Basin’s digital and AI future,2025-09-25,SEACOM   Africa’s trailblazer in digital infrastructure  today announced the launch of SEACOM 2.0  a groundbreaking subsea cable system poised to redefine connectivity across the Indian Ocean Basin  Middle East  Mediterranean  and Southern Europe. Unveiled at Submarine Networks World 2025 in Singapore  the project marks a bold leap toward securing Africa’s role in the global digital economy while addressing the explosive demand for AI  cloud  and real-time data services. ​ SEACOM 2.0 builds o...,https://infrastructurenews.co.za/2025/09/25/unveiling-seacom-2-0-a-new-digital-renaissance-and-subsea-network-to-power-the-indian-ocean-basins-digital-and-ai-future/,,
South Africa,Infrastructure News,Eskom Confirms Structural Integrity Of Koeberg Plant,2025-09-25,Eskom has moved to confirm the structural integrity of safety monitoring at the Koeberg Nuclear Power Station in Cape Town. “Recent commentary suggesting that Eskom is ‘flying blind’ at Koeberg Nuclear Power Station is inaccurate and misleading. Eskom confirms that all safety-critical systems are fully functional  carefully monitored  and continuously improved in line with strict nuclear safety standards ” it said in a statement on Wednesday. The power utility said that Koeberg’s containment ...,https://infrastructurenews.co.za/2025/09/25/eskom-confirms-structural-integrity-of-koeberg-plant/,,
South Africa,Infrastructure News,5 Ways Digital Innovation Can Secure Reliable Water for Communities While Saving Municipalities from Leaking Billions,2025-09-25,Nearly half of South Africa ’s treated water never reaches households or businesses. The result isn’t only approximately R7.2 billion in annual deficit municipal revenue – it’s also taps that run dry  strained infrastructure  and communities left without the services they need. “Every litre lost is also a lost chance to improve people’s lives ” says Sabine Dall’Omo  CEO of Siemens Sub-Saharan Africa. “Digital solutions give municipalities the tools to recover water  reinvest in infrastructure...,https://infrastructurenews.co.za/2025/09/25/5-ways-digital-innovation-can-secure-reliable-water-for-communities-while-saving-municipalities-from-leaking-billions/,,
South Africa,Infrastructure News,Renewable Energy a ‘Defining Opportunity’ for Africa’s Re-industrialization – Graham-Maré,2025-10-09,"The renewable energy industry is a “defining opportunity” for African countries to leverage its vast resources to re-industrialize, create dignified employment opportunities for youth, and power a new wave of skills development. This according to Deputy Minister of Electricity and Energy Samantha Graham-Maré, who was speaking at a side event of the G20 4th Energy Transitions Working Group (ETWG) meetings. “For Africa, this is the defining challenge and the defining opportunity of our century...”",https://infrastructurenews.co.za/2025/10/09/renewable-energy-a-defining-opportunity-for-africas-re-industrialisation-graham-mare/,,
South Africa,Infrastructure News,Africa50 Appoints Global Leader Sérgio Pimenta To Spearhead Its Later-Stage Africa-Focused Infrastructure Acceleration Fund,2025-10-02,"Africa50, the pan-African infrastructure investor and multi-vehicle asset manager, today announced the appointment of Sérgio Pimenta as Chief Executive Officer of the Africa50 IAF. The appointment marks a strategic move to scale private-sector investment, given the crucial role infrastructure plays in the continent’s development. Pimenta brings over 25 years of experience at the International Finance Corporation (IFC), where he most recently served as Vice President for Africa, leading near...",https://infrastructurenews.co.za/2025/10/02/africa50-appoints-global-leader-sergio-pimenta-to-spearhead-its-later-stage-africa-focused-infrastructure-acceleration-fund/,,
