country,source,title,date_iso,summary,url,category,status
South Africa,Infrastructure News,When Cyber Laws Backfire: The Rules Making Us Less Safe,2025-10-13,Regulation was designed to protect customers  curb risk  and hold businesses accountable. But today  it’s often doing the opposite – creating impossible trade-offs  punishing transparency  and turning defenders into accidental offenders. Instead of building resilience  rigid laws are breeding fragility  making organisations and consumers more vulnerable than ever. Gartner’s 2025 research confirms that Security and Risk Management leaders are moving beyond a pure prevention mindset to embed re...,https://infrastructurenews.co.za/2025/10/13/when-cyber-laws-backfire-the-rules-making-us-less-safe/,,
South Africa,Infrastructure News,South Africans Are Going Off The Service Grid: What Happens When Citizens Replace The State?,2025-10-13,South Africa’s constitution promises all citizens access to adequate housing and basic services – water  security  sanitation and electricity. In practice  people from rich to poor experience persistent water cuts  sewage overflows  electricity blackouts and uneven policing. Fiona Anciano  Charlotte Lemanski  Christina Culwick Fatti and Margot Rubin are urban researchers who investigated how and why households in South Africa are going off-grid in almost every way. They speak to The Conversat...,https://infrastructurenews.co.za/2025/10/13/south-africans-are-going-off-the-service-grid-what-happens-when-citizens-replace-the-state/,,
South Africa,Infrastructure News,Gauteng Hosts Roundtable On Sinkholes,2025-10-13,The Gauteng Department of Cooperative Governance and Traditional Affairs (CoGTA) recently held a first of its kind roundtable on the management of sinkholes and dolomite. “Sinkholes are not just geological events  they are a test of how well we plan  manage  and maintain infrastructure. This roundtable has allowed us to align government  scientists  and engineers behind prevention  preparedness  and resilience ” said MEC Jacob Mamabolo. This as the Council for Geoscience (CGS) reported that w...,https://infrastructurenews.co.za/2025/10/13/gauteng-hosts-roundtable-on-sinkholes/,,
South Africa,Infrastructure News,Government To Announce Major Nuclear Energy Expansion Plans,2025-10-13,Government will soon make an announcement on plans to expand South Africa’s foray into nuclear energy. This according to Minister of Electricity and Energy  Dr Kgosientsho Ramokgopa  who delivered the opening address at the G20 Nuclear Energy Ministerial Conference held in Durban. “[We] will be making big announcements next week  post-Cabinet. We are close to that. Our ambition is to build a new job program [of] at least initially the size of 5000 megawatts  and we think that we can derive th...,https://infrastructurenews.co.za/2025/10/13/government-to-announce-major-nuclear-energy-expansion-plans/,,
South Africa,Infrastructure News,African Climate Experts Call For Inclusive Global Prosperity And Climate Justice At G20,2025-10-13,African climate think tanks and experts have called for the support of inclusive decision-making spaces by the G20 and accelerated reform of international cooperation institutions to create a more equitable global economic architecture that leaves no one behind. Reaffirming Africa’s commitment to multilateralism and international law as essential foundations for shared global prosperity  they noted that Africa’s position is clear that “the climate agenda is the development agenda”. Speaking i...,https://infrastructurenews.co.za/2025/10/13/african-climate-experts-call-for-inclusive-global-prosperity-and-climate-justice-at-g20/,,
South Africa,Infrastructure News,President Ramaphosa Welcomes €11.5 Billion EU Investment In South Africa,2025-10-13,President Cyril Ramaphosa has welcomed a new investment package from the European Union (EU) valued at €11.5 billion (R230 billion)  describing it as a significant step towards building South Africa’s economy of the future while deepening long-standing ties with Europe. Speaking during a media briefing on Thursday  President Ramaphosa said the initiative opens “new possibilities for trade and investment” and marks the beginning of “a new era of partnership and cooperation” between South Afric...,https://infrastructurenews.co.za/2025/10/13/president-ramaphosa-welcomes-e11-5-billion-eu-investment-in-south-africa/,,
South Africa,Infrastructure News,Wastewater Monitoring Safeguards Water Quality And Industry Compliance With Hach,2025-10-13,Kagiso Ramoadi  regional sales manager at Hach With stricter environmental regulations and mounting pressure to protect aquatic life  accurate wastewater monitoring has become a priority for both municipalities and industries. Hach   a global leader in water analysis  is helping South African sectors meet these demands with innovative testing solutions and trusted local support. COD testing measures chemical oxygen demand  which is the amount of oxygen required to chemically break down organi...,https://infrastructurenews.co.za/2025/10/13/wastewater-monitoring-safeguards-water-quality-and-industry-compliance-with-hach/,,
South Africa,Infrastructure News,When Plastics Won’t Play Nice,2025-10-13,Garreth Russel  MD of RevoWaste Plastics are often described as the most stubborn of waste streams  essential to modern life yet resistant to recycling systems. South African plastic recyclers tend to focus on niches like PET  which is highly recyclable  and view a lot of the plastics in circulation as non-recyclable. “We wanted to look at the challenging waste streams  the so-called ‘non-recyclables’ ” says Gareth Russell  managing director of Revowaste . “Four and a half years on  we’re pro...,https://infrastructurenews.co.za/2025/10/13/when-plastics-wont-play-nice/,,
South Africa,Infrastructure News,Media Briefing On Strengthening Africa’s G20 Contribution On Climate  Environment And Sustainability,2025-10-10,AUDA-NEPAD   the African Union’s development agency  in partnership with the Office of the Special Envoy for Climate Change  Kenya as the Chair of the Conference of African Heads of State and Government (CAHOSCC)  is pleased to invite you to a media briefing to be held during informal consultations aimed at strengthening Africa’s G20 contribution on climate  environment and sustainability. The two-day consultations will bring together African think tanks  intergovernmental organisations and p...,https://infrastructurenews.co.za/2025/10/10/media-briefing-on-strengthening-africas-g20-contribution-on-climate-environment-and-sustainability/,,
South Africa,Infrastructure News,GE Vernova and PROTEC Celebrate Graduation of Next Engineers: Engineering Academy class,2025-10-10,Next Engineers  a global college- and career-readiness programme working to increase the opportunities for young people in engineering  celebrated the graduation of 43 learners from the Engineering Academy in Johannesburg  South Africa. The graduation ceremony  held at The University of the Witwatersrand  Johannesburg  marked the programme’s second graduating class and highlights its contribution towards bridging the science  technology  engineering and mathematics (STEM) skills gap in the co...,https://infrastructurenews.co.za/2025/10/10/ge-vernova-and-protec-celebrate-graduation-of-next-engineers-engineering-academy-class/,,
South Africa,Infrastructure News,A Transport Month Call For Municipal Engineers To Be Heard To Prevent Infrastructure Collapse,2025-10-10,Geoff Tooley  IMESA president As South Africa marks Transport Month  the Institute of Municipal Engineering of Southern Africa (IMESA) is calling for urgent reform in how infrastructure decisions are made. The organisation says that many ongoing failures in transport and public infrastructure are rooted in one critical issue: engineers are being excluded from procurement and planning decisions. “At municipal level  tender evaluation committees and bid adjudication committees – which are respo...,https://infrastructurenews.co.za/2025/10/10/a-transport-month-call-for-municipal-engineers-to-be-heard-to-prevent-infrastructure-collapse/,,
South Africa,Infrastructure News,Deputy Minister Mahlobo Commends Public Private Partnerships To Tackle Water And Sanitation Challenges In Mpumalanga Province,2025-10-09,Deputy Minister of Water and Sanitation  Mr David Mahlobo Deputy Minister of Water and Sanitation   Mr David Mahlobo  has reiterated the importance of public-private partnerships in resolving long-standing water and sanitation challenges in the Mpumalanga province. He said this when he officially opened a two-day Water and Sanitation Indaba held in Secunda  Mpumalanga province on 07-08 October 2025  where water and sanitation experts  municipalities  policy makers  researchers and academia co...,https://infrastructurenews.co.za/2025/10/09/deputy-minister-mahlobo-commends-public-private-partnerships-to-tackle-water-and-sanitation-challenges-in-mpumalanga-province/,,
South Africa,Infrastructure News,TNPA Awards 25-year Liquid Bulk Terminal Concession At Port Of Cape Town,2025-10-09,The Transnet National Ports Authority (TNPA) has signed a Terminal Operator Agreement (TOA) with FFS Tank Terminals to operate and maintain a Liquid Bulk Terminal at the Port of Cape Town for a 25-year concession period. With an investment of R195.7million over the first three years  this new concession will lead to the refurbishment of terminal infrastructure and upgrades aimed at improving operational efficiency and ensuring the security of supply to local industries. Once operational  the ...,https://infrastructurenews.co.za/2025/10/09/tnpa-awards-25-year-liquid-bulk-terminal-concession-at-port-of-cape-town/,,
South Africa,Infrastructure News,WaterConnect’s First Development Agreement Targets Water Infrastructure in Kenya,2025-10-08,WaterConnect   the project development company founded by Water.org   has signed its first project development agreement with consortium partners Haskoning  RebelGroup  Private Infrastructure Development Group (PIDG)  and Africa Water Infrastructure Development Ltd. (AWID) (the water platform owned by British International Investment and Metito)  to advance the Naivasha Special Economic Zone (SEZ) and Domestic Bulk Water Supply and Wastewater Project in Kenya. “This is a defining moment for W...,https://infrastructurenews.co.za/2025/10/08/waterconnects-first-development-agreement-targets-water-infrastructure-in-kenya/,,
South Africa,Infrastructure News,Johannesburg Water Condemns Assault of Investigator During Illegal Connections Operation in Tulisa Park,2025-10-08,Johannesburg Water strongly condemns the assault of one of its illegal connections investigators  who was attacked by a customer during the execution of his duties in Tulisa Park  Johannesburg South  on Wednesday  1 October 2025. The investigator was at the property to investigate a suspected illegal reconnection after the customer was disconnected by Credit Management Disconnection (Level 1). The Entity views any act of violence against our employees with the utmost seriousness and will not ...,https://infrastructurenews.co.za/2025/10/08/johannesburg-water-condemns-assault-of-investigator-during-illegal-connections-operation-in-tulisa-park/,,
South Africa,Infrastructure News,Johannesburg Water Launches Underground Water Pilot Project to Improve Supply to Informal Settlements,2025-10-08,Johannesburg Water  in partnership with Wits Enterprise  which provides strategic consulting services to bring about societal change  announces the launch of a pilot project aimed at improving access to a reliable water supply in informal settlements through the use of underground water sources. “This innovative project marks a significant step in addressing long-standing water supply challenges in underserved communities across the City of Johannesburg. By tapping into Underground aquifers  ...,https://infrastructurenews.co.za/2025/10/08/johannesburg-water-launches-underground-water-pilot-project-to-improve-supply-to-informal-settlements/,,
South Africa,Infrastructure News,Johannesburg Water And Water-Efficient Sanitation,2025-10-08,Aligning governance  technology and budgets is proving essential to deliver water-efficient sanitation that saves money while restoring dignity. Speaking at a Bremen Overseas Research and Development Association (Borda) event  Dr Zakhele Khuzuwayo  manager: Innovation and Technology  Johannesburg Water   said the sector must “stop working in silos” and align across public  private and academic stakeholders. City of Johannesburg perspective Dr. Zakhele Khuzuwayo  manager: Innovation and Techno...,https://infrastructurenews.co.za/2025/10/08/johannesburg-water-and-water-efficient-sanitation/,,
South Africa,Infrastructure News,The City of Cape Town Celebrates Its First Junior River Warden Programme,2025-10-07,The City of Cape Town ’s Deputy Mayor and Mayoral Committee Member for Spatial Planning and Environment  Alderman Eddie Andrews joined the City’s Biodiversity Management branch to recognise the learners from Red River Primary; Floreat Primary and Ysterplaat Primary who are participating in the recently launched Junior River Warden Programme. This environmental education initiative focuses on creative projects; hands-on activities and community engagement for learners to gain practical conserv...,https://infrastructurenews.co.za/2025/10/07/the-city-of-cape-town-celebrates-its-first-junior-river-warden-programme/,,
South Africa,Infrastructure News,Rethink Amanzi – Securing Our Future: Call for Abstracts for the WISA 2026 Biennial Conference & Exhibition,2025-10-07,The Water Institute of Southern Africa (WISA) invites professionals  researchers  policymakers  and stakeholders across the water sector to contribute to one of the most important conversations shaping our region’s future – the WISA 2026 Biennial Conference & Exhibition  themed “Rethink Amanzi – Securing Our Future.” Taking place in 2026  this flagship event will unite voices from across Southern Africa and beyond to tackle one of the most pressing challenges of our time: ensuring sustainable...,https://infrastructurenews.co.za/2025/10/07/rethink-amanzi-securing-our-future-call-for-abstracts-for-the-wisa-2026-biennial-conference-exhibition/,,
South Africa,Infrastructure News,Innomotics Geared Motors: Built For Tough Water Applications,2025-10-07,Building on Siemens’ legacy of 150 years of engineering excellence and innovation  Innomotics offers a portfolio of leading motors  drives  converters  programmable logic controllers  software and other engineered solutions. Local presence Innomotics has established a strong and growing presence in South Africa  centred on its operations in Midrand  Johannesburg. The company recently opened an assembly centre  dedicated to producing and distributing geared motors and low-voltage motors. By as...,https://infrastructurenews.co.za/2025/10/07/innomotics-geared-motors-built-for-tough-water-applications/,,
South Africa,Infrastructure News,People Fight for Water as Infrastructure Crumbles,2025-10-06,Near Sibongakonke Mdluli’s RDP house in Marikana  Dundee  a hole has been dug to reach the municipal water line  through which water runs only once a day and for short periods at a time. When the water comes on  residents shove and push each other to fill their containers from the broken pipe. Physical fights have broken out  says Mdluli. Water supply here is the responsibility of the uMzinyathi District Municipality   which is failing its mandate to deliver water to several local municipalit...,https://infrastructurenews.co.za/2025/10/06/people-fight-for-water-as-infrastructure-crumbles/,,
South Africa,Infrastructure News,Eskom: Power Grid Remains Stable,2025-10-06,Eskom says the power system remains stable  supported by sustained improvements in generation performance through the ongoing delivery of the Generation Recovery Plan. In a statement on Friday  the power utility indicated that the month-to-date Energy Availability Factor (EAF) stood at 70.45%  reflecting consistent gains in plant reliability and a reduction in unplanned outages. This is key to stabilising the grid and supporting economic growth. “The ongoing technical improvements under Eskom...,https://infrastructurenews.co.za/2025/10/06/eskom-power-grid-remains-stable/,,
South Africa,Infrastructure News,Government Reiterates Commitment to Provide Access to Water,2025-10-06,The Department of Water and Sanitation (DWS) has reaffirmed its commitment to ensuring that all South Africans have access to sustainable water and sanitation services. Addressing the Commission on Policy Review and Legislative Reforms  the department’s Deputy Director-General Dr Risimati Mathye emphasised that water is not only a basic human right but the cornerstone of health  dignity and economic growth  which must therefore be managed and delivered with long-term sustainability in mind. T...,https://infrastructurenews.co.za/2025/10/06/government-reiterates-commitment-to-provide-access-to-water/,,
South Africa,Infrastructure News,eWASA: Pushing For Unity In South Africa’s Circular Economy,2025-10-06,South Africa is under pressure to reduce waste to landfill and build a circular economy. This comes at a time when landfills are filling up  climate change is increasing severe weather events  and the world is looking to more sustainable economic models that look to the future. Keith Anderson  CEO of the EPR Waste Association of South Africa (eWASA)  believes Extended Producer Responsibility (EPR) is a turning point for South Africa  but only if it is enforced consistently and supported by co...,https://infrastructurenews.co.za/2025/10/06/ewasa-pushing-for-unity-in-south-africas-circular-economy/,,
South Africa,Infrastructure News,Pressure Perfect With Dynamic Fluid Control: The Valve Technology That Keeps Pipelines Efficient And Leak-Free,2025-10-06,Valves are vital in water systems  controlling flow and access  preventing backflow  as well as managing pressure. Air valves specifically release trapped air to improve pumping efficiency and admit air to avoid vacuums  protecting pipelines from collapse while safeguarding the integrity of water and wastewater systems. Dynamic Fluid Control (DFC)  a leading valve manufacturer  is committed to developing innovative solutions that address real-world challenges. One such example was in America ...,https://infrastructurenews.co.za/2025/10/06/pressure-perfect-with-dynamic-fluid-control-the-valve-technology-that-keeps-pipelines-efficient-and-leak-free/,,
South Africa,Infrastructure News,Joburg Water Provides Update on Coronationville Water Provision,2025-10-03,Johannesburg Water has moved to assure residents that progress is being made to improve water supply to Coronationville in the west of the city. The area was the sight of violent protest last month with residents demanding water supply. “Johannesburg Water is making progress on the planned intervention for an immediate intervention to improve supply to the high zone of Coronationville. The project commenced on 22 September 2025  with excavations to expose pipework on the ground. Excavations h...,https://infrastructurenews.co.za/2025/10/03/joburg-water-provides-update-on-coronationville-water-provision/,,
South Africa,Infrastructure News,Western Cape’s Proclaimed Fishing Harbours Project Makes Progress,2025-10-03,The Minister of Forestry  Fisheries and the Environment   Dr Dion George  has welcomed the progress that has been outlined in the September 2025 report on the revitalisation of the Western Cape’s 12 Proclaimed Fishing Harbours. The report highlights steady improvements in infrastructure  safety  and operational efficiency  all aimed at supporting coastal economies and sustainable fisheries. “Our Proclaimed Fishing Harbours are central to coastal livelihoods and the fishing industry. The work ...,https://infrastructurenews.co.za/2025/10/03/western-capes-proclaimed-fishing-harbours-project-makes-progress/,,
South Africa,Infrastructure News,DWS to Host Programme for Future Leaders,2025-10-03,The Department of Water and Sanitation (DWS) will host its annual Water and Sanitation Education Programme (WSEP) in Boksburg  Gauteng. Set to be held from 5–11 October 2025  the programme is aimed at inspiring the next generation of leaders in the sector. The programme seeks to raise awareness among learners about water use efficiency  resource protection  health  hygiene  and the impact of invasive alien plants. Young minds are given the tools and encouragement to shape the future of this v...,https://infrastructurenews.co.za/2025/10/03/dws-to-host-programme-for-future-leaders/,,
South Africa,Infrastructure News,Ewaste Africa: Building South Africa’s Circular Future,2025-10-02,Pravashen Naidoo  CEO of EWaste Africa The surge in consumer electronics has inadvertently led to a proportional increase in e-waste. This hazardous waste stream demands specialised handling  and with solar energy now firmly established in South Africa  the need for proper e-waste (including solar and battery) recycling has become even more critical. EWaste Africa   a recycling company specialising in e-waste  has evolved alongside South Africa’s waste regulatory framework. Initially focusing...,https://infrastructurenews.co.za/2025/10/02/ewaste-africa-building-south-africas-circular-future/,,
South Africa,Infrastructure News,Dams for Development? Unpacking Tensions in the World Bank’s Hydropower Policies,2025-10-02,Dams have been emblematic of the World Bank’s approach to development for many decades. From the bank’s early years in the 1960s and 1970s  large-scale infrastructure projects such as dams  power plants and transport networks were central to its strategy for economic growth and poverty reduction. This reflected a top-down modernisation paradigm . But the controversial social  economic and environmental impacts of dams sparked widespread criticism. This prompted internal scrutiny and a reducti...,https://infrastructurenews.co.za/2025/10/02/dams-for-development-unpacking-tensions-in-the-world-banks-hydropower-policies/,,
South Africa,Infrastructure News,Africa’s Borrowing Costs Are Too High: The G20’s Missed Opportunity to Reform Rating Agencies,2025-10-01,One of the commitments the South African presidency of the G20 made in its policy priorities document at the beginning of 2025 was to push for fairer  more transparent sovereign credit ratings. And to address the high cost of capital caused by an illusive perception of high risk in developing economies. South Africa proposed to establish a commission to look into the cost of capital. In particular  to investigate the issues that impair the ability of low- and middle-income countries to access...,https://infrastructurenews.co.za/2025/10/01/africas-borrowing-costs-are-too-high-the-g20s-missed-opportunity-to-reform-rating-agencies/,,
South Africa,Infrastructure News,In-House Geotech Lab Sets SRK Apart,2025-10-01,Having built a strong reputation in the geotechnical engineering space for more than 50 years  SRK Consulting South Africa (SA) has established its own specialised in-house geotechnical laboratory at its Johannesburg practise– becoming one of only a few international consulting firms with such a facility. The dedicated laboratory began operating in February 2025 to streamline and verify testing – especially in the demanding field of tailings management. There is also a strong applied research...,https://infrastructurenews.co.za/2025/10/01/in-house-geotech-lab-sets-srk-apart/,,
South Africa,Infrastructure News,Port of Ngqura Promises to Be One of the Best in Africa,2025-10-01,What started off as a small port today stands as one of the most promising ports in the country  with great potential to become one of the greatest in Africa – if not the world. The Port of Ngqura  also known as Coega Harbour  is the only deepwater port on the east coast of South Africa  about 20km north-east of Gqeberha in Nelson Mandela Bay Municipality. Situated at the mouth of the Coega River  it is the newest and the deepest container port in South Africa. It is a world-class deepwater t...,https://infrastructurenews.co.za/2025/10/01/port-of-ngqura-promises-to-be-one-of-the-best-in-africa/,,
South Africa,Infrastructure News,Cleaning Up Construction: 40 Contractors Banned by Public Works Department,2025-09-30,Forty contractors have been blacklisted by the Construction Industry Development Board (CIDB) from doing business with the department and its entities. Source: @DeanMacpherson/X. Public Works and Infrastructure Minister Dean Macpherson. The blacklisting spans from June 2024 to date. Public Works Minister Dean Macpherson said this sends a clear signal that the department is serious about acting against non-performance and it means that these contractors are now prohibited from bidding for tend...,https://infrastructurenews.co.za/2025/09/30/cleaning-up-construction-40-contractors-banned-by-public-works-department/,,
