country,source,title,date_iso,summary,url,category,status
Kenya,Construction Kenya,Construction Cost in Kenya: Everything You Need to Know,2025-10-19,Building costs estimation. (Photo: Courtesy) Construction costs in Kenya range from Sh48 750 to Sh122 860 per square metre (Sh4 529 to Sh11 414 per square foot) for residential  commercial  retail  and industrial buildings. ​​Building costs vary depending on factors such as the topography of the ...,https://www.constructionkenya.com/1009/cost-building-house-kenya/,infrastructure,ongoing
Kenya,Construction Kenya,UN-Habitat  Kisumu Ink Sh2.7bn Social Housing Deal,2025-10-16,Prof Anyang’ Nyong’o and Anaclaudia Rossbach sign the deal in Kisumu. (Photo: Courtesy) The United Nations Human Settlements Programme (UN-Habitat) has signed a major deal with Kisumu County to upgrade social housing and improve residents’ living standards. Valued at Sh2.7 billion  the initiative...,https://www.constructionkenya.com/12789/un-habitat-kisumu-social-housing/,infrastructure,
Kenya,Construction Kenya,Kwa Jomvu Interchange 95% Complete After 8-Year Delay,2025-10-21,Ongoing construction at the Kwa Jomvu Interchange. (Photo: Courtesy) Construction of the long-delayed Kwa Jomvu Interchange on Mombasa–Kwa Jomvu highway is almost finished. Once complete  it will ease the heavy traffic that drivers have faced for years. The 900-metre interchange had been on hold ...,https://www.constructionkenya.com/12797/kwa-jomvu-interchange/,highway,ongoing
Kenya,Construction Kenya,MPs Now Demand Urgent Removal of Asbestos Roofs,2025-10-03,Safe disposal of asbestos with proper gear and containment. (Photo: Courtesy) Over a year after the government demanded the removal of asbestos roofing nationwide within three months  many buildings across Kenya remain covered with the dangerous material. With little done so far  Members of the N...,https://www.constructionkenya.com/12772/mps-demand-removal-asbestos-roofs/,infrastructure,ongoing
Kenya,Construction Kenya,New Vipingo SEZ to Drive Sh390bn in Investor Projects,2025-09-25,President Ruto launches the Vipingo SEZ on Sept. 16  2025. (Photo: Courtesy) The Vipingo Special Economic Zone (SEZ) in Kilifi County has officially opened  signalling a major push in Kenya’s industrial growth. The 2 000-acre hub  located 42 km from Mombasa  is expected to attract Sh390 billion i...,https://www.constructionkenya.com/12765/vipingo-special-economic-zone/,SEZ,completed
Kenya,Construction Kenya,New Setback for Kenya’s Sh337bn High Grand Falls Dam,2025-09-25,A hydropower dam. (Photo: Courtesy) Plans for the long-delayed High Grand Falls Dam along the Tana River have hit another setback after the National Treasury terminated the project in July  citing unspecified regulatory shortcomings in the Project Development Report. The Sh337 billion initiative ...,https://www.constructionkenya.com/12763/high-grand-falls-dam/,port,
