country,source,title,date_iso,summary,url,category,status
Nigeria,Leadership,Ngo-Atlantic-Oyorokoto Road Will Unlock Coastal Prosperity For Rivers – Fubara,2025-10-30,"Rivers State Governor, Sir Siminalayi Fubara, has said the ongoing construction of the brand new 13.52-kilometre Ngo-Atlantic-Oyorokoto Road, will harness the full potential of the state’s blue economy and open up the coastal region for economic growth. The road, being constructed by Monier Construction Company (MCC), cuts through challenging coastal terrain and leads to a […]",https://leadership.ng/ngo-atlantic-oyorokoto-road-will-unlock-coastal-prosperity-for-rivers-fubara/,highway,
Nigeria,Leadership,58th Birthday: Fintiri Donates N30m To Hospital Patients,2025-10-30,"Governor Ahmadu Umaru Fintiri of Adamawa State marked his 58th birthday on Tuesday with a humanitarian gesture, visiting hospital patients in Yola and donating N30 million to support their medical treatment. The Governor announced a donation of N15 million to patients at the Specialist Hospital, Yola, and another N15 million to the endowment fund of […]",https://leadership.ng/58th-birthday-fintiri-donates-n30m-to-hospital-patients/,port,
Nigeria,Leadership,South-East PDP Backs Ogbu For National Woman Leader,2025-10-30,The South-East Zonal Working Committee of the Peoples Democratic Party (PDP) has declared its support for the election of Mrs Chinenyenwa Ogbu as the national woman leader of the party. The zone further clarified that Ogbu is a bona fide member of the party contrary to some reports that she defected to the All Progressives […],https://leadership.ng/south-east-pdp-backs-ogbu-for-national-woman-leader/,port,
Nigeria,Leadership,ADC Backs Dasin-led Interim Executive In Adamawa,2025-10-30,The African Democratic Congress (ADC) has recognised the Barrister Sadiq Dasin-led interim party executive in Adamawa State. The party further asked all party members who were involved in a separate arrangement to have a rethink and follow the path of reconciliation. It further charged the new interim chairman to extend the hand of fellowship to […],https://leadership.ng/adc-backs-dasin-led-interim-executive-in-adamawa/,technology,
Nigeria,Leadership,Global Rights Empowers Kaduna Women For Stronger Community Peacebuilding,2025-10-30,"Global Rights, a peace, justice, and accountability group, has conducted a two-day mentorship workshop for women in Community Dialogue Committees (CDCs) in Kaduna State to enable them to be more effective and efficient in their community peacebuilding roles. The training, which took place in Abuja from 28 to 29 October 2025, focused on building participants’ […]",https://leadership.ng/global-rights-empowers-kaduna-women-for-stronger-community-peacebuilding/,rail,
Nigeria,Leadership,AbdulRazaq Receives Award For Inclusive Governance,2025-10-30,"The governor of Kwara State, Abdulrahman Abdulrazaq, has won the Integrity Governor of the Year Award of the Nigerian Association of Christian Journalists (NACJ). Presenting the award in Ilorin,the association’s president, Dr Charles Okhai, said AbdulRazaq merited recognition for his impressive achievements across many sectors. Okhai said the governor emerged top in the ranking process […]",https://leadership.ng/abdulrazaq-receives-award-for-inclusive-governance/,technology,
Nigeria,Leadership,"Swiss Embassy, Group Donate Toilets, Library To Abuja School",2025-10-30,"In partnership with the Embassy of Switzerland, the Create That Change Development Initiative (CCDI) has commissioned new toilet and library facilities at the LEA Primary School, Sheritti, Kabusa, Abuja. Speaking during the handing-over ceremony yesterday, Sharon Ayeni, the executive director of CCDI, said the gesture was part of the organisation’s Public School Revival Initiative (PSRI), […]",https://leadership.ng/swiss-embassy-group-donate-toilets-library-to-abuja-school/,technology,
Nigeria,Leadership,"Foundation Empowers 100 Widows, Children In Lokoja",2025-10-30,"No fewer than 50 widows and 50 children in Lokoja have benefitted from the empowerment of Veronika Bakoz Charity Foundation. The foundation brought smiles to their faces through a comprehensive skills acquisition and empowerment programme held at Nyamayama, along Ganaja Village in the Kogi State capital. The outreach, which combined humanitarian aid with vocational […]",https://leadership.ng/foundation-empowers-100-widows-children-in-lokoja/,energy,
Nigeria,Leadership,Dependable Vehicular Safety Will Enhance National Security – Vice Chancellor,2025-10-30,"The vice chancellor, Plateau State University (PLASU), Bokkos, Prof Shedrack Best, has advocated for a safe, reliable, dependable vehicular safety and effective management system to enhance national security. Prof. Best stated this in a keynote address presented at the National Conference of Directors and Chief Road Traffic Officers (VIOs) of the Federation, holding at Steffan […]",https://leadership.ng/dependable-vehicular-safety-will-enhance-national-security-vice-chancellor/,highway,
Nigeria,Leadership,Reps Seek Upgrade Of 1st Generation varsities,2025-10-30,"The House of Representatives has urged the Federal Ministries of Education and Finance, the National Universities Commission, the Tertiary Education Trust (TETFund), and Development Partners to work out modalities to refurbish first-generation universities and restore their glory and quality. These include the University of Ibadan (UI), University of Nigeria, Nsuka (UNN) and Ahmadu Bello University, […]",https://leadership.ng/reps-seek-upgrade-of-1st-generation-varsities/,economic,
Nigeria,Leadership,"Unity,  Key To Nigeria’s Progress, Say South West Governors",2025-10-30,"TOPE FAYEHUNSouth West Governors have said unity remains key to Nigeria’s progress, not division. The governors made the remarks in separate speeches at the Southwest Leaders’ Dialogue, which was held at The Dome in Akure, the Ondo State capital. The theme was “Strengthening Democracy through Dialogue: Assessing Progress, Charting the Future.” The Ondo State governor, […]",https://leadership.ng/unity-key-to-nigerias-progress-say-south-west-governors/,technology,
Nigeria,Leadership,"Tax Reforms Promise Inclusionary Growth, Enterprise Resilience For MSMEs",2025-10-30,"Experts have described the ‘Nigeria Tax Administration (NTA) Act 2025,’ as a potential game-changer for Micro, Small and Medium Enterprises (MSMEs), offering broader tax reliefs and fresh incentives designed to ease operational pressures and encourage formalisation, tax filing and documentation for small and medium enterprises (SMEs). According to a partner and tax expert at The […]",https://leadership.ng/tax-reforms-promise-inclusionary-growth-enterprise-resilience-for-msmes-2/,highway,
Nigeria,Leadership,"UNICEF, Partners Organise Quiz Competition to Observe World Polio Day",2025-10-30,"The United Nations Children’s Fund (UNICEF) in collaboration with the Kebbi State Primary Healthcare Development Agency (KBPHCDA) and other implementing partners, has organised a quiz competition among primary and secondary schools in Birnin Kebbi to commemorate World Polio Day. The competition, held at the Emergency Operation Centre (EOC) within the KBPHCDA office complex, aimed to […]",https://leadership.ng/unicef-partners-organise-quiz-competition-to-observe-world-polio-day/,technology,
Nigeria,Leadership,Agric Diversification Way Out Of Nigeria’s Food Crisis — Lawmaker,2025-10-30,"For there to be all-year-round food sufficiency, Nigeria must embrace full diversification into large-scale mechanised agriculture. Chairman of the Akwa Ibom State House of Assembly Committees on Health, Nutrition and Food Security, Hon. Moses Essien, who made this advocacy, has called for the “development of a robust and sustainable agribusiness as a strategic pathway to […]",https://leadership.ng/agric-diversification-way-out-of-nigerias-food-crisis-lawmaker-2/,technology,
Nigeria,Leadership,Fake Spiritualist: EFCC Hands Over Recovered Properties To Fraud Victim,2025-10-30,"Chairman of the Economic and Financial Crimes Commission (EFCC), Mr. Ola Olukoyede has handed over three properties, two exotic vehicles and the sum of N1,100,00.00 recovered as proceeds of crime from one fake spiritualist and advance fee fraudster, Fatai Olalere Alli, (a.k.a. Baba Abore, Baba Osun) by the Advance Fee Fraud Section of the Ibadan […]",https://leadership.ng/fake-spiritualist-efcc-hands-over-recovered-properties-to-fraud-victim/,technology,
Nigeria,Leadership,Gov Radda Unveils Reforms At Nigeria Energy Summit,2025-10-30,"Katsina State governor, Malam Dikko Umaru Radda, has reaffirmed his administration’s commitment to clean energy transformation and sustainable growth, unveiling sweeping energy reforms that position Katsina as a national model for renewable innovation and energy security. Speaking through his deputy, Malam Faruk Lawal Jobe, at the Nigeria Energy Leadership Summit West Africa’s premier energy forum […]",https://leadership.ng/gov-radda-unveils-reforms-at-nigeria-energy-summit/,energy,
Nigeria,Leadership,"Police Rescue 2 Kidnap Victims, Arrest Suspects In Bauchi",2025-10-30,"Bauchi State Police Command has rescued two kidnap victims and arrested two suspects believed to be behind the abduction. According to a statement by the spokesperson of the command, CSP Ahmed Wakil, made available to reporters in Bauchi yesterday, a 32-year-old resident of Wuntin Dada, Bauchi, Mr Stanley Abuchi, had on the 25th October 2025, […]",https://leadership.ng/police-rescue-2-kidnap-victims-arrest-suspects-in-bauchi/,port,
Nigeria,Leadership,Shippers’ Council Decries Foreign Shipping Lines’ Peak Season Surcharges On Africa-bound Cargoes,2025-10-30,The Nigerian Shippers’ Council (NSC) has expressed deep concern over the imposition of Peak Season Surcharges (PSS) and other arbitrary fees by foreign shipping companies on cargoes destined for Africa. Speaking at the two-day Sub-Regional Seminar and Meeting of the Standing Committee on Trade and Transport under the Union of African Shippers’ Councils (UASC) in […],https://leadership.ng/shippers-council-decries-foreign-shipping-lines-peak-season-surcharges-on-africa-bound-cargoes-2/,port,
Nigeria,Leadership,Bauchi Govt Relocates Wunti Market,2025-10-30,"The Bauchi State Executive Council has approved the relocation of Wunti Market and Kasuwan Gwari traders to the Ibrahim Bako area, at the outskirts of Bauchi metropolis, in a move aimed at restoring order, easing congestion and stimulating commercial growth within the metropolis. Commissioner for Cooperatives and SMEs Development, Mohammed Sadeeq Hamisu Shira, disclosed this […]",https://leadership.ng/bauchi-govt-relocates-wunti-market/,rail,
Nigeria,Leadership,"Gov Yusuf Revives Monthly Empowerment Scheme, Disburses N260m To 5,200 Women",2025-10-30,"Governor of Kano State Abba Yusuf has disbursed N260 million to 5,200 indigent women across the 44 local government areas of the state as part of his administration’s renewed monthly empowerment programme aimed at uplifting vulnerable women and boosting grassroots economic activities. Speaking during the ceremony at the coronation hall of the Government House, Kano, […]",https://leadership.ng/gov-yusuf-revives-monthly-empowerment-scheme-disburses-n260m-to-5200-women/,energy,
Nigeria,Leadership,Kebbi Teaching Hospital Treats 500 Cancer Patients,2025-10-30,"The Federal Teaching Hospital (FTH) Birnin Kebbi in Kebbi State has disclosed that it has treated over 500 patients affected by cancer diseases. Acting chairman of Medical Advisory Committee of the Hospital, Dr Muhammad Danyaro Rilwanu disclosed this to journalists yesterday on behalf of the Chief Medical Director of the hospital, Dr Aliyu Hamza Balarabe […]",https://leadership.ng/kebbi-teaching-hospital-treats-500-cancer-patients/,technology,
Nigeria,Leadership,Kebbi Police Warn Against Spreading Fake News On Private Airport,2025-10-30,"The Kebbi State Police Command has strongly condemned a malicious publication circulating on social media, alleging that a retired Assistant Controller of Customs has built a private airport in Argungu Forest to smuggle cocaine and other illicit drugs into Nigeria. The Command categorically refutes the claims, describing them as “baseless, misleading, and orchestrated attempts to […]",https://leadership.ng/kebbi-police-warn-against-spreading-fake-news-on-private-airport/,airport,
Nigeria,Leadership,Forgery Allegation Against Tunji-Ojo Mere Political Noise – Reps,2025-10-30,"The deputy spokesman of the House of Representatives, Hon. Philip Agbese, has described the minister of Interior, Dr Olubunmi Tunji-Ojo, as “not just a super-performing minister, but parliament’s treasured asset.” He therefore, dismissed recent allegations surrounding the former lawmaker’s National Youth Service Corps (NYSC) certificate, saying it is a “mere political noise by enemies of […]",https://leadership.ng/forgery-allegation-against-tunji-ojo-mere-political-noise-reps/,technology,
Nigeria,Leadership,"Assembly Seeks Urgent Action On Rising Insecurity In Shanono, Tsanyawa, Bagwai",2025-10-30,"The Kano State House of Assembly has urged the state government to take swift and decisive action to tackle the growing insecurity in Shanono, Tsanyawa, and Bagwai local government areas. The resolution followed a joint motion of urgent public importance sponsored by members representing Shanono/Bagwai and Ghari/Tsanyawa constituencies during Wednesday’s plenary session presided over by […]",https://leadership.ng/assembly-seeks-urgent-action-on-rising-insecurity-in-shanono-tsanyawa-bagwai/,port,
Nigeria,Leadership,"Bauchi Recruits 3,000 Health Workers",2025-10-30,"In a major push to strengthen healthcare delivery across Bauchi State, Governor Bala Abdulkadir Mohammed has announced the recruitment of 3,000 health workers to boost the manpower base of the sector. The governor made this known while flagging off the renovation of the Bauchi State Specialist Hospital, a massive project estimated to cost over N19 […]",https://leadership.ng/bauchi-recruits-3000-health-workers/,energy,
Nigeria,Leadership,Estate Surveyor Seeks Objective Assessment Of Property,2025-10-30,"An Estate surveyor and valuer, in Kogi State, Zainab Obadaki has stressed the importance of providing an objective assessment of a property’s worth based on a range of factors, saying that it will assist in decision making over property acquisition. According to Obadaki, the Kogi State Property valuation is a cornerstone of the real estate […]",https://leadership.ng/estate-surveyor-seeks-objective-assessment-of-property/,port,
Nigeria,Leadership,"Sanwo-Olu Disburses N2.7b To Over 10,000 Vulnerable Households",2025-10-30,"Lagos State government on Wednesday revealed that at least N2.7 billion has so far been disbursed to over 10,000 vulnerable households in the state under the social interventions, tagged EKO Cares and EKO Listens initiatives of the state Governor, Mr Babajide Sanwo-Olu’s led administration. The initiatives aimed at providing various financial support to assist in […]",https://leadership.ng/sanwo-olu-disburses-n2-7b-to-over-10000-vulnerable-households/,port,
Nigeria,Leadership,"APC Free, Fair Primary  Will Pave Way For Oyebanji’s Victory – Group",2025-10-30,"A political support group, the BAO Grassroots Support for President Bola Tinubu, has said the successful conduct of the primary  in the state has laid a solid foundation for the All Progressives Congress (APC) and its candidate, Ekiti State governor, Mr Biodun Oyebanji, to win the forthcoming governorship in the state. According to the group, […]",https://leadership.ng/apc-free-fair-primary-will-pave-way-for-oyebanjis-victory-group/,port,
