country,source,title,date_iso,summary,url,category,status
Ghana,Citi Newsroom,Ghana has lost a great role model for women — Ofosu-Ampofo mourns Nana Konadu,2025-10-26,Samuel Ofosu-Ampofo  Policy Adviser for Political Affairs at the Office of the Vice President  has eulogised the late former First Lady  Nana Konadu Agyeman-Rawlings  describing her as an enduring symbol of women’s empowerment and political leadership in Ghana. Speaking in an interview with Steph...,https://citinewsroom.com/2025/10/ghana-has-lost-a-great-role-model-for-women-ofosu-ampofo-mourns-nana-konadu/,infrastructure,
Ghana,Citi Newsroom,Minority demands Agric Minister’s briefing over nationwide food glut,2025-10-25,The Minority in Parliament has called for the Minister for Food and Agriculture  Eric Opoku  to be summoned before the House to brief Members on the government’s plans to address the growing food glut across the country. The call comes amid mounting concerns from the Chamber of Agribusiness Ghana...,https://citinewsroom.com/2025/10/minority-demands-agric-ministers-briefing-over-nationwide-food-glut/,infrastructure,planned
Ghana,Citi Newsroom,Sponsors laud successful opening of Northern Business Fair 2025 in Tamale,2025-10-25,The Northern Business Fair opened at Tamale’s Aliu Mahama Sports Stadium to an impressive turnout of exhibitors and visitors. Joana Abombisa  Senior Export Development Officer at the Ghana Export Promotion Authority (GEPA)  described the collaboration with Channel One TV and Citi FM as a “valuabl...,https://citinewsroom.com/2025/10/sponsors-laud-successful-opening-of-northern-business-fair-2025-in-tamale/,port,completed
Ghana,Citi Newsroom,Three dead  several injured in Tatale–Zabzugu road crash,2025-10-25,An accident on the Tatale–Zabzugu road on Friday night  October 24  claimed three lives and left more than ten others injured. According to reports  the crash occurred when a Kia truck with registration number GW-5828-17  carrying traders returning from the Kukpalgu market  collided with a statio...,https://citinewsroom.com/2025/10/three-dead-several-injured-in-tatale-zabzugu-road-crash/,port,
Ghana,Citi Newsroom,KGL Group Chairman Alex Apau Dadey wins Forbes Best of Africa Leadership award,2025-10-26,Alex Apau Dadey  Executive Chairman of KGL Group  has been celebrated with the prestigious Forbes Best of Africa Corporate Leadership and Innovation Award at a high-profile Leadership and Philanthropy Forum held at the House of Lords in London. The award was formally presented by Mark A. Furlong ...,https://citinewsroom.com/2025/10/kgl-group-chairman-alex-apau-dadey-wins-forbes-best-of-africa-leadership-award/,infrastructure,
Ghana,Citi Newsroom,Aglow Int’l mourns Nana Konadu  celebrates her lifelong service to women,2025-10-25,Aglow International has paid glowing tribute to the late former First Lady and President of the 31st December Women’s Movement  Nana Konadu Agyeman Rawlings  describing her as a visionary leader and tireless champion of women’s empowerment. In a statement signed by its National President  Mrs Dor...,https://citinewsroom.com/2025/10/aglow-intl-mourns-nana-konadu-celebrates-her-lifelong-service-to-women/,infrastructure,
Ghana,Citi Newsroom,State must build strong docket before seeking Ofori-Atta’s extradition — Nii Kpakpo Samoa,2025-10-25,Member of the National Democratic Congress (NDC) Legal Team  Nii Kpakpo Samoa Addo  has said the ongoing debate over the possible extradition of former Finance Minister Ken Ofori-Atta from the United States is premature  explaining that the legal requirements for such a process have not yet been ...,https://citinewsroom.com/2025/10/state-must-build-strong-docket-before-seeking-ofori-attas-extradition-nii-kpakpo-samoa/,port,ongoing
Ghana,Citi Newsroom,Gold Coast University introduces six new MBA programmes,2025-10-25,Gold Coast University has unveiled six new Master of Business Administration (MBA) programmes as part of its commitment to meeting the dynamic trade and human capital needs of the 21st-century business environment. The announcement was made by the Chancellor  Bishop Dr Gideon Titi-Ofei  during th...,https://citinewsroom.com/2025/10/gold-coast-university-introduces-six-new-mba-programmes/,infrastructure,
Ghana,Citi Newsroom,Application for employment as none complaint minister,2025-10-25,His Excellency  Warm greetings from an obedient citizen who obeys the law only when the police are watching! I write  with great humility and mild sarcasm  to officially apply for the newly imagined but urgently needed national post  Minister for the None Complaint Economy (M.N.C.E.) Your Excelle...,https://citinewsroom.com/2025/10/application-for-employment-as-none-complaint-minister/,infrastructure,
Ghana,Citi Newsroom,PHOTOS: Entrepreneurs showcase innovation  excellence at Northern Business Fair 2025,2025-10-25,Tamale is buzzing with excitement as residents  exhibitors  and business partners converge at the Tamale Sports Stadium for the grand opening of the Northern Business Fair 2025 today  Saturday  October 25. The two-day fair  which runs from October 25 to 26  is transforming Tamale into a vibrant s...,https://citinewsroom.com/2025/10/photos-entrepreneurs-showcase-innovation-excellence-at-northern-business-fair-2025/,port,
Ghana,Citi Newsroom,Cybersecurity Amendment Bill  2025: 4 Reasons why the Bill may threaten  not safeguard Ghana’s digital space,2025-10-26,The Cybersecurity Authority has come under intense criticism in recent days over the amended Cybersecurity Act  1038. From attempts to gain sweeping control over Ghana’s cyberspace to the controversial 30% levy on industry players  the new amendment raises serious concerns. Here are four reasons ...,https://citinewsroom.com/2025/10/cybersecurity-amendment-bill-2025-4-reasons-why-the-bill-may-threaten-not-safeguard-ghanas-digital-space/,infrastructure,
Ghana,Citi Newsroom,Nana Konadu’s passing a profound national loss – National House of Chiefs,2025-10-25,The National House of Chiefs has expressed profound sorrow over the passing of the former First Lady of Ghana  Nana Konadu Agyeman-Rawlings  describing her as a trailblazer  visionary  and advocate for women’s empowerment. In a statement signed by the Public Relations Officer  Stephen Owusu  on b...,https://citinewsroom.com/2025/10/nana-konadus-passing-a-profound-national-loss-national-house-of-chiefs/,rail,
Ghana,Citi Newsroom,Nana Konadu’s legacy etched in gold — Andrew Appiah Danquah,2025-10-25,Legal Director of the United Party (UP)  Andrew Appiah Danquah  has paid tribute to the late Nana Konadu Agyeman-Rawlings  describing her as a transformational figure whose courage and conviction reshaped Ghana’s political and social landscape. Speaking on The Big Issue on Channel One TV on Satur...,https://citinewsroom.com/2025/10/nana-konadus-legacy-etched-in-gold-andrew-appiah-danquah/,infrastructure,
Ghana,Citi Newsroom,Nana Konadu’s impact unmatched among Ghana’s First Ladies – Baffour Awuah,2025-10-25,The Member of Parliament for Manhyia South  Nana Agyei Baffour Awuah  has paid glowing tribute to the late former First Lady  Nana Konadu Agyeman-Rawlings  describing her as a trailblazer in women’s empowerment and one of the most influential figures in Ghana’s history. Speaking on Channel One TV...,https://citinewsroom.com/2025/10/nana-konadus-impact-unmatched-among-ghanas-first-ladies-baffour-awuah/,rail,
Ghana,Citi Newsroom,Tamale: Excitement builds at Northern Business Fair 2025 as exhibitors offer massive discounts,2025-10-25,The much-anticipated Northern Business Fair 2025 has officially opened at the Tamale Sports Stadium  transforming the city into a buzzing marketplace of innovation  enterprise  and culture. The two-day fair  organised by Channel One TV and Citi FM  has drawn hundreds of exhibitors and thousands o...,https://citinewsroom.com/2025/10/tamale-excitement-builds-at-northern-business-fair-2025-as-exhibitors-offer-massive-discounts/,port,completed
Ghana,Citi Newsroom,Venezuela’s Maduro accuses US of ‘fabricating war’ as it deploys world’s largest warship,2025-10-25,Venezuela’s President Nicolás Maduro has accused the US of “fabricating a new war”  after it ordered the world’s largest warship to be sent to the Caribbean. The USS Gerald R. Ford can carry up to 90 aircraft  marking a significant increase in US firepower in the region. The US has conducted 10 a...,https://citinewsroom.com/2025/10/venezuelas-maduro-accuses-us-of-fabricating-war-as-it-deploys-worlds-largest-warship/,infrastructure,planned
Ghana,Citi Newsroom,Codify chieftaincy customs to safeguard peace – Gonja Overlord to govt,2025-10-25,The Overlord of Gonja  Yagbonwura Bikunuto Jewu Soale I  has called on the government  through the National House of Chiefs  to intensify efforts toward codifying customs  practices  and usages related to chieftaincy successions. He said such clarity would enhance justice  reduce conflicts  and s...,https://citinewsroom.com/2025/10/codify-chieftaincy-customs-to-safeguard-peace-gonja-overlord-to-govt/,infrastructure,
Ghana,Citi Newsroom,Education Minister orders mandatory use of mother tongue in schools,2025-10-25,Minister of Education  Haruna Iddrisu  has directed the Ghana Education Service (GES) to strictly enforce the use of mother tongue instruction in all Ghanaian schools. According to the Education Minister  this directive forms part of efforts to reform the education sector  while promoting the use...,https://citinewsroom.com/2025/10/education-minister-orders-mandatory-use-of-mother-tongue-in-schools/,infrastructure,
Ghana,Citi Newsroom,Northern Business Fair: Regional Minister commends Channel One TV  Citi FM for empowering local entrepreneurs,2025-10-25,The Northern Regional Minister  Ali Adolf  has praised Channel One TV/Citi FM for promoting entrepreneurship and innovation in northern Ghana through the maiden Northern Business Fair in Tamale. Speaking on behalf of the Minister at the opening ceremony on Saturday  25 October  the Municipal Chie...,https://citinewsroom.com/2025/10/northern-business-fair-2025-channel-one-tv-citi-fm-giving-local-businesses-platform-to-shine-reg-minister/,infrastructure,
Ghana,Citi Newsroom,Tamale: DAY 2 of Northern Business Fair [PHOTOS],2025-10-26,The second day of the Northern Business Fair 2025 is underway at the Aliu Mahama Sports Stadium in Tamale  drawing strong participation from exhibitors  entrepreneurs  and business enthusiasts across the northern sector. The first day saw lively crowds and active shopping  with exhibitors offerin...,https://citinewsroom.com/2025/10/tamale-day-2-of-northern-business-fair-photos/,port,ongoing
Ghana,Citi Newsroom,Mahama announces 2% increase in DACF allocation for PWDs,2025-10-24,President John Dramani Mahama has announced an increase in the allocation of disability funds for Persons Living with Disabilities (PWDs) under the District Assemblies Common Fund  from three per cent to five per cent  effective 2026. Speaking during the launch of the Free Tertiary Education Prog...,https://citinewsroom.com/2025/10/mahama-announces-2-increase-in-dacf-allocation-for-pwds/,infrastructure,planned
Ghana,Citi Newsroom,Absa Bank introduces ‘Red Ticket’ for Tidal Rave 2025,2025-10-24,Absa Bank Ghana has partnered with Tidal Rave to offer a limited early-bird “Red Ticket” to festival attendees through its Spark by Absa app. The 2025 edition will run over two days at the La Palm Royal Beach Hotel in Accra  beginning with an invite-only programme on 14 November for VIP and Wild ...,https://citinewsroom.com/2025/10/absa-bank-introduces-red-ticket-for-tidal-rave-2025/,infrastructure,planned
Ghana,Citi Newsroom,GNPC reaffirms commitment to operatorship at Second Annual General Meeting,2025-10-24,The Ghana National Petroleum Corporation (GNPC) has restated its commitment to achieving full operatorship as it continues to strengthen technical competence  institutional resilience  and financial sustainability. This assurance was given at the Corporation’s Second Annual General Meeting (AGM) ...,https://citinewsroom.com/2025/10/gnpc-reaffirms-commitment-to-operatorship-at-second-annual-general-meeting/,infrastructure,
Ghana,Citi Newsroom,Prosecute Ofori-Atta in absentia – Senyo Hosi tells OSP  AG,2025-10-25,The Convenor of the One Ghana Movement  Senyo Hosi  has urged the Special Prosecutor  Kissi Agyebeng  and the Attorney-General  Dr Dominic Ayine  to consider prosecuting former Finance Minister Ken Ofori-Atta in absentia if he is found culpable in any wrongdoing. Speaking on Channel One TV’s The ...,https://citinewsroom.com/2025/10/prosecute-ofori-atta-in-absentia-senyo-hosi-tells-osp-ag/,infrastructure,
Ghana,Citi Newsroom,Interior Minister  Acting Defence Minister must be summoned over Gbinyiri and Sampa clashes – Ntim Fordjour,2025-10-24,The Ranking Member on Parliament’s Defence and Interior Committee  Reverend John Ntim Fordjour  has called for the Minister for the Interior and the Acting Minister for Defence to be summoned before Parliament over recent violent disturbances in Gbinyiri and Sampa. The conflict in Gbinyiri  which...,https://citinewsroom.com/2025/10/interior-minister-acting-defence-minister-must-be-summoned-over-gbinyiri-and-sampa-clashes-ntim-fordjour/,infrastructure,planned
Ghana,Citi Newsroom,Economic Independence of the Sahel: If We Have Our Own Currency  We Have Everything  according to expert,2025-10-24,African experts are increasingly calling for the end of monetary dependence imposed by Paris. One of the most prominent voices in this movement is economist Nicolas Agbohou  author of “The CFA Franc and the Euro Against Africa.” His position remains unequivocal: “In the Francophone zone  the ulti...,https://citinewsroom.com/2025/10/economic-independence-of-the-sahel-if-we-have-our-own-currency-we-have-everything-according-to-expert/,infrastructure,
Ghana,Citi Newsroom,Bank of England Finance Chief Afua Kyei tops list of influential black Britons,2025-10-24,Afua Kyei  the Bank of England’s chief financial officer  has been named the UK’s most influential black person. The 43-year-old is one of the UK’s most senior finance leaders  in charge of the financial governance of the Bank’s £1 trillion balance sheet and funding reforms. The BoE executive dir...,https://citinewsroom.com/2025/10/bank-of-england-finance-chief-afua-kyei-tops-list-of-influential-black-britons/,infrastructure,
Ghana,Citi Newsroom,All roads lead to Tamale as Northern Business Fair 2025 opens today,2025-10-25,Residents  exhibitors  and partners are brimming with anticipation as the Northern Business Fair 2025 prepares to open in Tamale today  Saturday  October 25. All roads will lead to the Tamale Sports Stadium  where the city will host one of Ghana’s most anticipated trade and innovation events from...,https://citinewsroom.com/2025/10/all-roads-lead-to-tamale-as-northern-business-fair-2025-opens-today/,port,planned
Ghana,Citi Newsroom,Ayine: We have evidence of $2m overpayment in DRIP contract,2025-10-24,The Attorney-General and Minister for Justice  Dr Dominic Ayine  has reaffirmed his earlier statements regarding alleged overpayment and financial irregularities involving J.A. Plant Pool (JAPP) Limited in the District Roads Improvement Programme (DRIP) contract. The comments come after J.A. Plan...,https://citinewsroom.com/2025/10/ayine-we-have-evidence-of-2m-overpayment-in-drip-contract/,highway,
Ghana,Citi Newsroom,Govt reimburses fees for 142k first-year students,2025-10-24,The government has reimbursed school fees for 142  440 first-year students enrolled in public tertiary institutions between July and October 2025  under the “No Fees Stress” policy. The Chief Executive Officer of the Students Loan Trust Fund (SLTF)  Dr. Saajida Shiraz  disclosed this during the l...,https://citinewsroom.com/2025/10/govt-reimburses-fees-for-142k-first-year-students/,infrastructure,
Ghana,Citi Newsroom,Police Inspector who killed girlfriend jailed for life,2025-10-24,The Kumasi High Court has sentenced Police Inspector Ahmed Twumasi  popularly known as “Taacum ” to life imprisonment after a seven-member jury  by a 5–2 majority verdict  found him guilty of murder. Inspector Twumasi was convicted for the fatal shooting of his girlfriend  Victoria Dapaah — popul...,https://citinewsroom.com/2025/10/police-inspector-who-killed-girlfriend-jailed-for-life/,infrastructure,
Ghana,Citi Newsroom,Edtech Mondays: EdTech for Special Needs: Inclusive Education for All,2025-10-24,Education is a fundamental right   but for many students with special needs  access to quality learning remains a challenge. As technology continues to transform how we teach and learn  one critical question arises: How can EdTech be harnessed to ensure that every learner  regardless of ability  ...,https://citinewsroom.com/2025/10/edtech-mondays-edtech-for-special-needs-inclusive-education-for-all/,energy,
Ghana,Citi Newsroom,Stronger partnerships key to driving Africa’s Digital transformation – MOBEX Africa CEO,2025-10-24,Chief Executive Officer of MOBEX Africa  George Spencer Quaye  has made a passionate call for stronger partnerships and greater collaboration across the continent to accelerate Africa’s digital transformation over the next decade. He emphasized that African governments must create an enabling env...,https://citinewsroom.com/2025/10/stronger-partnerships-key-to-driving-africas-digital-transformation-mobex-africa-ceo/,infrastructure,
Ghana,Citi Newsroom,Trump says trade talks with Canada ‘terminated’ over anti-tariffs advert,2025-10-24,US President Donald Trump has announced an immediate end to all trade negotiations with Canada over an advert critical of the tariffs he has imposed on the nation. The advert  sponsored by the government of Canada’s province of Ontario  quoted Trump’s predecessor  Ronald Reagan  an icon of US con...,https://citinewsroom.com/2025/10/trump-says-trade-talks-with-canada-terminated-over-anti-tariffs-advert/,infrastructure,planned
Ghana,Citi Newsroom,Investors seek Metro Mass partnership to modernise operations,2025-10-24,Foreign and local investors have expressed strong interest in partnering with Metro Mass Transit Limited (MMTL) to expand its fleet and modernise its infrastructure nationwide. During the maiden Ghana Transport & Logistics Fair 2025 at the World Trade Centre in Accra  investors who visited the co...,https://citinewsroom.com/2025/10/investors-seek-metro-mass-partnership-to-modernise-operations/,port,
Ghana,Citi Newsroom,Children’s act under review to address modern digital realities – Gender Minister,2025-10-24,Minister for Gender  Children and Social Protection  Agnes Naa Momo Lartey  has announced that the ministry is currently reviewing the Children’s Act to reflect the realities of the digital age. According to the Minister  the increased access to digital tools by children necessitates measures to ...,https://citinewsroom.com/2025/10/childrens-act-under-review-to-address-modern-digital-realities-gender-minister/,infrastructure,planned
Ghana,Citi Newsroom,Court adjourns Ofori-Atta vs OSP case to November 25,2025-10-24,The Human Rights Division of the High Court has adjourned to November 25  2025  the case involving former Finance Minister Kenneth Ofori-Atta and the Office of the Special Prosecutor (OSP). The adjournment follows the hearing of two motions on Thursday  October 23  2025. According to an update on...,https://citinewsroom.com/2025/10/court-adjourns-ofori-atta-vs-osp-case-to-november-25/,infrastructure,
Ghana,Citi Newsroom,Bosomtwe: Eight galamseyers arrested for destroying Konkoma basic school park,2025-10-24,National security operatives in the Ashanti Region say they are interrogating eight illegal miners arrested at Kokonma in the Bosomtwe District and indicated they are making extra efforts to identify individuals who spearheaded such activity. Illegal miners have encroached on land designated for ...,https://citinewsroom.com/2025/10/bosomtwe-eight-galamseyers-arrested-for-destroying-konkoma-basic-school-park/,infrastructure,
Ghana,Citi Newsroom,NAIMOS  REGSEC dismantle illegal mining network in Oda River Forest Reserve,2025-10-24,The National Anti-Illegal Mining Operations Secretariat (NAIMOS)  in collaboration with the Ashanti Regional Security Council (REGSEC)  has dismantled a major illegal mining network operating within the Oda River Forest Reserve in the Ashanti Region. The intelligence-led operation  conducted on O...,https://citinewsroom.com/2025/10/naimos-regsec-dismantle-illegal-mining-network-in-oda-river-forest-reserve/,infrastructure,
Ghana,Citi Newsroom,GNCCI renews call for simplified VAT  COVID-19 levy removal,2025-10-24,The Ghana National Chamber of Commerce and Industry (GNCCI) has once again urged government to simplify and consolidate the country’s complex tax regime as part of measures to ease the cost of doing business. The Chamber believes that the introduction of a single  transparent Value Added Tax (VAT...,https://citinewsroom.com/2025/10/gncci-renews-call-for-simplified-vat-covid-19-levy-removal/,infrastructure,
Ghana,Citi Newsroom,Chamber of Licensed Gold Buyers commends GoldBod for transforming artisanal mining  boosting output,2025-10-24,The Chamber of Licensed Gold Buyers (CLGB) has commended the Ghana Gold Board (GoldBod) for its remarkable progress in formalising the artisanal and small-scale mining (ASM) sector. According to the Chamber  GoldBod has ensured a sharp rise in gold production  export earnings and foreign exchange...,https://citinewsroom.com/2025/10/chamber-of-licensed-gold-buyers-commends-goldbod-for-transforming-artisanal-mining-boosting-output/,port,
Ghana,Citi Newsroom,NDC mourns late Nana Konadu Agyeman Rawlings,2025-10-24,The National Democratic Congress (NDC) has expressed deep sorrow following the death of former First Lady Nana Konadu Agyeman Rawlings  describing her as a remarkable woman whose lifelong dedication to women’s empowerment left an indelible mark on Ghana’s history. In a statement signed by the par...,https://citinewsroom.com/2025/10/ndc-mourns-late-nana-konadu-agyeman-rawlings/,infrastructure,
Ghana,Citi Newsroom,Mahama pledges Catholic university  regional hospital for Damongo,2025-10-24,President John Dramani Mahama has announced plans to establish two major projects  the Catholic Science and Technology University and a regional hospital in Damongo in the Savannah Region. The President made the announcement during a courtesy call by the Catholic Metropolitan Archbishop of Tamale...,https://citinewsroom.com/2025/10/mahama-pledges-catholic-university-regional-hospital-for-damongo/,rail,planned
Ghana,Citi Newsroom,Low trust could derail Ghana’s fintech revolution,2025-10-24,Ghana’s growing digital finance ecosystem is facing a major test of confidence as industry experts warn that low levels of public trust could slow down adoption and undermine the country’s financial inclusion agenda. Speaking at the 2025 Fintech Stakeholder Forum in Accra  key players in the fina...,https://citinewsroom.com/2025/10/low-trust-could-derail-ghanas-fintech-revolution/,rail,
Ghana,Citi Newsroom,JA Plant Pool: Alleged $2m overpayment in DRIP contract was a clerical error,2025-10-24,The management of J.A. Plant Pool (Ghana) Limited (JAPP) has attributed the alleged US$2 million overpayment in the District Roads Improvement Programme (DRIP) contract to a clerical error in official documents. The company also dismissed allegations of overpayment  tax evasion  and over-invoicin...,https://citinewsroom.com/2025/10/ja-plant-pool-alleged-2m-overpayment-in-drip-contract-was-a-clerical-error/,highway,
Ghana,Citi Newsroom,BoG must develop formula for digital loan rates – Prof. Quartey,2025-10-24,Ghana’s fast-growing digital lending market  worth billions of cedis in mobile-based loans every month  risks spiraling into instability unless the Bank of Ghana (BoG) steps in to standardize how interest rates are determined across financial technology platforms. To address the phenomenon  Profe...,https://citinewsroom.com/2025/10/bog-must-develop-formula-for-digital-loan-rates-prof-quartey/,infrastructure,
Ghana,Citi Newsroom,‘May the Almighty give her rest’—PAG PAG mourns former First Lady Nana Konadu Agyeman-Rawlings,2025-10-24,The Progressive Alliance for Ghana (PAG) has expressed deep sorrow over the passing of former First Lady  Nana Konadu Agyeman-Rawlings  describing her as a remarkable woman whose contributions to national development and women’s empowerment will be remembered for generations. In a statement signe...,https://citinewsroom.com/2025/10/may-the-almighty-give-her-rest-pag-pag-mourns-former-first-lady-nana-konadu-agyeman-rawlings/,infrastructure,planned
Ghana,Citi Newsroom,Extend ORAL’s mandate to expose more corrupt NPP’s deals – NDC’s Novihoho Afaglo,2025-10-24,The combined team of ORAL and the Attorney General’s Department is doing an important job by revealing the corrupt actions of the previous government  showing that taxpayers’ money intended for development has been misappropriated by corrupt officials of the NPP government. Thanks to ORAL’s dilig...,https://citinewsroom.com/2025/10/extend-orals-mandate-to-expose-more-corrupt-npps-deals-ndcs-novihoho-afaglo/,port,
Ghana,Citi Newsroom,Digital Habits: The Overlooked Key to Secure Banking (Part 3),2025-10-24,Most people imagine that robust technology and strong systems are the main barriers standing between their money and cybercriminals. In reality  the greatest risk to your security often lies in your own daily habits. Cybercriminals are not just targeting complex systems. Increasingly  they are fo...,https://citinewsroom.com/2025/10/digital-habits-the-overlooked-key-to-secure-banking-part-3/,infrastructure,
