country,source,title,date_iso,summary,url,category,status
Ghana,Citi Newsroom,Establishment of Ghana’s first marine protected area: Implications for  fisheries governance  maritime administration and blue economy agenda,2025-10-28,On 7 October 2025  Cabinet approved the establishment of Ghana’s first Marine Protected Area (MPA) — the Greater Cape Three Points MPA — covering approximately 700 square kilometres of coastal and marine waters between Ampatano and Domunli in the Western Region. This bold and historic decision ma...,https://citinewsroom.com/2025/10/establishment-of-ghanas-first-marine-protected-area-implications-for-fisheries-governance-maritime-administration-and-blue-economy-agenda/,port,
Ghana,Citi Newsroom,Entrepreneurs urged to open up businesses for equity investment   ,2025-10-28,Ghanaian entrepreneurs are being urged to open up their businesses to equity investors to attract the resources needed for sustainable expansion and competitiveness. The call comes as access to growth capital continues to hinder many small and medium-sized enterprises (SMEs) from scaling their op...,https://citinewsroom.com/2025/10/entrepreneurs-urged-to-open-up-businesses-for-equity-investment/,infrastructure,
Ghana,Citi Newsroom,Economy stabilises under Mahama  Reserves hit $12 billion — Asiama,2025-10-28,Ghana has made a decisive economic turnaround under the leadership of President John Dramani Mahama  according to the Governor of the Bank of Ghana  Dr. Johnson Asiama. Speaking at the launch of the 60th anniversary of the Ghana Cedi in Accra on Tuesday  October 28  Dr. Asiama highlighted that co...,https://citinewsroom.com/2025/10/economy-stabilises-under-mahama-reserves-hit-12-billion-asiama/,infrastructure,
Ghana,Citi Newsroom,Security forces storm Panbros Salt to help Chinese national claim disputed land,2025-10-28,Armed national security officers and police have stormed Panbros Salt Industries Limited to assist in the seizure of a portion of the company’s salt pans. The land in dispute is reportedly being claimed by a Chinese investor who intends to convert the area into a real estate development. The cont...,https://citinewsroom.com/2025/10/security-forces-storm-panbros-salt-to-help-chinese-national-claim-disputed-land/,port,
Ghana,Citi Newsroom,Fidelity Bank named Bank of the Year at 8th Ghana Business Awards,2025-10-28,Fidelity Bank Ghana  the nation’s largest privately-owned bank  has been crowned Bank of the Year at the prestigious 8th Ghana Business Awards  held on Friday  October 24  2025  at the Kempinski Gold Coast Hotel. In a spectacular sweep that underscores its market leadership  the bank also clinche...,https://citinewsroom.com/2025/10/fidelity-bank-named-bank-of-the-year-at-8th-ghana-business-awards/,infrastructure,
Ghana,Citi Newsroom,GAF warns public of live firing exercise at Bundase Training Camp,2025-10-28,The Ghana Armed Forces has alerted the public  particularly residents of Dawhenya and surrounding areas  about a live firing exercise scheduled at the Bundase Training Camp on Friday  October 31  2025. The Land Combat Fire Power Demonstration Exercise is intended to test the operational readiness...,https://citinewsroom.com/2025/10/gaf-warns-public-of-live-firing-exercise-at-bundase-training-camp/,rail,
Ghana,Citi Newsroom,Building Trust  One Mandate at a Time: Absa’s Perspective on Custody,2025-10-28,Ghana’s capital market is entering a period of rapid evolution. As the needs of institutional investors change  the importance of robust  transparent  and responsive custody services has never been greater. Yet  in a market where many offerings appear similar on the surface  how does Absa Bank Gh...,https://citinewsroom.com/2025/10/building-trust-one-mandate-at-a-time-absas-perspective-on-custody/,port,
Ghana,Citi Newsroom,Regional inequality deepens as Accra attracts 86% of FDI — NDPC,2025-10-28,The National Development Planning Commission (NDPC) has raised concern over the increasing concentration of Ghana’s economic activity and foreign direct investment (FDI) in the Greater Accra Region  describing the trend as a result of weak long-term national planning. Chairman of the NDPC  Dr. Ni...,https://citinewsroom.com/2025/10/regional-inequality-deepens-as-accra-attracts-86-of-fdi-ndpc/,infrastructure,
Ghana,Citi Newsroom,OSP invites DVLA boss over alleged GH¢4m bribe attempt,2025-10-29,The Office of the Special Prosecutor (OSP) has invited the Chief Executive Officer of the Driver and Vehicle Licensing Authority (DVLA)  Julius Neequaye Kotey  for questioning following his public claim that he rejected a GH¢4 million bribe allegedly offered to stop the rollout of the new Digital...,https://citinewsroom.com/2025/10/osp-invites-dvla-boss-over-alleged-gh%c2%a24m-bribe-attempt/,infrastructure,
Ghana,Citi Newsroom,Cedi@60: BoG begins year-long celebration with official launch today ,2025-10-28,The Bank of Ghana will today kick off a year-long celebration marking 60 years of the cedi  the nation’s enduring symbol of economic independence. The official launch of the Cedi@60 commemoration takes place this Tuesday  October 28  at the Accra International Conference Centre  under the theme “...,https://citinewsroom.com/2025/10/cedi60-bog-begins-year-long-celebration-with-official-launch-today/,infrastructure,planned
Ghana,Citi Newsroom,Education Ministry pledges improved classroom conditions through Foundational Learning Tracker,2025-10-28,The Ministry of Education has pledged to improve classroom conditions and increase investments in education to ensure students receive quality learning experiences through the Foundational Learning Action Tracker. Speaking during the launch of the 2025 Foundational Learning Action Tracker  Deputy...,https://citinewsroom.com/2025/10/education-ministry-pledges-improved-classroom-conditions-through-foundational-learning-tracker/,rail,
Ghana,Citi Newsroom,Cedi surges 37% against dollar; BoG vows to maintain stability,2025-10-28,Governor of the Bank of Ghana  Dr. Johnson Asiama  has reaffirmed the central bank’s commitment to implementing sound policies to maintain exchange rate stability and consolidate recent gains. His assurance comes as the Ghana cedi continues its strong rally  appreciating by 37 percent against the...,https://citinewsroom.com/2025/10/cedi-surges-37-against-dollar-bog-vows-to-maintain-stability/,infrastructure,ongoing
Ghana,Citi Newsroom,BoG rolls out tougher anti-money laundering and terrorism financing measures,2025-10-28,The Bank of Ghana (BoG) has rolled out new Anti-Money Laundering  Countering the Financing of Terrorism  and Proliferation Financing (AML/CFT/PF) Guidelines aimed at tightening oversight and ensuring stronger compliance across the financial sector. The move  according to the central bank  forms p...,https://citinewsroom.com/2025/10/bog-rolls-out-tougher-anti-money-laundering-and-terrorism-financing-measures/,infrastructure,
Ghana,Citi Newsroom,BoG confirms weakened Dollar bolstered stability of Cedi,2025-10-28,The Bank of Ghana has confirmed that the recent weakness of the U.S. dollar has provided crucial support to the Ghana Cedi  helping to stabilise the local currency despite ongoing pressures in the domestic foreign exchange market. According to the Central Bank  the U.S. dollar index weakened by a...,https://citinewsroom.com/2025/10/bog-confirms-weakened-dollar-bolstered-stability-of-cedi/,port,ongoing
Ghana,Citi Newsroom,Cedi’s strong rally expected to stabilise as market momentum eases — Databank Research,2025-10-28,Databank Research has projected that the Ghana cedi will maintain relative stability in the coming weeks  supported by sustained foreign exchange inflows and renewed confidence ahead of the national budget presentation. The research firm highlighted that the reclassification of gold as a top-tier...,https://citinewsroom.com/2025/10/cedis-strong-rally-expected-to-stabilise-as-market-momentum-eases-databank-research/,port,planned
Ghana,Citi Newsroom,Govt committed to sustaining Cedi stability – Ato Forson,2025-10-28,The Minister for Finance  Dr. Cassiel Ato Forson  has reaffirmed the government’s unwavering commitment to maintaining the stability of the Ghana cedi and safeguarding the gains achieved in recent months. Speaking at the launch of the 60th anniversary of the Ghana Cedi in Accra on Tuesday  Octobe...,https://citinewsroom.com/2025/10/govt-committed-to-sustaining-cedi-stability-ato-forson/,infrastructure,
Ghana,Citi Newsroom,NDPC aiding Presidency in finalising coordinated dev’t plan – Nii Moi Thompson,2025-10-27,The National Development Planning Commission (NDPC) says it is working closely with the presidency to finalise a coordinated programme of economic and social development policies that will guide the next phase of government planning and implementation. Speaking on The Point of View on Channel One...,https://citinewsroom.com/2025/10/ndpc-aiding-presidency-in-finalising-coordinated-devt-plan-nii-moi-thompson/,infrastructure,planned
Ghana,Citi Newsroom,NDPC publishes first Annual Progress Report in 30 years,2025-10-27,The National Development Planning Commission (NDPC) has  for the first time in three decades  published the government’s Annual Progress Report to provide the public with an accurate picture of national performance across key sectors. Speaking on The Point of View on Channel One TV on Monday  Oct...,https://citinewsroom.com/2025/10/ndpc-publishes-first-annual-progress-report-in-30-years/,port,
Ghana,Citi Newsroom,PAC Chair  DVLA boss clash over data privacy in digital number plate rollout,2025-10-27,The Chairperson of Parliament’s Public Accounts Committee (PAC)  Abena Osei Asare  and the Chief Executive of the Driver and Vehicle Licensing Authority (DVLA)  Julius Neequaye Kotey  were involved in a heated exchange during Monday’s committee sitting over the planned rollout of digital vehicle ...,https://citinewsroom.com/2025/10/pac-chair-dvla-boss-clash-over-data-privacy-in-digital-number-plate-rollout/,infrastructure,planned
Ghana,Citi Newsroom,PAC questions ECG’s quarterly tariff hikes amid financial irregularities,2025-10-29,The Public Accounts Committee (PAC) of parliament has questioned the Electricity Company of Ghana’s (ECG) justification for its constant quarterly upward tariff adjustments  citing significant financial infractions and inefficiencies uncovered in the 2024 Auditor-General’s Report. Electricity tar...,https://citinewsroom.com/2025/10/pac-questions-ecgs-quarterly-tariff-hikes-amid-financial-irregularities/,port,
Ghana,Citi Newsroom,EdTech Monday: Stakeholders push for inclusive tech education,2025-10-27,Disability advocates have called for the adoption of technology-driven solutions to promote inclusive education for children with special needs. Speaking on the Citi Breakfast Show on Monday  October 27  under the theme “EdTech for Special Needs: Inclusive Education for All ” the panelists urged ...,https://citinewsroom.com/2025/10/edtech-monday-stakeholders-push-for-inclusive-tech-education/,infrastructure,
Ghana,Citi Newsroom,Gov’t imposes moratorium on independent biometric systems for MDAs,2025-10-28,The Office of the President has announced a moratorium on the procurement and use of independent biometric Automated Fingerprint Identification Systems (AFIS) by all Ministries  Departments  Agencies (MDAs)  and Metropolitan  Municipal  and District Assemblies (MMDAs). The directive  issued by Se...,https://citinewsroom.com/2025/10/govt-imposes-moratorium-on-independent-biometric-systems-for-mdas/,rail,planned
Ghana,Citi Newsroom,World’s oldest president re-elected in disputed vote in Cameroon,2025-10-27,Cameroon’s president won yet another term on Monday  giving the world’s oldest leader seven more years in office despite allegations of electoral fraud from the opposition. Paul Biya  92  who has ruled the central African nation since 1982  was declared the victor with 53.7 per cent of the vote. ...,https://citinewsroom.com/2025/10/worlds-oldest-president-re-elected-in-disputed-vote-in-cameroon/,infrastructure,
Ghana,Citi Newsroom,E/R: Six perish in tragic crash near Akuse junction,2025-10-27,About six people have reportedly died in a fatal accident involving a Toyota Hiace van with registration number GS 6374-22 on the Kpong–Tema Highway near Akuse Junction in the Lower Manya Krobo Municipality. According to sources  four of the victims died on the spot  while two others were pronoun...,https://citinewsroom.com/2025/10/e-r-six-perish-in-tragic-crash-near-akuse-junction/,port,
Ghana,Citi Newsroom,Don’t announce unapproved policies – Cabinet directs Ministers,2025-10-27,The Office of the Cabinet Secretary has issued a directive reminding all Ministers of State to adhere strictly to established Cabinet procedures before publicly announcing any government policies or programmes. The notice comes in response to a growing trend where some Ministers have announced ma...,https://citinewsroom.com/2025/10/cabinet-directs-ministers-to-seek-approval-before-announcing-policies/,infrastructure,planned
Ghana,Citi Newsroom,GRA officer denies GH¢2 000 extortion allegation; demands GH¢5m defamatory compensation,2025-10-28,A Revenue Officer with the Customs Division of the Ghana Revenue Authority (GRA)  Torgbe Agbeti Dordoe  has firmly denied allegations that he extorted GH₵2 000 from a businessman at the Kotoka International Airport. Torgbe Agbeti Dordoe insists the accusations are unfounded and were only made to ...,https://citinewsroom.com/2025/10/gra-officer-denies-gh%c2%a22000-extortion-allegation-demands-gh%c2%a25m-defamatory-compensation/,port,
Ghana,Citi Newsroom,MG Auto Trading Ghana unveils all-new MG RX9 SUV  announces plans for local assembly,2025-10-28,MG Auto Trading Ghana Ltd.  the exclusive distributor of MG vehicles in Ghana  has unveiled the all-new MG RX9 SUV at a grand ceremony held at the MG/Mac Ghana Spintex Showroom in Accra. The event brought together dignitaries  corporate executives  esteemed customers  and members of the media to ...,https://citinewsroom.com/2025/10/mg-auto-trading-ghana-unveils-all-new-mg-rx9-suv-announces-plans-for-local-assembly/,infrastructure,
Ghana,Citi Newsroom,Gomoa-West District Assembly equips headteachers for school improvement,2025-10-27,The Gomoa West District Assembly has taken a bold step toward strengthening educational leadership with its maiden two-day Leadership and Management Training Workshop held on October 23–24  2025  at the District Assembly Hall at Apam. The workshop  themed “Building Leadership Capacity for School ...,https://citinewsroom.com/2025/10/gomoa-west-district-assembly-equips-headteachers-for-school-improvement/,rail,
Ghana,Citi Newsroom,Brain Hill Int’l School crowned best International School in Ghana,2025-10-27,In a night dedicated to celebrating excellence and impact  Brain Hill International School (BHIS) was honoured as “Best International School in Ghana” at the 8th Ghana Business Awards 2025  held at the Kempinski Gold Coast Hotel in Accra. The award recognises BHIS for its innovative curriculum th...,https://citinewsroom.com/2025/10/brain-hill-intl-school-crowned-best-international-school-in-ghana/,infrastructure,
Ghana,Citi Newsroom,Judge threatens to proceed with Ameyaw-Akumfi’s trial if he is absent again,2025-10-27,The High Court hearing the case involving former Ghana Infrastructure Investment Fund (GIIF) Board Chairman  Prof. Christopher Ameyaw-Akumfi  has warned that the trial will proceed in his absence if he fails to appear with legal representation by Wednesday. Presiding judge  Justice Audrey Kocuvi-...,https://citinewsroom.com/2025/10/judge-threatens-to-proceed-with-ameyaw-akumfis-trial-if-he-is-absent-again/,infrastructure,planned
Ghana,Citi Newsroom,Daboya: Boat Paddler missing after Canoe accident on White Volta,2025-10-27,A man is feared drowned after a canoe capsized on the White Volta at Daboya in the Savannah Region in the early hours of Monday  October 27  2025. Confirming the incident to Citi News   Abdul Rashid Yamusah  Director of the North Gonja District Office of the National Disaster Management Organisat...,https://citinewsroom.com/2025/10/daboya-boat-paddler-missing-after-canoe-accident-on-white-volta/,infrastructure,
Ghana,Citi Newsroom,GNFS rescues two trapped victims in pre-dawn crash at Asankare,2025-10-27,A swift intervention by the Ghana National Fire Service (GNFS) rescue team from the Konongo–Odumase Fire Command saved two passengers who were trapped in a road crash at Asankare in the Asante Akim South Municipality early Saturday morning. The incident occurred around 4:59 a.m. on October 25  20...,https://citinewsroom.com/2025/10/gnfs-rescues-two-trapped-victims-in-pre-dawn-crash-at-asankare/,highway,
Ghana,Citi Newsroom,Akufo-Addo  Sammi Awuku  other NPP leaders to attend high-level democracy forum in Kenya,2025-10-27,Former President Nana Addo Dankwa Akufo-Addo will lead a high-powered Ghanaian delegation to the upcoming Democracy Union of Africa (DUA) and International Democracy Union (IDU) conference in Nairobi  Kenya. The five-day event  scheduled for October 26–30  2025  will bring together political lead...,https://citinewsroom.com/2025/10/akufo-addo-sammi-awuku-other-npp-leaders-to-attend-high-level-democracy-forum-in-kenya/,infrastructure,planned
Ghana,Citi Newsroom,GWOGO Summit 2025 inspires Authentic Living in the Digital Age,2025-10-27,The 2025 Glorious Women on the Go (GWOGO) Summit opened with a bold call for patrons to embrace authenticity and self-awareness in an era dominated by social media and digital validation. The event brought together thought leaders  faith figures  entrepreneurs  women professionals and students to...,https://citinewsroom.com/2025/10/gwogo-summit-2025-inspires-authentic-living-in-the-digital-age/,infrastructure,completed
Ghana,Citi Newsroom,Gunmen kill three  injure two including Radio Presenter in Binduri,2025-10-27,Five people  including a radio presenter  were shot in the Binduri District of the Upper East Region when unidentified gunmen attacked their residence on Sunday  October 26  2025. Three of the victims  including a five-year-old child  died instantly  while two others sustained injuries and were r...,https://citinewsroom.com/2025/10/gunmen-kill-three-injure-two-including-radio-presenter-in-binduri/,infrastructure,
Ghana,Citi Newsroom,Finance Minister to present 2026 Budget November 13,2025-10-27,Finance Minister Dr. Cassiel Ato Forson is expected to present the 2026 Budget Statement and Economic Policy to Parliament on Wednesday  November 13  sources close to the Finance Ministry have confirmed. The proposed date  which awaits formal approval by Parliament  will mark the first full-year ...,https://citinewsroom.com/2025/10/finance-minister-to-present-2026-budget-november-13/,infrastructure,planned
Ghana,Citi Newsroom,Trump raises tariffs on Canadian goods over Reagan advert,2025-10-27,Donald Trump has said he is adding 10% to US tariffs on goods imported from Canada  after the province of Ontario aired an anti-tariff advertisement featuring Ronald Reagan. Calling the advert a “fraud”  the US president lashed out at Canadian officials for not removing it ahead of the World Seri...,https://citinewsroom.com/2025/10/trump-raises-tariffs-on-canadian-goods-over-reagan-advert/,port,
Ghana,Citi Newsroom,Newmont appoints Danquah Addo-Yobo as Ghana Country Manager,2025-10-27,Newmont has announced the appointment of Danquah Addo-Yobo as Country Manager for its Ghana business. The role  which took effect from 1 st October  2025  is part of the strategic realignment of Newmont’s global structure  following the integration of the company’s Africa and Asia-Pacific busines...,https://citinewsroom.com/2025/10/newmont-appoints-danquah-addo-yobo-as-ghana-country-manager/,infrastructure,planned
Ghana,Citi Newsroom,GIPC begins investment roadshows in Volta and Oti Regions,2025-10-27,The Ghana Investment Promotion Centre (GIPC) has begun its Regional Investment Roadshows to promote district-level investment opportunities and boost economic growth across the country. Anchored in the Centre’s Investment Opportunity Mapping Project (IOMP)  the initiative seeks to identify and pr...,https://citinewsroom.com/2025/10/gipc-begins-investment-roadshows-in-volta-and-oti-regions/,port,
Ghana,Citi Newsroom,Gov’t to borrow GH¢75bn from domestic market in Q4,2025-10-27,The Government plans to borrow GH¢75.7 billion from the domestic market between October and December 2025  as part of efforts to meet its public sector financing needs and refinance maturing debts. According to the latest issuance calendar released by the Bank of Ghana  about GH¢67.5 billion of t...,https://citinewsroom.com/2025/10/govt-to-borrow-gh%c2%a275bn-from-domestic-market-in-q4/,infrastructure,planned
Ghana,Citi Newsroom,Funding pressures mount as gov’t falls short of T-Bill target by 30%,2025-10-27,The government’s short-term borrowing efforts came under renewed pressure last week as it missed its Treasury bill target by 30 percent  raising GH¢4.76 billion against a planned GH¢6.82 billion. Data from the Bank of Ghana show that despite the shortfall  all bids submitted were accepted — an in...,https://citinewsroom.com/2025/10/funding-pressures-mount-as-govt-falls-short-of-t-bill-target-by-30/,infrastructure,planned
Ghana,Citi Newsroom,Yango Ghana highlights efforts in transforming ride-hailing  delivery services,2025-10-27,Yango Group  a global technology company  headquartered in Dubai and operating in over 30 countries worldwide has made significant inroads into the Ghanaian market. Since its entry in 2019  Yango has revolutionized urban mobility and logistics  offering innovative solutions that cater to the need...,https://citinewsroom.com/2025/10/yango-ghana-highlights-efforts-in-transforming-ride-hailing-delivery-services/,highway,
Ghana,Citi Newsroom,BoG raises licence renewal fees for foreign exchange bureaux,2025-10-26,The Bank of Ghana has increased the biennial licence renewal fee for all licensed foreign exchange bureaux across the country from GH¢800 to GH¢2 000  representing a 150 percent increase. According to the central bank  the upward review forms part of ongoing regulatory reforms aimed at strengthen...,https://citinewsroom.com/2025/10/bog-raises-licence-renewal-fees-for-foreign-exchange-bureaux/,infrastructure,ongoing
Ghana,Citi Newsroom,Sponsors hail impressive turnout at maiden Northern Business Fair,2025-10-26,As the maiden Northern Business Fair draws to a close in Tamale  sponsors have lauded the event for creating unprecedented exposure and market opportunities for northern-based entrepreneurs. Ecobank Ghana  headline sponsor of the fair  says its involvement reflects a broader commitment to financi...,https://citinewsroom.com/2025/10/sponsors-hail-impressive-turnout-at-maiden-northern-business-fair/,port,
Ghana,Citi Newsroom,Exhibitors celebrate gains  partnerships as Northern Business Fair concludes in Tamale,2025-10-26,Exhibitors at the two-day Northern Business Fair   organised by Channel One TV and Citi FM at the Aliu Mahama Sports Stadium in Tamale  have expressed satisfaction with the successful conclusion of the event. Many participants said the fair met their expectations and called for an extension of it...,https://citinewsroom.com/2025/10/exhibitors-celebrate-gains-partnerships-as-northern-business-fair-concludes-in-tamale/,port,
Ghana,Citi Newsroom,Northern Business Fair: A gateway to new opportunities for Northern Ghana,2025-10-27,The Northern Business Fair 2025 came to a successful close on Sunday  October 26  leaving behind an atmosphere of excitement  optimism  and renewed confidence in the entrepreneurial potential of northern Ghana. Organised by Channel One TV and Citi FM  the two-day fair at the Aliu Mahama Sports St...,https://citinewsroom.com/2025/10/northern-business-fair-a-gateway-to-new-opportunities-for-northern-ghana/,port,
Ghana,Citi Newsroom,Empty luxury apartments signal possible illicit financing – Sir Sam Jonah,2025-10-26,Ghanaian business magnate and Chancellor of the University of Cape Coast  Sir Sam Jonah  has expressed serious concerns about the country’s booming luxury real estate market  suggesting that many high-end developments are being financed through dishonest or illicit means. Pointing to the growing ...,https://citinewsroom.com/2025/10/empty-luxury-apartments-signal-possible-illicit-financing-sir-sam-jonah/,infrastructure,
Ghana,Citi Newsroom,Momentum grows on Day Two of Northern Business Fair in Tamale,2025-10-26,The Northern Business Fair 2025 has entered its second day at the Aliu Mahama Sports Stadium in Tamale  drawing enthusiastic participation from exhibitors  entrepreneurs  and business enthusiasts across the northern sector. The fair  organised by Channel One TV and Citi FM  continues to celebrate...,https://citinewsroom.com/2025/10/momentum-grows-on-day-two-of-northern-business-fair-in-tamale/,port,
Ghana,Citi Newsroom,Don’t panic over food glut – Talensi MP urges farmers,2025-10-25,The Member of Parliament for Talensi  Daniel Dung Mahama  has assured farmers that the government is taking decisive steps to address the ongoing food glut affecting maize and rice producers across the country. His comments come amid growing concerns from the Chamber of Agribusiness Ghana that th...,https://citinewsroom.com/2025/10/dont-panic-over-food-glut-talensi-mp-urges-farmers/,infrastructure,ongoing
