country,source,title,date_iso,summary,url,category,status
Ghana,Ghana News Agency,Omanhene of Denkyira transitions to his ancestral seat of authority today  ,2025-10-29,By Victoria Agyemang  GNA Jukwa (C/R)  Oct 29  GNA – A new chapter is unfolding in Denkyira’s rich history as Odeefo Boa Amponsem IV  the newly enstooled Omanhene (Paramount Chief) of Denkyira  prepares to make his symbolic journey to Abankesieso  near Dunkwa-on-Offin  following his grand enstool...,https://gna.org.gh/2025/10/omanhene-of-denkyira-transitions-to-his-ancestral-seat-of-authority-today/,infrastructure,
Ghana,Ghana News Agency,China tech wave an engine of global prosperity  not a threat,2025-10-30,— Xinhua Commentary Beijing  Oct. 29 (Xinhua/GNA) – China is doubling down on technological innovation to fuel its high-quality development in the next five-year period. This transition is poised to generate significant positive spillovers for global prosperity. In contrast to the narrative of th...,https://gna.org.gh/2025/10/china-tech-wave-an-engine-of-global-prosperity-not-a-threat/,infrastructure,
Ghana,Ghana News Agency,Cocoa-growing communities in Aiyinasi-North connected to national electricity grid  ,2025-10-29,By P. K.Yankey Abidjan (W/R)  Oct. 29  GNA – Six communities in cocoa-growing areas at Aiyinasi-North in the Ellembelle District of the Western Region have been connected to the national electricity grid. The communities are Abidjan  Santokrom  Asoredanho  Anloga  Dotsekrom  and New Adiembra. The...,https://gna.org.gh/2025/10/cocoa-growing-communities-in-aiyinasi-north-connected-to-national-electricity-grid/,energy,
Ghana,Ghana News Agency,Doctors Without Borders ordered to leave Libya by November,2025-10-30,Cairo  Oct 29  (dpa/GNA) – Libyan authorities in Tripoli have ordered the aid organization  Doctors Without Borders (MSF)  to leave the country by November 9  the group said on Wednesday. “No reason has been given to justify our expulsion  and the process remains unclear ” MSF said in a statement...,https://gna.org.gh/2025/10/doctors-without-borders-ordered-to-leave-libya-by-november-2/,infrastructure,
Ghana,Ghana News Agency,WASCAL launches third batch of energy and green hydrogen programme ,2025-10-30,By Hannah Awadzi Accra  Oct. 30  GNA – The Third batch of the International Masters Programme in Energy and Green Hydrogen has been launched on Thursday to explore green hydrogen ideas. Under the programme  about 60 students from the West African sub region are given scholarships to study green H...,https://gna.org.gh/2025/10/wascal-launches-third-batch-of-energy-and-green-hydrogen-programme/,energy,completed
Ghana,Ghana News Agency,Two employees of German subsidiary in the US killed,2025-10-30,New York  Oct 29  (dpa/GNA) – Two Germans have been killed in a violent crime in the US state of Tennessee  local media reported on Wednesday. The German company Barnstorfer Kunststofftechnik (Barku) announced on its website that the victims were employees of a subsidiary. Citing the local police...,https://gna.org.gh/2025/10/two-employees-of-german-subsidiary-in-the-us-killed/,port,planned
Ghana,Ghana News Agency,Bekwai circuit court hands 20-year jail terms to Fiankoma armed robbers,2025-10-29,By Samuel Ofori Boateng Bekwai (Ash)  Oct. 29  GNA – The Bekwai Circuit Court has sentenced three armed robbers to twenty years imprisonment each  for their involvement in a violent highway robbery incident that took place at Fiankoma near Jacobu in the Ashanti Region. The convicts- Peter Boadi  ...,https://gna.org.gh/2025/10/bekwai-circuit-court-hands-20-year-jail-terms-to-fiankoma-armed-robbers/,highway,
Ghana,Ghana News Agency,MP rolls out district-wide eye screening exercise at Ellembelle  ,2025-10-30,By P. K. Yankey  GNA Ampain (W/R)  Oct. 30  GNA – Mr Emmanuel Armah-Kofi Buah  the Member of Parliament (MP) for Ellembelle  has organised a free eye screening exercise across the Ellembelle District to help eliminate cataract disease among the people. The three-week health outreach programme  ai...,https://gna.org.gh/2025/10/mp-rolls-out-district-wide-eye-screening-exercise-at-ellembelle/,infrastructure,
Ghana,Ghana News Agency,Cedi’s strength is a reflection of national confidence  productivity  and partnership-Governor ,2025-10-29,By Morkporkpor Anku Accra  Oct. 29  GNA – Dr Johnson Pandit Asiama  the Governor of the Bank of Ghana  said the Cedi’s strength reflected national confidence  productivity  and partnership. He said with stability  production  and innovation as the guiding pillars  Ghana’s currency could once agai...,https://gna.org.gh/2025/10/cedis-strength-is-a-reflection-of-national-confidence-productivity-and-partnership-governor/,infrastructure,
Ghana,Ghana News Agency,Norway mosque attacker sentenced to 21 years in prison,2025-10-30,Oslo  Oct 29  (dpa/GNA) – A man who killed his stepsister and attacked a mosque in Norway six years ago  has been sentenced to 21 years in prison in a retrial. The Oslo District Court ruled on Wednesday that he is of sound mind  and  according to the NTB news agency  also concluded that a prison ...,https://gna.org.gh/2025/10/norway-mosque-attacker-sentenced-to-21-years-in-prison/,infrastructure,
Ghana,Ghana News Agency,Xi says China  U.S. economic  trade teams reached consensus,2025-10-30,Busan  South Korea  Oct. 30 (Xinhua/GNA) – Chinese President Xi Jinping said here Thursday that economic and trade teams of China and the United States held in-depth talks and reached consensus on solutions to problems. He made the remarks during a meeting with his U.S. counterpart  Donald Trump ...,https://gna.org.gh/2025/10/xi-says-china-u-s-economic-trade-teams-reached-consensus/,infrastructure,
Ghana,Ghana News Agency,Stakeholders call for gender-equitable tax regime in Ghana,2025-10-30,By Francis Ntow Accra  Oct 30  GNA – Stakeholders have called for urgent tax reforms to address gender inequalities  warning that Ghana’s heavy reliance on indirect taxes disproportionately affects low-income households and workers  particularly  women  pushing many into poverty. The stakeholders...,https://gna.org.gh/2025/10/stakeholders-call-for-gender-equitable-tax-regime-in-ghana/,port,
Ghana,Ghana News Agency,Korean Government commits $28 million to support Ghana’s STEM Phase II,2025-10-29,By Benjamin A. Commey Accra  Oct. 29  GNA – The Government of Korea has pledged to inject an additional $28 million to support the second phase of the Science  Technology  Engineering  and Mathematics (STEM) project in Ghana. This commitment follows the successful implementation of the first phas...,https://gna.org.gh/2025/10/korean-government-commits-28-million-to-support-ghanas-stem-phase-ii/,port,
Ghana,Ghana News Agency,Banker charged over church fund theft,2025-10-29,By Joyce Danso Accra  Oct. 29  GNA – A banker has been arraigned before an Accra Circuit Court for allegedly making unauthorised transactions in the bank accounts of the Coptic Orthodox Church. Kwabena Opoku-Acheampong  a relationship officer of a bank (name withheld)  is accused of dishonestly a...,https://gna.org.gh/2025/10/banker-charged-over-church-fund-theft/,infrastructure,
Ghana,Ghana News Agency,Ghana Chamber of Shippers holds pink durbar ,2025-10-30,By Laudia Sawer Tema  Oct. 30  GNA-The Ghana Chamber of Shippers has organised the ‘Maritime Goes Pink Durbar’ as part of awareness creation on breast cancer. The durbar was organised in partnership with the Women’s International Shipping and Trading Association (WISTA-Ghana) and the Women in Mar...,https://gna.org.gh/2025/10/ghana-chamber-of-shippers-holds-pink-durbar/,port,
Ghana,Ghana News Agency,William Kpormatsi supports ‘2025 Avenor Tutudoza’ Football Gala  ,2025-10-29,By Agbaxode Emmanuel  GNA Akatsi (VR)  Oct. 29  GNA – Mr. William Kpormatsi  a businessman and politician  has donated sets of football jerseys and 28 balls towards the upcoming Avenor Tutudoza Football Gala. It forms part of the activities lined up for the Festival celebrations. The Gala would f...,https://gna.org.gh/2025/10/william-kpormatsi-supports-2025-avenor-tutudoza-football-gala/,port,planned
Ghana,Ghana News Agency,NEIP launches Adwumawura programme in Oti Region ,2025-10-29,By Kingsley Mamore Dambai (O/R) Oct 29  GNA- The National Entrepreneurship and Innovation Programme (NEIP) has officially launched its Adwumawura programme in the Oti Region. The programme aims to empower local entrepreneurs  particularly the youth by providing them with the necessary skills  too...,https://gna.org.gh/2025/10/neip-launches-adwumawura-programme-in-oti-region/,energy,completed
Ghana,Ghana News Agency,Government decentralizing mining permits to curb galamsey – Lands Minister  ,2025-10-29,By Emelia B. Addae Koforidua  Oct. 29  GNA – The Ministry of Lands and Natural Resources  through the Minerals Commission  is establishing District Offices to bring mining governance services closer to the people. “Indeed  decentralizing the mining permitting processes will deter people from enga...,https://gna.org.gh/2025/10/government-decentralizing-mining-permits-to-curb-galamsey-lands-minister/,infrastructure,planned
Ghana,Ghana News Agency,NYEP empowers youth,2025-10-29,By Patience Tawiah  GNA Nkwanta (O/R)  Oct. 29  GNA- The National Apprenticeship Programme (NAP) has officially begun in the Nkwanta South Municipality of the Oti Region  aiming to tackle youth unemployment and promote skills development. Already  batik tie-and-dye fabrics produced by local train...,https://gna.org.gh/2025/10/nyep-empowers-youth/,rail,
Ghana,Ghana News Agency,SSNIT to expand  remodel key hotels to boost investment returns – DG discloses,2025-10-30,By Benjamin A. Commey Accra  Oct. 30  GNA – Mr. Kwesi Afreh Biney  the Director-General of the Social Security and National Insurance Trust (SSNIT)  has disclosed plans to expand and remodel some of the Trust’s key hotel investments as part of efforts to enhance returns and strengthen the long-te...,https://gna.org.gh/2025/10/ssnit-to-expand-remodel-key-hotels-to-boost-investment-returns-dg-discloses/,infrastructure,planned
Ghana,Ghana News Agency,Residents await arrival of Boa Amponsem IV at Abankesieso  ,2025-10-29,By Victoria Agyemang Dunkwa-on-Offin(C/R)  Oct 29  GNA- The people of  Dunkwa-on-Offin and its surroundings communities are filled with excitement and anticipation as they prepare to welcome Odeefo Boa Amponsem IV  the newly enstooled Denkyirahene. This follows his successful enstoolment at Jukwa...,https://gna.org.gh/2025/10/residents-await-arrival-of-boa-amponsem-iv-at-abankesieso/,infrastructure,
Ghana,Ghana News Agency,Denkyirahene arrives at Dunkwa amidst wholesome welcome by chiefs and people ,2025-10-30,By Victoria Agyemang  GNA Dunkwa-on-Offin (C/R)  Oct. 30  GNA – The streets of Dunkwa-on-Offin were filled with joy and excitement in the evening of Wednesday  October 29 as the newly enstooled Denkyirahene  Odeefo Boa Amponsem IV  arrived in the traditional capital to a rousing welcome from chie...,https://gna.org.gh/2025/10/denkyirahene-arrives-at-dunkwa-amidst-wholesome-welcome-by-chiefs-and-people/,infrastructure,
Ghana,Ghana News Agency,Tens of thousands evacuated as severe cyclone hits Indian coast,2025-10-29,New Delhi  Oct 29  (dpa/GNA) – Tens of thousands of people were evacuated to temporary shelters  as a severe cyclonic storm made a landfall on India’s south-eastern coast Tuesday. Torrential rains triggered flooding  house collapses and landslides  while winds exceeding 100 kilometres per hour up...,https://gna.org.gh/2025/10/tens-of-thousands-evacuated-as-severe-cyclone-hits-indian-coast/,infrastructure,
Ghana,Ghana News Agency,EC to re-open nominations for District Level Elections,2025-10-29,Accra  Oct 29  GNA – The Electoral Commission of Ghana (EC) is set to reopen nominations for Electoral Areas and Units where no Nomination was filed. A statement signed by Samuel Tettey  Deputy Chairman in charge of Operations and issued on Wednesday  said the decision was in accordance with the ...,https://gna.org.gh/2025/10/ec-to-re-open-nominations-for-district-level-elections/,infrastructure,
Ghana,Ghana News Agency,Youth urged to embrace Web3  blockchain technologies for empowerment ,2025-10-30,By Solomon Gumah Tamale  Oct 30  GNA – Mr Abdul Wahab Osman  Founder and Team Lead  Hive Students Hub Community has urged young people to embrace emerging digital technologies such as Web3 and blockchain as tools for empowerment  innovation  and self-employment. He said platforms such as the HIVE...,https://gna.org.gh/2025/10/youth-urged-to-embrace-web3-blockchain-technologies-for-empowerment/,infrastructure,
Ghana,Ghana News Agency,Headteacher becomes certified Engineer  ,2025-10-29,By Patience Tawiah Nkwanta (O/R)  Oct. 29  GNA-Mr. Thomas Sovor  Headteacher of the Shiare RC Basic School  in the Nkwanta South Municipality of the Oti Region  has been certified as an engineer by  the Ghana Institute of Engineering and Technology (IET-GH). Mr. Sorvor specialises in Civil Engine...,https://gna.org.gh/2025/10/headteacher-becomes-certified-engineer/,infrastructure,
Ghana,Ghana News Agency,Friends of Adaklu to organize one-day workshop for CCPC members  ,2025-10-30,By Emmanuel Nyatsikor Adaklu Waya (V/R)  Oct. 30 GNA – Friends of Adaklu (FOA)  a Non-Governmental Organisation  dedicated to supporting vulnerable children and families is organizing a training workshop for Community Child Protection Committee (CCPC) members in the Adaklu district. The workshop ...,https://gna.org.gh/2025/10/friends-of-adaklu-to-organize-one-day-workshop-for-ccpc-members/,port,
Ghana,Ghana News Agency,Leverage Whistleblower’s Act and report societal ills — Police Commander ,2025-10-30,By Benjamin Akoto  GNA Wenchi (Bono)  Oct. 30  GNA – Superintendent George Kwakye  the Wenchi District Police Commander has urged Ghanaians to leverage the Whistleblower’s Act and report crimes  wrongdoings and corruption-related offences to the police. He said the Whistleblower Act  2006 (Act 72...,https://gna.org.gh/2025/10/leverage-whistleblowers-act-and-report-societal-ills-police-commander/,port,
Ghana,Ghana News Agency,SIGRA  partners hold training workshop for CSOs  WLOs  and partner Assemblies ,2025-10-30,By Michael Foli Jackidy  GNA Ho (V/R)  Oct. 30  GNA – The Strengthening Investment in Gender-Responsive Climate Adaptation (SIGRA) Project  has organised a three-day capacity-building workshop for Civil Society Organisations (CSOs). The training in collaboration with Women in Law and Development ...,https://gna.org.gh/2025/10/sigra-partners-hold-training-workshop-for-csos-wlos-and-partner-assemblies/,rail,
Ghana,Ghana News Agency,District Assemblies urged to work to reduce financial infractions as reported in the Auditor General’s report,2025-10-29,By Charles Tawiah  GNA Nkawie (Ash) Oct 29  GNA –  Ms Shirley Kyei  a member of the Public Accounts Committee (PAC) of Parliament  has called on district  municipal and metropolitan assemblies to work towards reducing the financial infractions captured in the report of the Auditor General. He sai...,https://gna.org.gh/2025/10/district-assemblies-urged-to-work-to-reduce-financial-infractions-as-reported-in-the-auditor-generals-report/,port,
Ghana,Ghana News Agency,Ghana Chamber of Mines Engages Stakeholders on Standardised Land Acquisition Framework,2025-10-29,Accra  Oct. 29  GNA – The Ghana Chamber of Mines has convened a stakeholder meeting aimed at developing a standardised framework to guide land acquisition  utilisation  and compensation within the mining sector. The meeting brought together regulators  mining companies  and community representati...,https://gna.org.gh/2025/10/ghana-chamber-of-mines-engages-stakeholders-on-standardised-land-acquisition-framework/,infrastructure,ongoing
Ghana,Ghana News Agency,I will leave a good legacy – Twifo Hemang DCE ,2025-10-29,By Nana Kwame Essel Twifo Hemang (C/R)  Oct 29  GNA – The District Chief Executive (DCE) for Twifo-Hemang-Lower- Denkyira  Mr Patrick Fiable  has called on residents to disregard false rumours circulating on social media and within the district alleging that he had misappropriated the Disability ...,https://gna.org.gh/2025/10/i-will-leave-a-good-legacy-twifo-hemang-dce/,infrastructure,planned
Ghana,Ghana News Agency,Nigerian jailed 10 years for trafficking 10 victims to Ghana,2025-10-29,By Joyce Danso Accra  Oct. 29  GNA – The Achimota Circuit Court has sentenced Chukwudi Nwachukwu  a 29-year-old Nigerian  to 10 years’ imprisonment for trafficking 10 girls from Nigeria to Ghana for prostitution. The victims  aged between 15 and 18 years  included Nwachukwu’s sister. They were lu...,https://gna.org.gh/2025/10/nigerian-jailed-10-years-for-trafficking-10-victims-to-ghana/,infrastructure,
Ghana,Ghana News Agency,Police rearrest guardian over alleged abuse of seven-year-old girl ,2025-10-30,By Issah Mohammed  GNA Accra  Oct. 30  GNA – The Nima Division of the Domestic Violence and Victims Support Unit (DOVVSU) has rearrested Ayisha Zakaria for allegedly burning the private part of a seven-year-old girl. The 24-year-old suspect was rearrested on Wednesday  less than 48 hours after he...,https://gna.org.gh/2025/10/police-rearrest-guardian-over-alleged-abuse-of-seven-year-old-girl/,port,
Ghana,Ghana News Agency,Nurses warned against wearing uniform to create social media content  ,2025-10-30,By Godfred Aaneamenga Polkuu  GNA Bolgatanga  Oct. 30  GNA – Mrs Philomena Adjoa Nyarkoa Woolley  the Registrar of the Nursing and Midwifery Council (NMC) of Ghana  has cautioned nurses and midwives against the use of uniforms to create social media video or picture contents. The Registrar observ...,https://gna.org.gh/2025/10/nurses-warned-against-wearing-uniform-to-create-social-media-content/,infrastructure,
Ghana,Ghana News Agency,GRA targets GH¢10 billion additional revenue with rollout of modified tax scheme for informal sector,2025-10-30,By Benjamin A. Commey Accra  Oct. 30  GNA – The Ghana Revenue Authority (GRA) has announced plans to mobilise an additional GH¢10 billion in revenue through the rollout of a new Modified Taxation Scheme targeted at the informal sector. The initiative  which is expected to be launched on November ...,https://gna.org.gh/2025/10/gra-targets-gh%c2%a210-billion-additional-revenue-with-rollout-of-modified-tax-scheme-for-informal-sector/,infrastructure,completed
Ghana,Ghana News Agency,Hurricane causes ‘considerable’ damage in Cuba  heads to Bahamas,2025-10-30,Mexico City  Oct 29  (dpa/GNA) – Hurricane Melissa swept across Cuba on Wednesday  causing severe flooding and forcing the evacuation of more than 735 000 people  hours after the powerful storm tore through Jamaica. Videos on social media showed residents wading through nearly knee-deep water in ...,https://gna.org.gh/2025/10/hurricane-causes-considerable-damage-in-cuba-heads-to-bahamas/,energy,
Ghana,Ghana News Agency,Ghana digital and innovation week 2025 begins to champion national digital transformation,2025-10-30,Accra  Oct. 30  GNA – The Ghana Digital and Innovation Week (GDIW) 2025 has officially commenced  marking a nationwide celebration of creativity  technology  and entrepreneurship. Held on the theme “Catalysing Change: Innovation and Digital Transformation at the Centre of Ghana’s Development Agen...,https://gna.org.gh/2025/10/ghana-digital-and-innovation-week-2025-begins-to-champion-national-digital-transformation/,infrastructure,
Ghana,Ghana News Agency,KMA records mixed revenue performance in third quarter,2025-10-29,By Yussif Ibrahim  GNA Kumasi  Oct. 29  GNA – The Kumasi Metropolitan Assembly (KMA) has recorded mixed results in its revenue mobilisation efforts for the third quarter of 2025  with overall collections from its various revenue centers falling below the 75 percent performance benchmark. Presenti...,https://gna.org.gh/2025/10/kma-records-mixed-revenue-performance-in-third-quarter/,rail,
Ghana,Ghana News Agency,Ghana finalises 15-year radioactive waste  spent fuel management policy ,2025-10-30,By Francis Ntow  GNA Accra  Oct 29  GNA – Ghana is in the final stages of adopting a national policy on radioactive waste and spent fuel management after 15 years of its development  as the country positions itself to incorporate nuclear energy into the energy mix by 2030. The policy  to be final...,https://gna.org.gh/2025/10/ghana-finalises-15-year-radioactive-waste-spent-fuel-management-policy/,energy,planned
Ghana,Ghana News Agency,Corporate bodies urged to institutionalise breast cancer screening ,2025-10-30,By Jibril Abdul Mumuni Accra  Oct. 30  GNA – Dr Josef Wewoli-Avereyireh  Senior Medical Officer at the Accra Medical Centre  has called on corporate organisations to institutionalise regular breast cancer screening to promote early detection and save lives. He made the appeal during a breast canc...,https://gna.org.gh/2025/10/corporate-bodies-urged-to-institutionalise-breast-cancer-screening/,infrastructure,
Ghana,Ghana News Agency,Gold industry contributes over $88 billion to Ghana’s GDP in 2024-Veep ,2025-10-30,By Dennis Peprah Afrisipakrom  (Ahafo)  Oct. 30  GNA -The gold industry contributed $88.1 billion to the nation’s Gross Domestic Products in 2024  the Vice President Professor Jane Nana Opoku-Agyemang said on Thursday. She said as at August 2025  the sector had added $11.2 billion to the GDP  say...,https://gna.org.gh/2025/10/gold-industry-contributes-over-88-billion-to-ghanas-gdp-in-2024-veep/,infrastructure,
Ghana,Ghana News Agency,Remorseful former king of Spain admits past mistakes,2025-10-30,Berlin  Oct 29  (dpa/GNA) – Spain’s former king Juan Carlos  has admitted to having “disappointed” many people in a review of his life. He fell victim to his own “misjudgements out of love and friendship ” the French newspaper Le Monde reported on Wednesday  citing the 87-year-old’s biography. Th...,https://gna.org.gh/2025/10/remorseful-former-king-of-spain-admits-past-mistakes/,port,
Ghana,Ghana News Agency,EPA bans fabrication  importation  sale and use of ‘Chanfan’ machines,2025-10-30,Accra  Oct. 30  GNA – The Environmental Protection Authority (EPA) has issued a directive prohibiting the fabrication  importation  sale  and use of “Chanfan” machines in Ghana  citing severe environmental destruction caused by their use on river mining activities. The Authority said several work...,https://gna.org.gh/2025/10/epa-bans-fabrication-importation-sale-and-use-of-chanfan-machines/,port,
Ghana,Ghana News Agency,Journalists urged to build open-source intelligence skills to strengthen investigative reporting,2025-10-29,By Eric Appah Marfo  GNA Accra  Oct. 29  GNA – Madam Karen Allen  a former BBC Foreign Correspondent and Open-Source Intelligence (OSINT) Specialist  has urged journalists to develop OSINT skills to enhance the quality and depth of investigative reporting in the digital age. She said OSINT inform...,https://gna.org.gh/2025/10/journalists-urged-to-build-open-source-intelligence-skills-to-strengthen-investigative-reporting/,port,
Ghana,Ghana News Agency,GIPC to host regional investment roadshow in Oti ,2025-10-29,By Kingsley Mamore  GNA Dambai (O/R)  Oct 29  GNA – The Ghana Investment Promotion Centre (GIPC)  in collaboration with the Oti Regional Coordinating Council (ORCC)  is set to host the regional investment roadshow on Thursday  October 30  at Bosatsu Hotel  in Dambai. The event aims to promote sus...,https://gna.org.gh/2025/10/gipc-to-host-regional-investment-roadshow-in-oti/,highway,
Ghana,Ghana News Agency,Female inclusion key to building fair  secure digital space — TAG International ,2025-10-30,By Eric Appah Marfo Accra  Oct. 29  GNA – Madam Francesca Quirke  Gender Equality and Social Inclusion Specialist at TAG International  a global security and resilience consultancy  has called for balanced female representation at the decision-making table on cybersecurity issues to promote a fai...,https://gna.org.gh/2025/10/female-inclusion-key-to-building-fair-secure-digital-space-tag-international/,energy,
Ghana,Ghana News Agency,Cedi@60: Mahama hails BoG for reaffirming its commitment to monetary stability,2025-10-29,By Iddi Yire  GNA Accra  Oct 29  GNA – As Ghanaians celebrate 60 years of their national currency  President John Dramani Mahama has commended the Bank of Ghana (BoG) for reaffirming its commitment to monetary stability and economic prosperity. The President in a statement said that was what his ...,https://gna.org.gh/2025/10/cedi60-mahama-hails-bog-for-reaffirming-its-commitment-to-monetary-stability/,infrastructure,
Ghana,Ghana News Agency,Vice-President calls for value addition to sustain Cedi stability,2025-10-29,By Morkporkpor Anku  GNA Accra  Oct. 29  GNA – Vice President Professor Naana Jane Opoku-Agyemang says Ghana’s economy is being reset to ensure stability and long-term growth built on discipline  hard work and trust from people and institutions. She said through prudent expenditure cuts  strength...,https://gna.org.gh/2025/10/vice-president-calls-for-value-addition-to-sustain-cedi-stability/,infrastructure,
Ghana,Ghana News Agency,Ghana’s Black Queens rout Egypt to qualify for 2026 WAFCON,2025-10-29,By Simon Asare Accra  Oct 29  GNA  – Ghana’s Black Queens cruised into the 2026 Women’s Africa Cup of Nations (WAFCON) with a 4-0 win over Egypt in the second leg of their qualifier at Accra Sports Stadium on Tuesday. The result gave Ghana a 7-0 aggregate victory  following a 3-0 win in the first...,https://gna.org.gh/2025/10/ghanas-black-queens-rout-egypt-to-qualify-for-2026-wafcon/,port,
