country,source,title,date_iso,summary,url,category,status
Ghana,Ghana News Agency,Adum murder case: Inspector Ahmed Twumasi gets life imprisonment  ,2025-10-24,By Muyid Deen Suleman ‎Kumasi  Oct. 24  GNA – A high court in Kumasi has sentenced Inspector Ahmed Twumasi alias “Tycoon ” a police officer  to life imprisonment for the gruesome murder of his 26-year-old girlfriend  Victoria Dapaah  also known as Maa Adwoa  at Adum. ‎The court found Inspector Tw...,https://gna.org.gh/2025/10/adum-murder-case-inspector-ahmed-twumasi-gets-life-imprisonment/,infrastructure,
Ghana,Ghana News Agency,Nneka Youth Foundation  partners mark International Girl-Child Day ,2025-10-24,By Frank Kwame Abbor Kpetoe (V/R)  Oct. 24  GNA – SheSpeaks Forum  an affiliate of the Nneka Youth Foundation  a not-for-profit youth-oriented organisation has marked the International Day of the Girl-Child at the Agotime Senior High School in the Agotime Ziope District in the Volta Region The st...,https://gna.org.gh/2025/10/nneka-youth-foundation-partners-mark-international-girl-child-day/,infrastructure,
Ghana,Ghana News Agency,Wamfie District Court remands three illegal miners ,2025-10-24,By Dennis Peprah Wamfie  (Bono)  Oct. 24  GNA-The Wamfie District Magistrate Court in the Dormaa East District of the Bono Region has remanded three suspected illegal miners in Police custody. The suspects  Moses Ayando 30 years  Joseph Akuwaaya 32 years and John Akanboei 34 years appeared before...,https://gna.org.gh/2025/10/wamfie-district-court-remands-three-illegal-miners/,infrastructure,
Ghana,Ghana News Agency,Stop chasing galamsey wealth  invest in education – Queen mother urges youth  ,2025-10-24,By Samuel Ofori Boateng Manso Dadease (Ash)  Oct. 24  GNA – Nana Akosua Asantewaa  queen mother of Manso Dadease  in the Amansie South District  has urged the youth to be interested in their education to enable them to play a meaningful role in national development. Speaking at the inauguration o...,https://gna.org.gh/2025/10/stop-chasing-galamsey-wealth-invest-in-education-queen-mother-urges-youth/,infrastructure,planned
Ghana,Ghana News Agency,Biakoye District Assembly distributes relief items to PWDs  ,2025-10-24,By Kingsley Mamore Dambai (O/R) Oct. 24  GNA- The Biakoye District Assembly in the Oti Region  has distributed relief items to 87 Persons with Disabilities (PWDs) in the area. The initiative  supported by the central government through PWDs Common Fund  provided cash  refrigerators  fufu machines...,https://gna.org.gh/2025/10/biakoye-district-assembly-distributes-relief-items-to-pwds/,port,
Ghana,Ghana News Agency,STMA gets GHS 13 million DACF for projects  ,2025-10-24,By Mildred Siabi-Mensah Sekondi   Oct. 22  GNA – The Government through the District Assemblies Common Fund  (DACF) has released some 13  167  736 million cedis for development projects within the three constituencies of the Sekondi-Takoradi Metropolitan Assembly (STMA) The Assembly   has therefo...,https://gna.org.gh/2025/10/stma-gets-ghs-13-million-dacf-for-projects/,rail,
Ghana,Ghana News Agency,IFED Global to host Africa Youth Festival in Accra  ,2025-10-24,Accra  Oct. 24  GNA-Innovation for Empowerment and Development (IFED Global) will bring together young people from across the African continent for the transformative Africa Youth Festival. The festival  which will mark the 10th anniversary of IFED  is scheduled for November 5 to 9  2025  at the ...,https://gna.org.gh/2025/10/ifed-global-to-host-africa-youth-festival-in-accra/,infrastructure,planned
Ghana,Ghana News Agency,Central Regional Minister  National Security move to halt sand winning at Gomoa Fetteh  ,2025-10-24,By Prince Acquah Gomoa Fetteh (C/R)  Oct 23  GNA –The Central Regional Security Council has declared war on sand winners at Gomoa Fetteh in the Gomoa East District of the Central Region to avert a catastrophe  waiting to explode along the coastal stretch of the district. Many coastal settlements ...,https://gna.org.gh/2025/10/central-regional-minister-national-security-move-to-halt-sand-winning-at-gomoa-fetteh/,infrastructure,
Ghana,Ghana News Agency,Teachers  school children at Odomase undergo training on cyber-security ,2025-10-24,By Christopher Tetteh GNA Odomase  (Bono)  Oct. 24  GNA-Teachers and school children at the Odomase Model School and Presbyterian Junior High School in the Sunyani West Municipality have undergone a three-day training on digital space and cyber-security. The Africa Rural Internet and STEM Initiat...,https://gna.org.gh/2025/10/teachers-school-children-at-odomase-undergo-training-on-cyber-security/,rail,
Ghana,Ghana News Agency,Businesses boom in Ho as SHS freshers report to campuses  ,2025-10-24,By Frank Kwame Abbor Ho  Oct. 24  GNA – Economic activity around major Senior High Schools (SHSs) in Ho has surged as first-year students report to campus for the 2025/2026 academic year  with tricycle operators  food vendors  and photographers cashing in on the busy period. At Ola Girls Senior H...,https://gna.org.gh/2025/10/businesses-boom-in-ho-as-shs-freshers-report-to-campuses/,port,
Ghana,Ghana News Agency,2026 WAFCON Qualifiers: Black Queens secure resounding win over Egypt in first leg,2025-10-24,By Simon Asare  GNA Accra  Oct. 24  GNA – The Black Queens of Ghana delivered an impressive performance to secure a decisive 3-0 victory over Egypt in the first leg of their 2026 Africa Women’s Cup of Nations (WAFCON) qualifier  played on Thursday in Ismailia. Ghana took a deserved lead just befo...,https://gna.org.gh/2025/10/2026-wafcon-qualifiers-black-queens-secure-resounding-win-over-egypt-in-first-leg/,infrastructure,
Ghana,Ghana News Agency,Belgium confirms its support for Morocco’s Autonomy Plan for The Sahara,2025-10-24,Accra  Oct 24  GNA-Belgium has expressed its support for the autonomy Initiative presented by Morocco in 2007  placing the Sahara region “within the framework of the Kingdom’s sovereignty and national unity ” stressing that it will act “as of now on diplomatic and economic plans in line with this...,https://gna.org.gh/2025/10/belgium-confirms-its-support-for-moroccos-autonomy-plan-for-the-sahara/,port,planned
Ghana,Ghana News Agency,Stronger voices  healthier futures: Empowering Ghana’s young women against HIV,2025-10-24,By Muniratu Akweley Issah Accra  Oct. 24  GNA – Stakeholders in Ghana’s HIV response have renewed calls for stronger human rights-based and gender-sensitive approaches to empower young women and adolescent girls in the country’s fight against HIV/AIDS. The call was made at a three-day workshop or...,https://gna.org.gh/2025/10/stronger-voices-healthier-futures-empowering-ghanas-young-women-against-hiv/,infrastructure,
Ghana,Ghana News Agency,Ghana’s energy transition plan gains momentum ,2025-10-24,Albert Oppong-Ansah Accra  Oct. 24  GNA – The Ministry of Energy and Green Transition has announced that the establishment of a National Renewable Energy Agency is progressing steadily  with operations expected to commence by mid-2026. Dr Robert B. M. Sogbadji  Deputy Director for Power at the Mi...,https://gna.org.gh/2025/10/ghanas-energy-transition-plan-gains-momentum/,energy,planned
Ghana,Ghana News Agency,GNCCI calls on government to enhance effort to generate revenue from property tax ,2025-10-24,By Morkporkpor Anku Accra  Oct. 24  GNA- The Ghana National Chamber of Commerce and Industry (GNCCI) has called on the government to enhance effort to generate revenue from property tax leveraging on Property Address System and other digital tools. This should include enhancing the capacity of th...,https://gna.org.gh/2025/10/gncci-calls-on-government-to-enhance-effort-to-generate-revenue-from-property-tax/,infrastructure,
Ghana,Ghana News Agency,Ghana must act swiftly to secure competitiveness of its local firms-GNCCI ,2025-10-24,By Morkporkpor Anku Accra  Oct. 24  GNA- The Ghana National Chamber of Commerce and Industry (GNCCI) says Ghana must act swiftly to secure the competitiveness of its local firms. Mr Stephane Miezan  the President of the GNCCI  said this must be done especially in an era marked by rising global tr...,https://gna.org.gh/2025/10/ghana-must-act-swiftly-to-secure-competitiveness-of-its-local-firms-gncci/,infrastructure,
Ghana,Ghana News Agency,Damango to host Catholic Science and Technology University – President Mahama ,2025-10-24,By Iddi Yire Accra  Oct 24  GNA – President John Dramani Mahama has announced that Damongo  the Savannah Regional Capital  will host two major projects  a Catholic Science and Technology University and a Regional Hospital that will serve as a teaching facility. A statement issued by the Presidenc...,https://gna.org.gh/2025/10/damango-to-host-catholic-science-and-technology-university-president-mahama/,energy,planned
Ghana,Ghana News Agency,Mahama declares three days of national mourning for Nana Konadu Agyeman-Rawlings  ,2025-10-24,By Iddi Yire Accra  Oct 24  GNA – President John Dramani Mahama has declared three days of national mourning in honour of former First Lady Nana Konadu Agyeman-Rawlings. A Government statement directed that flags should fly at half-mast nationwide to honour her service in women’s empowerment  chi...,https://gna.org.gh/2025/10/mahama-declares-three-days-of-national-mourning-for-nana-konadu-agyeman-rawlings/,infrastructure,
Ghana,Ghana News Agency,Residents appeal for rehabilitation of Awudome Kofe–Agortime Kofe Road ,2025-10-24,By Daniel Agbesi Latsu Kadjebi (O/R)  Oct. 24  GNA – Residents of Awudome Kofe  Aziage Kofe  Kpando Kofe  and other adjoining communities in the Kadjebi District of the Oti Region have appealed to the government and the Kadjebi District Assembly to rehabilitate the Awudome Kofe–Agortime Kofe road...,https://gna.org.gh/2025/10/residents-appeal-for-rehabilitation-of-awudome-kofe-agortime-kofe-road/,highway,
Ghana,Ghana News Agency,Volta Regional Minister commends President Mahama for prioritising Keta Port Project ,2025-10-24,By Evans Worlanyo Ameamu Keta (VR) Oct 24  GNA- Mr. James Gunu  the Volta Regional Minister  has commended President John Dramani Mahama for prioritising the Keta Port project. According to him  the project would be a game-changer that would provide numerous economic benefits and opportunities fo...,https://gna.org.gh/2025/10/volta-regional-minister-commends-president-mahama-for-prioritising-keta-port-project/,port,
Ghana,Ghana News Agency,Nanumba South NCCE sensitises women groups on fight against corruption ,2025-10-24,By Solomon Gumah Wulensi (N/R)  Oct. 24  GNA – The National Commission for Civic Education (NCCE) in the Nanumba South District of the Northern Region has organised a town hall meeting at Wulensi to sensitise women groups and other stakeholders on the need to actively participate in the fight aga...,https://gna.org.gh/2025/10/nanumba-south-ncce-sensitises-women-groups-on-fight-against-corruption/,infrastructure,
Ghana,Ghana News Agency,Bono Regional Police Command intensifies peace efforts at Sampa ,2025-10-24,By Regina Benneh Sunyani  (Bono)  Oct. 24  GNA-The Bono Regional Police Command has engaged faith-based organisations at Sampa in the Jaman North District of the Bono Region with a call on them to support in sustaining peace and stability in the area. The Sampa Township has been experiencing recu...,https://gna.org.gh/2025/10/bono-regional-police-command-intensifies-peace-efforts-at-sampa/,port,
Ghana,Ghana News Agency,Volta Region advances budget hearings to strengthen fiscal discipline  development planning ,2025-10-24,By Michael Foli Jackidy Dzodze (V/R)  Oct 24  GNA – The Volta Regional 2026–2029 Composite Budget Hearings have entered their second day  following a successful opening session in the Ho West District on Monday. The latest session took place in Ketu North  bringing together representatives from M...,https://gna.org.gh/2025/10/volta-region-advances-budget-hearings-to-strengthen-fiscal-discipline-development-planning/,infrastructure,
Ghana,Ghana News Agency,CEO of MobileMoney LTD urges balanced regulation for digital finance growth,2025-10-24,Accra  Oct. 24  GNA-Ghana’s financial technology industry has reached a decisive moment where regulation must evolve in tandem with innovation to ensure that new digital financial products foster economic growth while safeguarding consumers  the Chief Executive Officer of MobileMoney LTD (MML)  M...,https://gna.org.gh/2025/10/ceo-of-mobilemoney-ltd-urges-balanced-regulation-for-digital-finance-growth/,infrastructure,
Ghana,Ghana News Agency,Experts push BoG on unified open banking API infrastructure,2025-10-24,Accra  Oct. 24  GNA-A strong case is emerging for Ghana to adopt common open banking API standards to accelerate financial inclusion  foster innovation  and improve digital service delivery across the financial ecosystem. An Open Banking API is a secure way for banks and other financial instituti...,https://gna.org.gh/2025/10/experts-push-bog-on-unified-open-banking-api-infrastructure/,infrastructure,
