country,source,title,date_iso,summary,url,category,status
Ghana,Ghana News Agency,Volta Region to host regional  district farmers’ day ahead of National Day  ,2025-10-28,By Michael Foli Jackidy  GNA Ho (V/R)  Oct. 28  GNA – The Volta Regional Minister  Mr James Gunu  has announced that the Regional and District Farmers’ Day celebrations will take place one week ahead of the National Farmers’ Day event. This  he said  would ensure that farmers in the region derive...,https://gna.org.gh/2025/10/volta-region-to-host-regional-district-farmers-day-ahead-of-national-day/,infrastructure,planned
Ghana,Ghana News Agency,Keta Municipal Assembly adjudged 10th best in Volta  ,2025-10-28,By Evans Worlanyo Ameamu Keta (VR) Oct. 28  GNA-The Keta Municipal Assembly (MA) has been adjudged 10th in the latest ranking for the first Quarter Performance for 2025 evaluation metrics  among 18 districts in the Volta Region. This information was displayed on a table showing district rankings ...,https://gna.org.gh/2025/10/keta-municipal-assembly-adjudged-10th-best-in-volta/,infrastructure,
Ghana,Ghana News Agency,Ghanaian electronic importers encouraged to liase with Energy Commission  ,2025-10-28,By Mildred Siabi-Mensah Takoradi  Oct. 28  GNA – Ghanaian Electronics importers have been advised to liase with the Energy Commission  to ensure the procurement of the right products that meet the approved standards. They are also to become aware of the various Ghana IEC/ISO standards to promote ...,https://gna.org.gh/2025/10/ghanaian-electronic-importers-encouraged-to-liase-with-energy-commission/,port,planned
Ghana,Ghana News Agency,Guardian allegedly burns child over bedwetting; case withdrawn under pressure  ,2025-10-28,By Issah Mohammed Accra  Oct. 28  GNA – Ayisha Zakaria  a 24-year-old guardian  has allegedly inflicted burns on the private part and inner thighs of a seven-year-old girl for bedwetting. Eyewitnesses said the suspect  a resident of Mamobi in the Ayawaso North Municipality  allegedly heated a met...,https://gna.org.gh/2025/10/guardian-allegedly-burns-child-over-bedwetting-case-withdrawn-under-pressure/,infrastructure,
Ghana,Ghana News Agency,PALI Ghana Alumni supports mothers of children with Cerebral Palsy  ,2025-10-28,Accra  Oct. 28  GNA – The Pan-African Leadership Institute (PALI) Ghana Alumni  with generous contributions from members  has made cash donation to support members of the Cerebral Palsy Ghana in Accra. The Group also donated a range of essential items  detergents  toiletries  adult diapers  bedsh...,https://gna.org.gh/2025/10/pali-ghana-alumni-supports-mothers-of-children-with-cerebral-palsy/,port,
Ghana,Ghana News Agency,NCCE engages women’s groups at North East Gonja on fight against corruption  ,2025-10-28,By Solomon Gumah Fuu (S/R)  Oct. 28  GNA – The North East Gonja District Directorate of the National Commission for Civic Education (NCCE) has organised an educational campaign for women groups at Fuu in the Savannah Region. It was to enhance their understanding of the rule of law and empower the...,https://gna.org.gh/2025/10/ncce-engages-womens-groups-at-north-east-gonja-on-fight-against-corruption/,infrastructure,
Ghana,Ghana News Agency,Twifo Attorkrom residents call for immediate fixing of their bad roads ,2025-10-28,By Nana Kwame Essel Twifo Attorkrom (C/R)  Oct. 28  GNA- Residents of Twifo Attorkrom in the Twifo- Atti-Morkwa District of the Central Region  have expressed deep frustration over the deplorable condition of their road  describing it as a “death trap.” This is because  the current usage of the r...,https://gna.org.gh/2025/10/twifo-attorkrom-residents-call-for-immediate-fixing-of-their-bad-roads/,highway,
Ghana,Ghana News Agency,Mini Hogbetsotso festival celebrated in Adidome to deepen Ewe unity ,2025-10-28,By Kekeli K. Blamey  GNA Adidome (VR)  Oct. 28  GNA — The Anlo Dukor Council  in collaboration with the Mafi Traditional Council  has celebrated a Mini Hogbetsotso festival at Adidome in the Central Tongu District of the Volta Region  to strengthen unity among Ewe-speaking communities and promoti...,https://gna.org.gh/2025/10/mini-hogbetsotso-festival-celebrated-in-adidome-to-deepen-ewe-unity/,infrastructure,
Ghana,Ghana News Agency,CaFGOAG  Regional Maritime University engages on sustainable fisheries collaboration ,2025-10-28,By Laudia Sawer  GNA Nungua  Oct. 28  GNA — The Canoe and Fishing Gear Owners Association of Ghana (CaFGOAG) has engaged the Regional Maritime University (RMU)  to explore areas of collaboration aimed at strengthening capacity building  research  and innovation in the small-scale fisheries sector...,https://gna.org.gh/2025/10/cafgoag-regional-maritime-university-engages-on-sustainable-fisheries-collaboration/,port,
Ghana,Ghana News Agency,Reddington beach resort to host Volta economic forum on October 31 ,2025-10-28,By Evans Worlanyo Ameamu Whuti (VR) Oct. 28  GNA – Reddington Beach Resort in Whuti in the Anloga district is set to host the much-anticipated Volta Economic Forum  the Hogbetsotsoza edition on Friday  October 31. The forum is being organise by the Volta Corridor Investment Centre  in collaborati...,https://gna.org.gh/2025/10/reddington-beach-resort-to-host-volta-economic-forum-on-october-31/,infrastructure,
Ghana,Ghana News Agency,GhIS advocates value engineering to curb infrastructure budget overruns,2025-10-28,By Isaac Arkoh Cape Coast  Oct. 28  GNA – The Ghana Institution of Surveyors (GhIS) has called for the immediate integration of Value Engineering as a game-changing strategy to revolutionise the efficiency and impact of Ghana’s infrastructure projects. Highlighting its transformative potential  G...,https://gna.org.gh/2025/10/ghis-advocates-value-engineering-to-curb-infrastructure-budget-overruns/,infrastructure,
Ghana,Ghana News Agency,CSA reaffirms commitment to safeguarding Ghana’s digital space  ,2025-10-28,Accra  Oct. 28  GNA – The Cyber Security Authority (CSA) Monday reaffirmed its commitment to working with national and international partners to build a safe  informed  and accountable digital space in Ghana. Mr Divine Selase Agbeti  the Acting Director-General of CSA  in a speech read on his beh...,https://gna.org.gh/2025/10/csa-reaffirms-commitment-to-safeguarding-ghanas-digital-space/,infrastructure,
Ghana,Ghana News Agency,Ghana launches $200 million rooftop solar initiative under Paris Agreement  ,2025-10-28,By Edward Acquah  GNA Accra  Oct. 28  GNA – Ghana Tuesday launched the National Clean Energy Programme (NCEP)  a $200 million initiative to expand rooftop solar photovoltaic (PV) systems nationwide. The programme  jointly implemented by the Ministry of Energy and Green Transition (MoEnGT)  the En...,https://gna.org.gh/2025/10/ghana-launches-200-million-rooftop-solar-initiative-under-paris-agreement/,energy,completed
Ghana,Ghana News Agency,Assembly member demands citizen involvement in fee-fixing process ,2025-10-28,By Opesika Tetteh Puplampu Ada Foah  Oct. 27  GNA – Mr Ebenezer Nartey  the Assembly Member for the Zongo Electoral Area in the Ada East District  has called for greater transparency  accountability  and citizen participation in the 2026 fee-fixing and composite budget process of district assembl...,https://gna.org.gh/2025/10/assembly-member-demands-citizen-involvement-in-fee-fixing-process/,infrastructure,
Ghana,Ghana News Agency,ACUC calls on African states to vote against economic blockade on Cuba ,2025-10-28,By Laudia Sawer Tema  Oct. 28  GNA-The AfriKan Continental Union Consult (ACUC) has called on African states to vote firmly once again against the United States economic blockade on Cuba. In a statement signed by Dr. Benjamin Anyagre Aziginaateeg  the Chief Executive Officer of ACUC  and copied t...,https://gna.org.gh/2025/10/acuc-calls-on-african-states-to-vote-against-economic-blockade-on-cuba/,infrastructure,
Ghana,Ghana News Agency,Early Power Limited donates medical supplies to Bediako CHPS Compound ,2025-10-28,By Isaac Newton Tetteh Bediako  Oct. 28  GNA-Early Power Limited  an independent power producer operating within the Kpone-Katamanso Municipality  has donated assorted medical supplies and consumables to the Bediako Community-Based Health Planning and Services (CHPS) Compound in the Nmlitsakpo El...,https://gna.org.gh/2025/10/early-power-limited-donates-medical-supplies-to-bediako-chps-compound/,infrastructure,planned
Ghana,Ghana News Agency,Seventeen school girls impregnated in Banda District within nine months ,2025-10-28,By Dennis Peprah Banda-Ahenkro  (Bono)  Oct. 28  GNA – The Banda District Directorate of Education in the Bono Region recorded 17 cases of pregnancies among school girls in the area between January and September 2025. Comparatively  Madam Alimatu Amadu  the Banda District Girl Child Education Coo...,https://gna.org.gh/2025/10/seventeen-school-girls-impregnated-in-banda-district-within-nine-months/,energy,
Ghana,Ghana News Agency,ASHMA partners Venture Capital Trust Fund to train business owners in Ashaiman ,2025-10-28,By Isaac Newton Tetteh Ashaiman  Oct. 28  GNA-The Ashaiman Municipal Assembly (ASHMA)  in collaboration with the Venture Capital Trust Fund (VCTF)  has commenced a three-day capacity-building workshop for business owners and entrepreneurs in the Ashaiman municipality to enhance their operational ...,https://gna.org.gh/2025/10/ashma-partners-venture-capital-trust-fund-to-train-business-owners-in-ashaiman/,rail,
Ghana,Ghana News Agency,TDC moves to collect revenue from defaulting companies ,2025-10-28,By Laudia Sawer  GNA Tema  Oct. 28  GNA-The TDC Ghana Limited  led by its Managing Director  Mr Courage Nunekpeku  and management staff  is embarking on a massive revenue collection drive from companies and other establishments that have defaulted for years in paying off their ground rent. The es...,https://gna.org.gh/2025/10/tdc-moves-to-collect-revenue-from-defaulting-companies/,infrastructure,
Ghana,Ghana News Agency,Vice-President Launches Cedi@60 Celebrations  Renews Call for Fiscal Discipline and Economic Sovereignty,2025-10-28,Accra  Oct. 28  GNA – Vice President Naana Jane Opoku-Agyemang has called for sound governance  transparent policies and citizen responsibility to maintain trust in the economy and the cedi. Addressing a gathering of dignitaries  economists  students  and citizens at the launch of Cedi @60 annive...,https://gna.org.gh/2025/10/vice-president-launches-cedi60-celebrations-renews-call-for-fiscal-discipline-and-economic-sovereignty/,infrastructure,
Ghana,Ghana News Agency,Women  PwDs empowered to influence local governance in Northern Region ,2025-10-28,By Solomon Gumah Tamale  Oct. 28  GNA – A total of 50 women leaders and persons with disabilities (PwDs) from the Nanumba South  Kumbungu  and Mion Districts have benefited from a leadership and governance training aimed at strengthening their participation in local decision-making processes. The...,https://gna.org.gh/2025/10/women-pwds-empowered-to-influence-local-governance-in-northern-region/,rail,
Ghana,Ghana News Agency,OMSU 2005  2000 Year Groups give back to Mawuli and Community ,2025-10-28,By Frank Kwame Abbor Ho  Oct. 28  GNA – Two decades on  2005 Old Mawuli Students Union (OMSU) have refurbished Mawuli School’s ICT lab with new facilities  while 2000 OMSU group also supported Ho Female Prison and renovated the school’s historic “White Block” to mark their milestone anniversaries...,https://gna.org.gh/2025/10/omsu-2005-2000-year-groups-give-back-to-mawuli-and-community/,port,
Ghana,Ghana News Agency,GTA Deputy Director honoured for outstanding support to Accra Arts and Crafts Market  2025,2025-10-28,By Hafsa Obeng Accra  Oct. 28  GNA – Mr. Kofi Atta Kakra Kusi  Deputy Director  Corporate Affairs  Ghana Tourism Authority (GTA)  has been honoured for his exceptional support and contributions to the International Edition of the Accra Arts and Crafts Market. The honour  which came during a Gala ...,https://gna.org.gh/2025/10/gta-deputy-director-honoured-for-outstanding-support-to-accra-arts-and-crafts-market-2025/,port,
Ghana,Ghana News Agency,Chief appeals for extension of electricity to Abi community in Berekum West   ,2025-10-28,By Benjamin Asomah Abi  (Bono)  Oct. 28  GNA – Nana Oppong Taa Senti  the Chief of Abi  a farming community in the Berekum West District of the Bono Region has appealed for extension of electricity to the area. He said extension of electricity would open up the area  create job opportunities  and...,https://gna.org.gh/2025/10/chief-appeals-for-extension-of-electricity-to-abi-community-in-berekum-west/,port,
Ghana,Ghana News Agency,Let’s ensure ethical use of emerging technologies to advance Africa’s digital transformation ‐ CSA boss ,2025-10-28,By Benjamin A. Commey Accra  Oct. 28  GNA – Mr. Divine Selassie Agbeti  the Director-General of the Cyber Security Authority (CSA)  has urged African countries to adopt and use emerging technologies responsibly to ensure sustainable digital transformation across the continent. He said emerging te...,https://gna.org.gh/2025/10/lets-ensure-ethical-use-of-emerging-technologies-to-advance-africas-digital-transformation-%e2%80%90-csa-boss/,infrastructure,
Ghana,Ghana News Agency,Free health screening wraps up Odwira Festival in Akropong-Akuapem  ,2025-10-28,By Samuel Yaokumah Akropong-Akuapem (E/R)  Oct. 28  GNA – The Oseadeeyo Kwasi Akuffo Foundation (OKWAF)  in collaboration with the Ministry of Youth Development and Empowerment (MoYDE)  has organised a free health screening session in Akropong-Akuapem to conclude a week-long celebration of the Od...,https://gna.org.gh/2025/10/free-health-screening-wraps-up-odwira-festival-in-akropong-akuapem/,infrastructure,
Ghana,Ghana News Agency,Young talents shine bright at Young and Loud Fest25 Auditions ,2025-10-28,By Frank Kwame Abbor Ho  Oct. 28  GNA –Young and Loud Fest25 auditions at GNAT Executive Hall showcased an explosion of youthful creativity  energy  and talent. The event brought together dozens of young performers eager to prove themselves on stage  transforming the venue into a hub of artistic ...,https://gna.org.gh/2025/10/young-talents-shine-bright-at-young-and-loud-fest25-auditions/,infrastructure,
Ghana,Ghana News Agency,Tourism Minister reaffirms support for creative and beauty industries  ,2025-10-28,By Hafsa Obeng Accra  Oct. 28  GNA – Madam Abla Dzifa Gomashie  Minister of Tourism  Culture and Creative Arts  has reaffirmed government’s commitment to empowering Ghana’s creative  tourism  and beauty industries. Speaking at the ninth Ghana Beauty Awards (GBA)  organised by Make-Up Ghana in Acc...,https://gna.org.gh/2025/10/tourism-minister-reaffirms-support-for-creative-and-beauty-industries/,port,
Ghana,Ghana News Agency,Fourth edition of Transport  Haulage and Road Safety conference set for November 18 ,2025-10-28,Accra  Oct. 28  GNA – The fourth edition of the Transport  Haulage and Road Safety (THROSA) Conference and Exhibition will bring together stakeholders to address issues concerning climate action in the transport sector  infrastructure financing  technology and public safety. Scheduled for Novembe...,https://gna.org.gh/2025/10/fourth-edition-of-transport-haulage-and-road-safety-conference-set-for-november-18-2/,port,planned
Ghana,Ghana News Agency,Trader remanded for alleged attempted human trafficking ,2025-10-28,By Joyce Danso  GNA Accra  Oct. 28  GNA – The Dansoman Circuit Court has remanded a trader into police custody for allegedly attempting to engage in human trafficking. Victoria Ogbonna  a 33-year-old Nigerian national residing in Bogoso  pleaded not guilty to the charge of “attempt to commit crim...,https://gna.org.gh/2025/10/trader-remanded-for-alleged-attempted-human-trafficking/,infrastructure,
Ghana,Ghana News Agency,Two arraigned for alleged visa fraud involving GHC45 000 ,2025-10-28,By Joyce Danso  GNA Accra  Oct. 28  GNA – Two persons have been arraigned before an Accra Circuit Court for allegedly defrauding a trader under the pretext of securing a Canadian visa. Isaac Abaidoo  a social worker  and Florence Mensah  a trader  have been jointly charged with conspiracy to comm...,https://gna.org.gh/2025/10/two-arraigned-for-alleged-visa-fraud-involving-ghc45000/,infrastructure,
Ghana,Ghana News Agency,Fidelity Bank invests GHS1 million to scale 16 Climate-Smart Enterprises,2025-10-28,Accra  Ghana – 28 th October 2025 – Fidelity Bank Ghana  in partnership with Innohub  has successfully concluded the second edition of the GreenTech Innovation Challenge (GTIC)  reaffirming its commitment to climate-smart finance and the strategic role of technology in ensuring food and economic ...,https://gna.org.gh/2025/10/fidelity-bank-invests-ghs1-million-to-scale-16-climate-smart-enterprises/,infrastructure,
Ghana,Ghana News Agency,100 000 Euros AYA Innovation Challenge launched to transform digital healthcare,2025-10-28,Accra  Oct 28  GNA – AYA-Integrated Healthcare Initiative has launched the AYA Innovation Challenge  a national call for digital health innovators to design solutions that empower Ghanaians for better self-management of non-communicable diseases (NCDs). The Challenge seeks to identify entrepreneu...,https://gna.org.gh/2025/10/100000-euros-aya-innovation-challenge-launched-to-transform-digital-healthcare/,infrastructure,completed
Ghana,Ghana News Agency,Ukraine’s Zelensky warns of wider drone  missile attacks on Russia,2025-10-27,Kiev  Oct 27  (dpa/GNA) – Ukrainian President  Volodymyr Zelensky  warned on Monday that Kiev plans to expand its drone and missile strikes to additional Russian regions. “The capabilities for long-range strikes are a component of our independence  and will be the most important component in guar...,https://gna.org.gh/2025/10/ukraines-zelensky-warns-of-wider-drone-missile-attacks-on-russia/,port,planned
Ghana,Ghana News Agency,Tourism Minister highlights guest experience as key to industry growth ,2025-10-27,By Hafsa Obeng  GNA Accra  Oct. 27  GNA – Madam Abla Dzifa Gomashie  Minister of Tourism  Culture and Creative Arts  has emphasised the importance of exceptional guest experiences in advancing Ghana’s tourism and hospitality industry. Speaking at the 50th Anniversary Symposium of the Ghana Hotels...,https://gna.org.gh/2025/10/tourism-minister-highlights-guest-experience-as-key-to-industry-growth/,port,
Ghana,Ghana News Agency,KMA and Rotary Club offer free breast and prostate cancer screening for market women ,2025-10-27,By Samuel Ofori Boateng Kumasi Oct. 27  GNA – The Kumasi Metropolitan Assembly (KMA)  in collaboration with the Rotary Club of Kumasi Premier International  has organised a free breast and prostate cancer screening exercise for traders at the Asafo Market in Kumasi. The outreach programme  which ...,https://gna.org.gh/2025/10/kma-and-rotary-club-offer-free-breast-and-prostate-cancer-screening-for-market-women/,rail,
Ghana,Ghana News Agency,ADDRO screens  sensitises 241 women and men for breast cancer ,2025-10-27,By Gilbert Azeem Tiroog Chiana (U/E)  Oct. 27  GNA – The Anglican Diocesan Development and Relief Organisation (ADDRO)  in collaboration with the Ghana Health Service (GHS)  has screened and sensitised 241residents in the Chiana Sub-District of the Kassena Nankana West District for breast cancer....,https://gna.org.gh/2025/10/addro-screens-sensitises-241-women-and-men-for-breast-cancer/,infrastructure,
Ghana,Ghana News Agency,Fourth edition of  Transport  Haulage and Road Safety conference set for November 18,2025-10-27,Accra  Oct. 27  GNA – The fourth edition of the Transport  Haulage and Road Safety (THROSA) Conference and Exhibition will bring together stakeholders to address issues concerning climate action in the transport sector  infrastructure financing  technology and public safety. Scheduled for Novembe...,https://gna.org.gh/2025/10/fourth-edition-of-transport-haulage-and-road-safety-conference-set-for-november-18/,port,planned
Ghana,Ghana News Agency,Open defecation: Kadjebi residents urged to construct household latrines,2025-10-27,By Daniel Agbesi Latsu  GNA Kadjebi (O/R)  Oct. 27  GNA – Mr. Fred Ackah  a Senior Environmental Health Assistant  has called on residents of the Kadjebi District to construct household latrines as a key intervention to improve sanitation and eliminate open defaecation. He said the construction a...,https://gna.org.gh/2025/10/open-defecation-kadjebi-residents-urged-to-construct-household-latrines/,water,
Ghana,Ghana News Agency,Bawumia  the best for NPP flagbearer for 2028-Council of Elders ,2025-10-27,By Dennis Peprah Sunyani  (Bono)  Oct. 27  GNA – Mr. James Kofi Kyeremeh  the Chairman of the Bono Regional Council of Elders of New Patriotic Party (NPP)  says the solid economic background makes the former Vice President Alhaji Mahamudu Bawumia the best flagbearer aspirant for the NPP in the El...,https://gna.org.gh/2025/10/bawumia-the-best-for-npp-flagbearer-for-2028-council-of-elders/,infrastructure,
Ghana,Ghana News Agency,Government announces GHS75.70 billion treasury issuance for Q4 2025 ,2025-10-27,By Jibril Abdul Mumuni Accra  Oct. 27  GNA – The Government  through the Bank of Ghana (BoG)  has announced plans to issue GHS75.70 billion in treasury securities from October to December 2025. The issuance forms part of a broader strategy to revitalise the domestic capital market and enhance pre...,https://gna.org.gh/2025/10/government-announces-ghs75-70-billion-treasury-issuance-for-q4-2025/,highway,planned
Ghana,Ghana News Agency,AgriCentric Ventures wins GreenTech Innovation Challenge 2025,2025-10-27,Accra  Oct. 27  GNA – Kumasi-based AgriCentric Ventures Limited has been adjudged the winner of 2025 GreenTech Innovation Challenge  an initiative by Fidelity Bank Ghana in partnership with the Innohub Foundation to promote sustainable  technology-driven agribusinesses. AgriCentric  which transfo...,https://gna.org.gh/2025/10/agricentric-ventures-wins-greentech-innovation-challenge-2025/,infrastructure,
Ghana,Ghana News Agency,Parents applaud Education Minister’s directive for stricter discipline,2025-10-27,By Evans Worlanyo Ameamu  GNA Keta (VR) Oct 27  GNA – Some parents in Keta municipality of the Volta Region have expressed their support for stronger disciplinary codes in Senior High Schools (SHSs) to address issues of indecent dressing and behaviour. This comes after Mr. Haruna Iddrisu  the Edu...,https://gna.org.gh/2025/10/parents-applaud-education-ministers-directive-for-stricter-discipline/,port,
Ghana,Ghana News Agency,Education must liberate the mind — Togbe Afede ,2025-10-27,By Frank Kwame Abbor  GNA Ho  Oct. 27  GNA – Togbe Afede XIV  the Agbogbomefia of Asogli State  has urged students to view education as a lifelong journey of liberation  creativity  and service to humanity. He stressed that true learning must empower the head  the heart and the hand. Speaking as ...,https://gna.org.gh/2025/10/education-must-liberate-the-mind-togbe-afede/,infrastructure,
Ghana,Ghana News Agency,SWFA holds forum in Tamale to promote sustainable agribusiness for women ,2025-10-27,By Solomon Gumah  GNA Tamale  Oct 27  GNA – The Savannah Women Farmers Association (SWFA) has held a forum in Tamale to strengthen the capacity of women farmers and promote their active participation in sustainable agriculture and agribusiness in Northern Region. The forum  organised under the Fo...,https://gna.org.gh/2025/10/swfa-holds-forum-in-tamale-to-promote-sustainable-agribusiness-for-women/,infrastructure,
Ghana,Ghana News Agency,BoG revises forex bureau licence renewal fee to GHS2 000 ,2025-10-27,By Jibril Abdul Mumuni Accra  Oct. 27  GNA – The Bank of Ghana (BoG) has revised the biennial licence renewal fee for all licensed Foreign Exchange Bureaux (FEBs) from GHS500 to GHS2 000. The central bank announced the adjustment in a public notice dated October 24  2025  stating that the revisio...,https://gna.org.gh/2025/10/bog-revises-forex-bureau-licence-renewal-fee-to-ghs2000/,infrastructure,planned
Ghana,Ghana News Agency,Kofi Yeboah donates books to Miaso Krobo D/A Basic School  ,2025-10-27,Accra  Oct. 27  GNA-A communication lecturer at Wisconsin International University College  Ghana  Mr Kofi Yeboah  has donated about 700 basic school books to Miaso Krobo D/A Basic School  in the Fanteakwa North District  in the Eastern Region. The books  including textbooks for Basic 1 – 9 and s...,https://gna.org.gh/2025/10/kofi-yeboah-donates-books-to-miaso-krobo-d-a-basic-school/,infrastructure,
Ghana,Ghana News Agency,NHIS Challenges stem from software providers  not funding — Mahama Ayariga ,2025-10-27,By Godwill Arthur-Mensah Accra  Oct.27  GNA- Majority Leader Mahama Ayariga has said the persistent challenges facing Ghana’s National Health Insurance Scheme (NHIS) are not due to a lack of funding. Rather  he said they stemmed from issues with software providers managing Scheme’s digital infras...,https://gna.org.gh/2025/10/nhis-challenges-stem-from-software-providers-not-funding-mahama-ayariga-2/,infrastructure,planned
Ghana,Ghana News Agency,Lions International District 418 organises free eye screening for drivers in Accra  ,2025-10-27,By Patrick Ofoe Nudzi Accra  Oct. 27  GNA – Lions International District 418 has organised free eye screening for close to 300 drivers  drivers’ mates and traders operating at the Tema Station and 37 Lorry Station in Accra. The screening exercise is in line with one of their global courses (areas...,https://gna.org.gh/2025/10/lions-international-district-418-organises-free-eye-screening-for-drivers-in-accra/,infrastructure,
