country,source,title,date_iso,summary,url,category,status
Ghana,Ghana News Agency,Residents lament power outage in Sogakope ,2025-10-27,By Kekeli K. Blamey Sogakope (VR)  Oct. 27  GNA – Residents and business operators in Sogakope and its adjoining communities have expressed frustration over a prolonged power outage that disrupted economic activities and daily life. The outage  which started on Sunday  October 26  2025  has affec...,https://gna.org.gh/2025/10/residents-lament-power-outage-in-sogakope/,infrastructure,
Ghana,Ghana News Agency,Foundation supports students of Sogakope D.A Basic school with sanitary pads ,2025-10-27,By Evans Worlanyo Ameamu Sogakope (VR) Oct 27  GNA-The Ewe Loyalty Foundation  a non-government organisation  has supported the Sogakope D. A Basic ‘B’ school in the South Tongu District of the Volta Region with sanitary pads. The significant move was to promote menstrual health and hygiene among...,https://gna.org.gh/2025/10/foundation-supports-students-of-sogakope-d-a-basic-school-with-sanitary-pads/,port,
Ghana,Ghana News Agency,North Tongu District emerges Second Best in Volta Region ,2025-10-27,By Kekeli K. Blamey Battor (V/R)  Oct. 27  GNA – The North Tongu District has been adjudged the second-best performing district in the Volta Region following the 2024 Quarter Four and 2025 Quarter One Monitoring and Evaluation exercise conducted by the Volta Regional Coordinating Council (VRCC). ...,https://gna.org.gh/2025/10/north-tongu-district-emerges-second-best-in-volta-region/,infrastructure,
Ghana,Ghana News Agency,Tap local capital market for future port expansions – Asaki Awingobit urges government   ,2025-10-27,By Benjamin A. Commey Accra  Oct. 27  GNA – Mr. Samson Asaki Awingobit  the Executive Secretary of the Importers and Exporters Association of Ghana  has urged the government to explore local funding options for future port infrastructure projects  such as the proposed Keta port. He suggested that...,https://gna.org.gh/2025/10/tap-local-capital-market-for-future-port-expansions-asaki-awingobit-urges-government/,port,planned
Ghana,Ghana News Agency,Former North Tongu DCE Osborn Fenu dies in road accident ,2025-10-27,By Kekeli K. Blamey Miotso  Oct. 27  GNA –Mr Osborn K. Divine Fenu  the immediate past District Chief Executive (DCE) of North Tongu  has reportedly died in a road accident that occurred on Sunday  October 26  2025. According to family sources  the former DCE was travelling to Accra after visitin...,https://gna.org.gh/2025/10/former-north-tongu-dce-osborn-fenu-dies-in-road-accident/,port,
Ghana,Ghana News Agency,TUC  stakeholders renew urgent call for Ghana to ratify ILO Convention 190 on workplace violence,2025-10-27,By Jibril Abdul Mumuni Accra  Oct. 24  GNA– The Trades Union Congress (TUC)  in collaboration with key social partners and stakeholders  has renewed its call on Government of Ghana to expeditiously ratify the International Labour Organisation (ILO) Convention 190 (C190). The call was the central ...,https://gna.org.gh/2025/10/tuc-stakeholders-renew-urgent-call-for-ghana-to-ratify-ilo-convention-190-on-workplace-violence/,infrastructure,
Ghana,Ghana News Agency,ECG Women In Engineering inspires their young into engineering,2025-10-27,By Jibril Abdul Mumuni Accra  Oct. 25  GNA – The Women in Engineering (WinE) wing of the Electricity Company of Ghana (ECG) is embarking on a nationwide drive to demystify Science  Technology  Engineering and Mathematics (STEM) as a male preserve to inspire girls to pursue careers in that area. T...,https://gna.org.gh/2025/10/ecg-women-in-engineering-inspires-their-young-into-engineering/,energy,
Ghana,Ghana News Agency,Dzodze marks 2025 Oil Palm festival; leaders emphasise unity  economic transformation ,2025-10-27,By Michael Foli Jackidy Dzodze (V/R)  Oct. 27  GNA – Mr Eric Edem Agbana  Member of Parliament for Ketu North  has reaffirmed his commitment to transforming Dzodze into a vibrant economic hub. “My vision is to make Dzodze a dynamic city where business activities  jobs  and economic opportunities ...,https://gna.org.gh/2025/10/dzodze-marks-2025-oil-palm-festival-leaders-emphasise-unity-economic-transformation/,port,
Ghana,Ghana News Agency,Stanbic Bank Affluent Team Champions Youth Empowerment at Mobole Leadership Forum ,2025-10-27,Accra  Oct. 27  GNA-Stanbic Bank Ghana’s Affluent Banking Team  in partnership with the Nneka Youth Foundation  hosted a Business Leadership Forum at Mobole D/A Basic School in the Ningo-Prampram district. The event brought together students  parents  and community members to explore leadership  ...,https://gna.org.gh/2025/10/stanbic-bank-affluent-team-champions-youth-empowerment-at-mobole-leadership-forum/,infrastructure,
Ghana,Ghana News Agency,Nana Konadu embodied UN ideals of equality and empowerment – Okudzeto Ablakwa,2025-10-27,By James Amoh Junior  GNA Accra  Oct. 24  GNA – Mr Samuel Okudzeto Ablakwa  Ghana’s Minister for Foreign Affairs  has paid glowing tribute to former First Lady  Nana Konadu Agyeman-Rawlings  describing her as a “vibrant and courageous stateswoman who embodied the United Nations’ values of equalit...,https://gna.org.gh/2025/10/nana-konadu-embodied-un-ideals-of-equality-and-empowerment-okudzeto-ablakwa/,infrastructure,
Ghana,Ghana News Agency,OSP  GIZ empower journalists in Illicit Financial Flows fight,2025-10-27,By Francis Ntow Accra  Oct 27  GNA – The Office of the Special Prosecutor (OSP) and the German Development Cooperation (GIZ) have held a three-day training for some Ghanaian journalists  exposing them to tools and techniques to help in the fight against illicit financial flows (IFFs) in the count...,https://gna.org.gh/2025/10/osp-giz-empower-journalists-in-illicit-financial-flows-fight/,rail,
Ghana,Ghana News Agency,GIPC begins regional investment Roadshows in the Volta and Oti Regions  ,2025-10-27,Accra  Oct. 27  GNA – The Ghana Investment Promotion Centre (GIPC) is set to drive economic transformation that empowers local communities through its upcoming Regional Investment Roadshows. Anchored in the Centre’s Investment Opportunity Mapping Project (IOMP)  the roadshows aim to spotlight inv...,https://gna.org.gh/2025/10/gipc-begins-regional-investment-roadshows-in-the-volta-and-oti-regions/,port,planned
Ghana,Ghana News Agency,Stanbic National Service Personnel Leave a Legacy of Care at 37 Military Hospital  ,2025-10-27,Accra  Oct. 27  GNA – The 2024/2025 cohort of National Service Personnel (NSP) at Stanbic Bank Ghana has extended much-needed support to the Dialysis Unit of the 37 Military Hospital  donating vital equipment and financial contribution to improve patient care. The donation included two electric d...,https://gna.org.gh/2025/10/stanbic-national-service-personnel-leave-a-legacy-of-care-at-37-military-hospital/,port,
Ghana,Ghana News Agency,Vice President leads gov’t delegation to console Nana Kunadu’s Family ,2025-10-27,By Hafsa Obeng/Munira Akweley Issah Accra  Oct. 27  GNA – The Vice President  Professor Naana Jane Opoku-Agyemang  on behalf of President Mahama and the Government  Monday led a high-powered delegation to commiserate with the family of the late former First Lady  Nana Konadu Agyeman-Rawlings. Sen...,https://gna.org.gh/2025/10/vice-president-leads-govt-delegation-to-console-nana-kunadus-family/,infrastructure,
Ghana,Ghana News Agency,Bawumia pledges to restructure nation’s budget statement  ,2025-10-26,By Robert Tachie Menson Dormaa-Ahenkro  (Bono)  Oct. 26  GNA – Alhaji Dr Mahamudu Bawumia  the former Vice President has pledged to restructure the nation’s budget statement when he becomes President. He said he was highly optimistic that the NPP would win the Election 2028 if the delegates give ...,https://gna.org.gh/2025/10/bawumia-pledges-to-restructure-nations-budget-statement/,infrastructure,
Ghana,Ghana News Agency,Empowering adolescent girls key to ending HIV epidemic- NACP  ,2025-10-26,By Muniratu Akweley Issah Accra  Oct. 26  GNA –Public Health experts have emphasised that empowering adolescent girls and young women with the right knowledge and tools to make informed health decisions was crucial to reducing new HIV infections and curbing Ghana’s epidemic. Dr. Emmanuel Teviu  P...,https://gna.org.gh/2025/10/empowering-adolescent-girls-key-to-ending-hiv-epidemic-nacp/,infrastructure,
Ghana,Ghana News Agency,Prudential Bank offers breast cancer screening for 200 women at Aboabo  ,2025-10-26,By Muyid Deen Suleman Kumasi  Oct. 26  GNA – In observance of World Breast Cancer Month  Prudential Bank Limited has organised a breast cancer screening exercise for 200 women at Aboabo in the Asokore Mampong Municipality. Eighteen medical professionals from Komfo Anokye Teaching Hospital (KATH) ...,https://gna.org.gh/2025/10/prudential-bank-offers-breast-cancer-screening-for-200-women-at-aboabo/,infrastructure,
Ghana,Ghana News Agency,Ewe Za 2025 rekindles pride  unity and cultural heritage in Volta,2025-10-26,By Frank Kwame Abbor Ho  Oct. 26  GNA – The maiden edition of Ewe Za 2025 cultural durbar held at the Jubilee Park in Ho has been hailed as a vibrant showcase of Ewe heritage  uniting citizens across borders through the power of art  language  and tradition. The event  adorned with a striking log...,https://gna.org.gh/2025/10/ewe-za-2025-rekindles-pride-unity-and-cultural-heritage-in-volta/,infrastructure,
Ghana,Ghana News Agency,StyleByFef donates to Osu Children’s Home,2025-10-26,By Daniel Adu Darko Accra  Oct. 26  GNA – StyleByFef  a fashion retail brand under the XFAR Group  has donated assorted items and cash worth over GH¢10 000 to the Osu Children’s Home as part of its corporate social responsibility (CSR) initiative to support underprivileged children. The donation ...,https://gna.org.gh/2025/10/stylebyfef-donates-to-osu-childrens-home/,port,
Ghana,Ghana News Agency,Mawuli School at 75: colour  culture  and commitment inspire grand celebration,2025-10-26,By Frank Kwame Abbor Ho  Oct. 26  GNA – Mawuli School in Ho has held its 75th Anniversary  a spectacle of colour  symbolism  and pride  with students  alumni  and dignitaries gathering under the theme  “Empowering the Head  Heart  and Hand into the Future.” The celebration beautifully fused art  ...,https://gna.org.gh/2025/10/mawuli-school-at-75-colour-culture-and-commitment-inspire-grand-celebration/,infrastructure,
Ghana,Ghana News Agency,Innovation  key to Ghana’s security robustness – Dep Interior Minister  ,2025-10-26,By Eric Appah Marfo Accra  Oct. 26  GNA – Mr Ebenezer Okletey Terlabi  the Deputy Minister of the Interior  has called for renewed commitment to innovation and collaboration to strengthen Ghana’s security and safety systems. Ghana must adapt to the changing security environment by embracing resea...,https://gna.org.gh/2025/10/innovation-key-to-ghanas-security-robustness-dep-interior-minister/,infrastructure,
Ghana,Ghana News Agency,Jackson University College: Redefining teacher education and transforming underserved communities  ,2025-10-26,By Yussif Ibrahim Kumasi  Oct. 26  GNA -Jackson University College (JUC) continues to distinguish itself as a beacon of innovation and excellence in Ghana’s teacher education landscape. At its 13th Congregation held in Kumasi  877 newly trained teachers were conferred with degrees and diplomas  r...,https://gna.org.gh/2025/10/jackson-university-college-redefining-teacher-education-and-transforming-underserved-communities/,rail,
Ghana,Ghana News Agency,UEW Cooperative Credit Union meets members on sustainability of the union   ,2025-10-26,By J. k Nabary Winneba  Oct. 26  GNA – Mrs Christina Kilson  the Chief Executive Officer (CEO) of the University of Education  Winneba (UEW) Co-operative Credit Union (UEWCCU)  has applauded members of the Union for their continuous loyalty and support in its operations. She made the commendation...,https://gna.org.gh/2025/10/uew-cooperative-credit-union-meets-members-on-sustainability-of-the-union/,port,
Ghana,Ghana News Agency,President announces increase in DACF allocation for Persons with Disabilities   ,2025-10-26,By Iddi Yire Accra  Oct 25  GNA – The Government will increase the District Assemblies’ Common Fund (DACF) allocation for Persons with Disabilities from three per cent to five per cent starting next year  President John Dramani Mahama has announced. The President announced this when he formally l...,https://gna.org.gh/2025/10/president-announces-increase-in-dacf-allocation-for-persons-with-disabilities/,infrastructure,planned
Ghana,Ghana News Agency,NDC urged to honour grassroots heroes behind Mahama’s victory  ,2025-10-26,By Frank Kwame Abbor Ho  Oct. 26  GNA – Mr Mac-Billions Bansah  Deputy Communications Officer of the Ho Central Constituency has called on the leadership of the National Democratic Congress (NDC) and the John Dramani Mahama-led government to recognise and reward the party’s grassroots members who...,https://gna.org.gh/2025/10/ndc-urged-to-honour-grassroots-heroes-behind-mahamas-victory/,infrastructure,
Ghana,Ghana News Agency,Africa Must Lead Its Digital Future—MOBEX Africa CEO,2025-10-26,Accra  Oct. 26  GNA – Mr. George Spencer Quaye  Chief Executive Officer of MOBEX Africa  has called on African nations to take ownership of their digital future by investing in innovation  infrastructure  and inclusive policy frameworks that empower local solutions. He made the call at the MOBEX ...,https://gna.org.gh/2025/10/africa-must-lead-its-digital-future-mobex-africa-ceo/,infrastructure,
Ghana,Ghana News Agency,Africa’s Digital Sovereignty Attainable— Chief of Staff,2025-10-26,Accra  Oct. 26  GNA –Mr Julius Debrah  the Chief of Staff  has stated that Africa’s digital identity and sovereignty are no longer unattainable ideals but achievable goals  provided the continent embraces a unified vision and strategic investment in technology and infrastructure. In a speech read...,https://gna.org.gh/2025/10/nsce-00science-digital-staffafricas-digital-sovereignty-attainable-chief-of-staff/,infrastructure,
Ghana,Ghana News Agency,KGL Group Chairman Alex Apau Dadey  wins Forbes Best of Africa Corporate Leadership and Innovation Award,2025-10-26,Accra. Oct 26  GNA- Alex Apau Dadey  the Executive Chairman of KGL Group  has been celebrated with the prestigious Forbes Best of Africa Corporate Leadership and Innovation Award at a Leadership and Philanthropy Forum held at the House of Lords in London. The award was formally presented by Mark ...,https://gna.org.gh/2025/10/kgl-group-chairman-alex-apau-dadey-wins-forbes-best-of-africa-corporate-leadership-and-innovation-award/,infrastructure,
Ghana,Ghana News Agency,Aglow International hails Nana Konadu as women’s leadership trailblazer  ,2025-10-26,Accra  Oct. 26  GNA – Aglow International on Sunday paid tribute to the late former First Lady  Nana Konadu Agyeman-Rawlings  celebrating her as a trailblazer  visionary  and tireless advocate of women’s empowerment. In a statement copied to Ghana News Agency  signed by Mrs Dorothy Danso  Nationa...,https://gna.org.gh/2025/10/aglow-international-hails-nana-konadu-as-womens-leadership-trailblazer/,rail,
Ghana,Ghana News Agency,IPMC  Executive Chairman Hari  celebrated at Ghana Business Awards 2025  ,2025-10-26,Accra  Oct 26  GNA- IPMC has been crowned Technology Group of the Year at the 2025 Ghana Business Awards in recognition of its pioneering role in driving digital transformation across Ghana and West Africa. The company’s Executive Chairman  Amar Deep Singh Hari  was also honoured with the prestig...,https://gna.org.gh/2025/10/ipmc-executive-chairman-hari-celebrated-at-ghana-business-awards-2025/,infrastructure,
Ghana,Ghana News Agency,Ghana calls for stronger regional energy integration under APRA ,2025-10-26,Accra  Oct. 26  GNA – Dr Senalor K. Yawlui  Ghana’s High Commissioner to Sierra Leone  has underscored the importance of regional integration and harmonised energy policies as the continent transitions towards clean and sustainable power. That  he said  could be achieved through the catalytic rol...,https://gna.org.gh/2025/10/ghana-calls-for-stronger-regional-energy-integration-under-apra/,port,
Ghana,Ghana News Agency,Ghana’s free tertiary education for persons with disabilities: targeting the tip of the pyramid  ,2025-10-26,A GNA feature by Hannah Awadzi Accra  Oct. 26  GNA –The launching of a policy by President John Dramani Mahama  which ensures that all fees for persons with disabilities at accredited public tertiary institutions are fully covered by the state  has been met with excitement and fun-fair within the...,https://gna.org.gh/2025/10/ghanas-free-tertiary-education-for-persons-with-disabilities-targeting-the-tip-of-the-pyramid/,infrastructure,
Ghana,Ghana News Agency,NHIS Challenges Stem from Software Providers  Not Funding — Mahama Ayariga ,2025-10-25,By Godwill Arthur-Mensah Accra  Oct.25  GNA- Majority Leader Mahama Ayariga has said the persistent challenges facing Ghana’s National Health Insurance Scheme (NHIS) are not due to a lack of funding. Rather  he said they stemmed from issues with software providers managing Scheme’s digital infras...,https://gna.org.gh/2025/10/nhis-challenges-stem-from-software-providers-not-funding-mahama-ayariga/,infrastructure,planned
Ghana,Ghana News Agency,Development Insights Hub inaugurates Ghana Evaluation Week ,2025-10-25,Accra  Oct 24  GNA-Development Insights Hub (DIH)  a sustainable and inclusive development non-profit organization  has inaugurated the Ghana Evaluation Week in Accra. The event was on the theme; “Ghana’s Evaluation Journey: Progress  Challenges and the Way Forward.” Mr Osama Makkawi Khogali  UNI...,https://gna.org.gh/2025/10/development-insights-hub-inaugurates-ghana-evaluation-week/,infrastructure,completed
Ghana,Ghana News Agency,Pentecost pastor inspires prisoners after donation by Youth Ministry ,2025-10-25,By Benjamin Akoto Sunyani  (Bono)  Oct. 25  GNA-Pastor Stephen Denkyi Asante  the Head Pastor of the Sunyani Central District of the Church of Pentecost (COP)  has inspired prisoners not to be disheartened by the incarceration. Instead  he urged them to be transformed and well-mannered by their p...,https://gna.org.gh/2025/10/pentecost-pastor-inspires-prisoners-after-donation-by-youth-ministry/,infrastructure,planned
Ghana,Ghana News Agency,Pentecost Youth Ministry presents food items to Sunyani Central Prisons   ,2025-10-25,By Benjamin Akoto Sunyani  (Bono)  Oct. 25  GNA – The Zion/Good News Youth Ministry of the Sunyani Central District of the Church of Pentecost has presented food items and other consumables worth over GH¢22 000 to Sunyani Central Prisons. The items comprising gallons of cooking oil  bags of sache...,https://gna.org.gh/2025/10/pentecost-youth-ministry-presents-food-items-to-sunyani-central-prisons/,infrastructure,
Ghana,Ghana News Agency,FirstBank Ghana Celebrates winners of 2025 Junior Internship Programme,2025-10-25,Accra  Oct. 25  GNA-FirstBank Ghana marked the successful conclusion of its 2025 Junior Internship Programme (JIP) with a vibrant closing ceremony and prize presentation for winners of the inaugural essay writing competition. The event brought together parents  partners  staff  and the 680 young ...,https://gna.org.gh/2025/10/firstbank-ghana-celebrates-winners-of-2025-junior-internship-programme/,infrastructure,
Ghana,Ghana News Agency,Rotary in Ghana  partners unveil End Polio Now billboard  ,2025-10-25,Accra  Oct 25  GNA-The Ghana District of Rotary International  District 9104  with some of its partners on Friday unveiled a giant “End Polio Now” billboard  in Accra  drawing attention to the world community to eradicate poliomyelitis from the surface of the earth. The unveiling of the billboard...,https://gna.org.gh/2025/10/rotary-in-ghana-partners-unveil-end-polio-now-billboard/,infrastructure,
Ghana,Ghana News Agency,Ketu North MCE commends farmers effort in promoting local rice production at Weta  ,2025-10-25,By Michael Foli Jackidy Weta (V/R)  Oct 25  GNA –The Reverend Martin Amenaki  Municipal Chief Executive (MCE) for Ketu North  has commended farmers under the Weta Irrigation Scheme for their dedication and innovation in rice production. The commendation came during the Weta Rice Fair  held under ...,https://gna.org.gh/2025/10/ketu-north-mce-commends-farmers-effort-in-promoting-local-rice-production-at-weta/,infrastructure,
Ghana,Ghana News Agency,Mawuli School Turns 75: Ho glows green and yellow in celebration              ,2025-10-25,By Frank Kwame Abbor Ho  Oct. 25  GNA – The “Oxygen” city of Ho  has been transformed into a sea of green and yellow as Mawuli School  one of Ghana’s premier second-cycle institutions  marks its 75th anniversary with a float of heavy convoy. The celebration is on the theme: “Empowering the Head  ...,https://gna.org.gh/2025/10/mawuli-school-turns-75-ho-glows-green-and-yellow-in-celebration/,infrastructure,
Ghana,Ghana News Agency,MTN builds staff capacity on Cybersecurity,2025-10-25,By Mildred Siabi-Mensah  GNA Takoradi  Oct 25  GNA – The Mobile Telephone Network   MTN Ghana  has schooled its staff on cybersecurity to strengthen their ability to combat digital fraud and cybercrime. Mr Prince Owusu-Nyarko  Regional Senior Manager for MTN Ghana’s South-West Business District  ...,https://gna.org.gh/2025/10/mtn-builds-staff-capacity-on-cybersecurity/,infrastructure,
Ghana,Ghana News Agency,OgeeTheMC outdoors HypecraftGH Association for hypemen ,2025-10-24,By Daniel Adu Darko Accra  Oct. 24  GNA — Ghana’s entertainment and events industry has entered a new chapter with the official launch of the HypecraftGH Association  an initiative founded by celebrated event host OgeeTheMC to unite and empower Masters of Ceremony (MCs) and hypemen. The launch to...,https://gna.org.gh/2025/10/ogeethemc-outdoors-hypecraftgh-association-for-hypemen/,infrastructure,
Ghana,Ghana News Agency,Ablakwa hails Nana Konadu Agyeman-Rawlings as a champion of equality and empowerment  ,2025-10-24,By James Amoh Junior Accra  Oct. 24  GNA – Mr Samuel Okudzeto Ablakwa  Ghana’s Minister for Foreign Affairs  has paid glowing tribute to former First Lady  Nana Konadu Agyeman-Rawlings  describing her as a “vibrant and courageous stateswoman who embodied the United Nations’ values of equality  in...,https://gna.org.gh/2025/10/ablakwa-hails-nana-konadu-agyeman-rawlings-as-a-champion-of-equality-and-empowerment/,infrastructure,
Ghana,Ghana News Agency,Former MDCEs in Upper East describe Bryan Acheampong’s fertilizer comment as misleading and unfair ,2025-10-24,By Anthony Adongo Apubeo Bolgatanga  Oct. 24  GNA – Former Municipal and District Chief Executives (MDCEs) who served under President Nana Addo Dankwa Akufo-Addo in the Upper East Region have described as misleading and unfair recent allegations by Dr Bryan Acheampong  a former Minister for Food ...,https://gna.org.gh/2025/10/former-mdces-in-upper-east-describe-bryan-acheampongs-fertilizer-comment-as-misleading-and-unfair/,infrastructure,
Ghana,Ghana News Agency,GNPC reaffirms operatorship role at second AGM,2025-10-24,Accra  Oct.24  GNA – The Ghana National Petroleum Corporation (GNPC) has reiterated its commitment to full operatorship  as it works to improve technical competence  institutional resilience  and financial sustainability. This assurance was given at the Corporation’s Second Annual General Meeting...,https://gna.org.gh/2025/10/gnpc-reaffirms-operatorship-role-at-second-agm/,infrastructure,
Ghana,Ghana News Agency,HIV fight needs innovation  equity  and self-reliance- Deputy Chief of Staff ,2025-10-24,By Eric Appah Marfo Accra  Oct. 24  GNA – Nana Oye Bampoe Addo  a Deputy Chief of Staff  has called for Ghana’s HIV response to be repositioned within a sustainable domestic financing framework to ensure long-term health sovereignty. She said such a shift was essential to achieving the country’s ...,https://gna.org.gh/2025/10/hiv-fight-needs-innovation-equity-and-self-reliance-deputy-chief-of-staff-2/,infrastructure,planned
Ghana,Ghana News Agency,Ghana must act swiftly to secure competitiveness of its local firms-GNCCI ,2025-10-24,By Morkporkpor Anku Accra  Oct. 24  GNA- The Ghana National Chamber of Commerce and Industry (GNCCI) says Ghana must act swiftly to secure the competitiveness of its local firms. Mr Stehane Miezan  the President of the GNCCI  said this must be done especially in an era marked by rising global tra...,https://gna.org.gh/2025/10/ghana-must-act-swiftly-to-secure-competitiveness-of-its-local-firms-gncci-2/,infrastructure,
Ghana,Ghana News Agency,Merit-based appointments needed for SOE leadership—Prof. Puni  ,2025-10-24,By Edward Acquah Accra  Oct. 24  GNA – Professor Albert Puni  a managemnt scholar  has called for merit-based processes to guide appointments to boards and CEO positions of state-owned enterprises (SOEs) to enhance efficiency. Delivering an inaugural lecture at the University of Professional Stud...,https://gna.org.gh/2025/10/merit-based-appointments-needed-for-soe-leadership-prof-puni/,infrastructure,
Ghana,Ghana News Agency,Government to double road infrastructure allocation in 2026 budget ,2025-10-24,By Francis Ntow Accra  Oct. 24  GNA – The government has announced plans to more than double road infrastructure allocation in the 2026 budget to sustain economic recovery and build long-term resilience. Mr Thomas Nyarko Ampem  Deputy Minister for Finance  said recent macroeconomic gains provided...,https://gna.org.gh/2025/10/government-to-double-road-infrastructure-allocation-in-2026-budget-2/,highway,planned
